lat,lon,label,placename,weeklyactive,totalactive,weeklyrecovered,totalrecovered,weeklydeaths,totaldeaths,weight,timestamp,reserved
3.8629098,100.935344,Daerah: Sabak Bernam<br>No:1<br>Hex coord:(9;0),Hutan Melintang. Hilir Perak. Malaysia,0,0,0,0,0,0,1,2021-10-27T08:14:33.3865826Z,0
3.8473498,100.827424,Daerah: Sabak Bernam<br>No:2<br>Hex coord:(1;1),Sungai Lang. Sobak Bernam. Sabak Bernam. Malaysia,0,0,0,0,0,0,1,2021-10-27T08:14:34.2943833Z,0
3.8473498,100.854404,Daerah: Sabak Bernam<br>No:3<br>Hex coord:(3;1),Sabak Bernam. 45100. Selangor. Malaysia,0,0,0,0,0,0,1,2021-10-27T08:14:35.0645316Z,0
3.8551298,100.867894,Daerah: Sabak Bernam<br>No:4<br>Hex coord:(4;1),Sabak Bernam. Selangor. Malaysia,0,0,0,0,0,0,1,2021-10-27T08:14:35.9864721Z,0
3.8473498,100.881384,Daerah: Sabak Bernam<br>No:5<br>Hex coord:(5;1),Sabak Bernam. Selangor. Malaysia,0,0,0,0,0,0,1,2021-10-27T08:14:36.7440971Z,0
3.8551298,100.894874,Daerah: Sabak Bernam<br>No:6<br>Hex coord:(6;1),Sabak Bernam. Selangor. Malaysia,2 ,0,0,0,0,0,1,2021-10-27T08:14:37.6404206Z,0
3.8473498,100.908364,Daerah: Sabak Bernam<br>No:7<br>Hex coord:(7;1),Sabak Bernam. 36400. Selangor. Malaysia,0,0,0,0,0,0,1,2021-10-27T08:14:38.4311472Z,0
3.8551298,100.921854,Daerah: Sabak Bernam<br>No:8<br>Hex coord:(8;1),Ladang Sabak Bernam Bahagian Satu. Sabak Bernam. Malaysia,0,0,0,0,0,0,1,2021-10-27T08:14:39.1901479Z,0
3.8473498,100.935344,Daerah: Sabak Bernam<br>No:9<br>Hex coord:(9;1),Sabak Bernam. 36400. Selangor. Malaysia,0,0,0,0,0,0,1,2021-10-27T08:14:40.2796071Z,0
3.8395698,100.813934,Daerah: Sabak Bernam<br>No:10<br>Hex coord:(0;2),Sungai Telok Belanga Kechil. Sobak Bernam. Sabak Bernam. Malaysia,0,0,0,0,0,0,1,2021-10-27T08:14:41.0495091Z,0
3.8317898,100.827424,Daerah: Sabak Bernam<br>No:11<br>Hex coord:(1;2),Sabak Bernam. 45100. Selangor. Malaysia,0,0,0,0,0,0,1,2021-10-27T08:14:41.7988967Z,0
3.8395698,100.840914,Daerah: Sabak Bernam<br>No:12<br>Hex coord:(2;2),Sabak Bernam. 45100. Selangor. Malaysia,0,0,0,0,0,0,1,2021-10-27T08:14:42.5633449Z,0
3.8317898,100.854404,Daerah: Sabak Bernam<br>No:13<br>Hex coord:(3;2),Sabak Bernam. 45100. Selangor. Malaysia,3 ,0,0,0,0,0,1,2021-10-27T08:14:43.3080415Z,0
3.8395698,100.867894,Daerah: Sabak Bernam<br>No:14<br>Hex coord:(4;2),Sabak Bernam. 45100. Selangor. Malaysia,0,0,0,0,0,0,1,2021-10-27T08:14:44.2556699Z,0
3.8317898,100.881384,Daerah: Sabak Bernam<br>No:15<br>Hex coord:(5;2),Sabak Bernam. Selangor. Malaysia,0,0,0,0,0,0,1,2021-10-27T08:14:45.0472047Z,0
3.8395698,100.894874,Daerah: Sabak Bernam<br>No:16<br>Hex coord:(6;2),Sabak Bernam. Selangor. Malaysia,2 ,0,0,0,0,0,1,2021-10-27T08:14:47.0915619Z,0
3.8317898,100.908364,Daerah: Sabak Bernam<br>No:17<br>Hex coord:(7;2),Jalan Haji Abdul Karim. Sobak Bernam. Selangor. Malaysia,0,0,0,0,0,0,1,2021-10-27T08:14:47.8570234Z,0
3.8395698,100.921854,Daerah: Sabak Bernam<br>No:18<br>Hex coord:(8;2),Ladang Sungai Bernam Bahagian Dua. Sabak Bernam. Malaysia,0,0,0,0,0,0,1,2021-10-27T08:14:48.6177041Z,0
3.8317898,100.935344,Daerah: Sabak Bernam<br>No:19<br>Hex coord:(9;2),Sabak Bernam. 36400. Selangor. Malaysia,0,0,0,0,0,0,1,2021-10-27T08:14:49.3695478Z,0
3.8240098,100.813934,Daerah: Sabak Bernam<br>No:20<br>Hex coord:(0;3),Balai Cerap Selangor. 45100 Sobak Bernam. Selangor. Malaysia,0,0,0,0,0,0,1,2021-10-27T08:14:50.2159380Z,0
3.8162298,100.827424,Daerah: Sabak Bernam<br>No:21<br>Hex coord:(1;3),Institut Latihan Dakwah Selangor. 45100 Sobak Bernam. Selangor. Malaysia,0,0,0,0,0,0,1,2021-10-27T08:14:50.9754081Z,0
3.8240098,100.840914,Daerah: Sabak Bernam<br>No:22<br>Hex coord:(2;3),Bagan Beting Kepah. 45100. Selangor. Malaysia,5 ,0,0,0,0,0,1,2021-10-27T08:14:52.0859558Z,0
3.8162298,100.854404,Daerah: Sabak Bernam<br>No:23<br>Hex coord:(3;3),Sungai Tangar. Sobak Bernam. Sabak Bernam. Malaysia,0,0,0,0,0,0,1,2021-10-27T08:14:52.8403922Z,0
3.8240098,100.867894,Daerah: Sabak Bernam<br>No:24<br>Hex coord:(4;3),Rizab Melayu Sungai Lang. Sobak Bernam. Sabak Bernam. Malaysia,1 ,0,0,0,0,0,1,2021-10-27T08:14:53.5995027Z,0
3.8162298,100.881384,Daerah: Sabak Bernam<br>No:25<br>Hex coord:(5;3),Sabak Bernam. Selangor. Malaysia,0,0,0,0,0,0,1,2021-10-27T08:14:54.3716058Z,0
3.8240098,100.894874,Daerah: Sabak Bernam<br>No:26<br>Hex coord:(6;3),Bagan Telok Ru. 45100. Selangor. Malaysia,0,0,0,0,0,0,1,2021-10-27T08:14:55.2883330Z,0
3.8162298,100.908364,Daerah: Sabak Bernam<br>No:27<br>Hex coord:(7;3),Jalan Haji Yusof. Sobak Bernam. Selangor. Malaysia,0,0,0,0,0,0,1,2021-10-27T08:14:56.0567498Z,0
3.8240098,100.921854,Daerah: Sabak Bernam<br>No:28<br>Hex coord:(8;3),Jalan Haji Mahfud. Selangor. Malaysia,0,0,0,0,0,0,1,2021-10-27T08:14:56.8322205Z,0
3.8162298,100.935344,Daerah: Sabak Bernam<br>No:29<br>Hex coord:(9;3),Ladang Sabak Berna Bahagian Tiga. Sabak Bernam. Malaysia,0,0,0,0,0,0,1,2021-10-27T08:14:57.5981448Z,0
3.8240098,100.948834,Daerah: Sabak Bernam<br>No:30<br>Hex coord:(10;3),Ladang Sabak Berna Bahagian Tiga. Sabak Bernam. Malaysia,0,0,0,0,0,0,1,2021-10-27T08:14:58.3735468Z,0
3.8162298,100.962324,Daerah: Sabak Bernam<br>No:31<br>Hex coord:(11;3),Sabak Bernam. 45200. Selangor. Malaysia,0,0,0,0,0,0,1,2021-10-27T08:14:59.4883031Z,0
3.8084498,100.813934,Daerah: Sabak Bernam<br>No:32<br>Hex coord:(0;4),SBP Integrasi Sabak Bernam. 45100 Sobak Bernam. Selangor. Malaysia,4 ,0,0,0,0,0,1,2021-10-27T08:15:00.2533406Z,0
3.8006698,100.827424,Daerah: Sabak Bernam<br>No:33<br>Hex coord:(1;4),Bagan Beting Kepah. 45100. Selangor. Malaysia,0,0,0,0,0,0,1,2021-10-27T08:15:01.0135377Z,0
3.8084498,100.840914,Daerah: Sabak Bernam<br>No:34<br>Hex coord:(2;4),Bagan Telok Ru. 45100. Selangor. Malaysia,0,0,0,0,0,0,1,2021-10-27T08:15:01.7784419Z,0
3.8006698,100.854404,Daerah: Sabak Bernam<br>No:35<br>Hex coord:(3;4),Kemajuan Tanah Parit Baharu. Sobak Bernam. Sabak Bernam. Malaysia,0,0,0,0,0,0,1,2021-10-27T08:15:02.5338526Z,0
3.8084498,100.867894,Daerah: Sabak Bernam<br>No:36<br>Hex coord:(4;4),Bagan Telok Ru. Selangor. Malaysia,0,0,0,0,0,0,1,2021-10-27T08:15:03.2964131Z,0
3.8006698,100.881384,Daerah: Sabak Bernam<br>No:37<br>Hex coord:(5;4),Bagan Telok Ru. Selangor. Malaysia,0,0,0,0,0,0,1,2021-10-27T08:15:05.0705779Z,0
3.8084498,100.894874,Daerah: Sabak Bernam<br>No:38<br>Hex coord:(6;4),Sabak Bernam. Selangor. Malaysia,3 ,0,0,0,0,0,1,2021-10-27T08:15:05.8498433Z,0
3.8006698,100.908364,Daerah: Sabak Bernam<br>No:39<br>Hex coord:(7;4),Sabak Bernam. Selangor. Malaysia,0,0,0,0,0,0,1,2021-10-27T08:15:06.6267499Z,0
3.8084498,100.921854,Daerah: Sabak Bernam<br>No:40<br>Hex coord:(8;4),Sabak Bernam. 45200. Selangor. Malaysia,0,0,0,0,0,0,1,2021-10-27T08:15:07.3881133Z,0
3.8006698,100.935344,Daerah: Sabak Bernam<br>No:41<br>Hex coord:(9;4),Ladang Sungai Bernam Bahagian Empat. Sabak Bernam. Malaysia,0,0,0,0,0,0,1,2021-10-27T08:15:08.1624609Z,0
3.8084498,100.948834,Daerah: Sabak Bernam<br>No:42<br>Hex coord:(10;4),Sabak Bernam. 36400. Selangor. Malaysia,0,0,0,0,0,0,1,2021-10-27T08:15:09.2836980Z,0
3.8006698,100.962324,Daerah: Sabak Bernam<br>No:43<br>Hex coord:(11;4),Sungai Keli Besar. Hilir Perak. Malaysia,0,0,0,0,0,0,1,2021-10-27T08:15:10.2012716Z,0
3.8084498,100.975814,Daerah: Sabak Bernam<br>No:44<br>Hex coord:(12;4),Tanjung Jawa. Sabak Bernam. Malaysia,0,0,0,0,0,0,1,2021-10-27T08:15:10.9661975Z,0
3.8006698,101.016284,Daerah: Sabak Bernam<br>No:45<br>Hex coord:(15;4),Teluk Sepintas. Selangor. Malaysia,2 ,0,0,0,0,0,1,2021-10-27T08:15:11.7359451Z,0
3.7928898,100.813934,Daerah: Sabak Bernam<br>No:46<br>Hex coord:(0;5),Sungai Apong. Sobak Bernam. Sabak Bernam. Malaysia,0,0,0,0,0,0,1,2021-10-27T08:15:12.5021111Z,0
3.7851098,100.827424,Daerah: Sabak Bernam<br>No:47<br>Hex coord:(1;5),Bagan Beting Kepah. 45100. Selangor. Malaysia,0,0,0,0,0,0,1,2021-10-27T08:15:13.3170779Z,0
3.7928898,100.840914,Daerah: Sabak Bernam<br>No:48<br>Hex coord:(2;5),Bagan Telok Ru. 45100. Selangor. Malaysia,0,0,0,0,0,0,1,2021-10-27T08:15:14.1630541Z,0
3.7851098,100.854404,Daerah: Sabak Bernam<br>No:49<br>Hex coord:(3;5),Bagan Telok Ru. 45100. Selangor. Malaysia,1 ,0,0,0,0,0,1,2021-10-27T08:15:14.9518852Z,0
3.7928898,100.867894,Daerah: Sabak Bernam<br>No:50<br>Hex coord:(4;5),Bagan Telok Ru. Selangor. Malaysia,0,0,0,0,0,0,1,2021-10-27T08:15:16.7201489Z,0
3.7851098,100.881384,Daerah: Sabak Bernam<br>No:51<br>Hex coord:(5;5),Bagan Telok Ru. Selangor. Malaysia,0,0,0,0,0,0,1,2021-10-27T08:15:17.4955799Z,0
3.7928898,100.894874,Daerah: Sabak Bernam<br>No:52<br>Hex coord:(6;5),Sabak Bernam. Selangor. Malaysia,3 ,0,0,0,0,0,1,2021-10-27T08:15:18.2700813Z,0
3.7851098,100.908364,Daerah: Sabak Bernam<br>No:53<br>Hex coord:(7;5),Masjid Al-Islakhiah. 45200. Selangor. Malaysia,0,0,0,0,0,0,1,2021-10-27T08:15:19.0542345Z,0
3.7928898,100.921854,Daerah: Sabak Bernam<br>No:54<br>Hex coord:(8;5),Sabak Bernam. 45200. Selangor. Malaysia,0,0,0,0,0,0,1,2021-10-27T08:15:19.9645761Z,0
3.7851098,100.935344,Daerah: Sabak Bernam<br>No:55<br>Hex coord:(9;5),Sabak Bernam. 45200. Selangor. Malaysia,0,0,0,0,0,0,1,2021-10-27T08:15:20.7760025Z,0
3.7928898,100.948834,Daerah: Sabak Bernam<br>No:56<br>Hex coord:(10;5),SK Kampung Baharu. Jalan Pekan Kampung Baru. Sabak Bernam. 45200. Selangor. Malaysia,0,0,0,0,0,0,1,2021-10-27T08:15:21.5468925Z,0
3.7851098,100.989304,Daerah: Sabak Bernam<br>No:57<br>Hex coord:(13;5),Teluk Sepintas. 45200. Selangor. Malaysia,0,0,0,0,0,0,1,2021-10-27T08:15:22.3177047Z,0
3.7928898,101.002794,Daerah: Sabak Bernam<br>No:58<br>Hex coord:(14;5),Teluk Sepintas. Selangor. Malaysia,0,0,0,0,0,0,1,2021-10-27T08:15:23.2304140Z,0
3.7851098,101.016284,Daerah: Sabak Bernam<br>No:59<br>Hex coord:(15;5),Teluk Sepintas. Selangor. Malaysia,0,0,0,0,0,0,1,2021-10-27T08:15:23.9919081Z,0
3.7928898,101.029774,Daerah: Sabak Bernam<br>No:60<br>Hex coord:(16;5),Teluk Sepintas. Selangor. Malaysia,0,0,0,0,0,0,1,2021-10-27T08:15:25.1285510Z,0
3.7851098,101.043264,Daerah: Sabak Bernam<br>No:61<br>Hex coord:(17;5),Teluk Sepintas. Selangor. Malaysia,0,0,0,0,0,0,1,2021-10-27T08:15:26.6417407Z,0
3.7928898,101.056754,Daerah: Sabak Bernam<br>No:62<br>Hex coord:(18;5),Tanjung Ketom. Hilir Perak. Malaysia,0,0,0,0,0,0,1,2021-10-27T08:15:27.4020241Z,0
3.7773298,100.840914,Daerah: Sabak Bernam<br>No:63<br>Hex coord:(2;6),Kuala Bernam Forest Reserve. Jalan Sungai Ayer Tawar. Bagan Beting Kepah. 45100. Selangor. Malaysia,0,0,0,0,0,0,1,2021-10-27T08:15:28.1824405Z,0
3.7773298,100.867894,Daerah: Sabak Bernam<br>No:64<br>Hex coord:(4;6),Bagan Telok Ru. Selangor. Malaysia,1 ,0,0,0,0,0,1,2021-10-27T08:15:28.9545805Z,0
3.7695498,100.881384,Daerah: Sabak Bernam<br>No:65<br>Hex coord:(5;6),Sabak Bernam. Selangor. Malaysia,0,0,0,0,0,0,1,2021-10-27T08:15:29.7243087Z,0
3.7773298,100.894874,Daerah: Sabak Bernam<br>No:66<br>Hex coord:(6;6),Sabak Bernam. Selangor. Malaysia,0,0,0,0,0,0,1,2021-10-27T08:15:30.5132115Z,0
3.7695498,100.908364,Daerah: Sabak Bernam<br>No:67<br>Hex coord:(7;6),Jalan Tebuk Jawa. Bagan Sungai Pulai. 45200 Sobak Bernam. Selangor. Malaysia,1 ,0,0,0,0,0,1,2021-10-27T08:15:32.2947727Z,0
3.7773298,100.921854,Daerah: Sabak Bernam<br>No:68<br>Hex coord:(8;6),Rizab Melayu Raja Hitam. Sabak Bernam. Malaysia,0,0,0,0,0,0,1,2021-10-27T08:15:33.0915281Z,0
3.7695498,100.935344,Daerah: Sabak Bernam<br>No:69<br>Hex coord:(9;6),Bagan Sungai Pulai. 45200. Selangor. Malaysia,0,0,0,0,0,0,1,2021-10-27T08:15:33.8624489Z,0
3.7773298,100.948834,Daerah: Sabak Bernam<br>No:70<br>Hex coord:(10;6),Sabak Bernam. 45200. Selangor. Malaysia,0,0,0,0,0,0,1,2021-10-27T08:15:34.7885523Z,0
3.7695498,100.962324,Daerah: Sabak Bernam<br>No:71<br>Hex coord:(11;6),Jalan Kampung Baru. Sabak Bernam. 45200. Selangor. Malaysia,0,0,0,0,0,0,1,2021-10-27T08:15:35.5603417Z,0
3.7695498,100.989304,Daerah: Sabak Bernam<br>No:72<br>Hex coord:(13;6),Teluk Sepintas. 45200. Selangor. Malaysia,0,0,0,0,0,0,1,2021-10-27T08:15:36.3647110Z,0
3.7773298,101.002794,Daerah: Sabak Bernam<br>No:73<br>Hex coord:(14;6),Rizab Melayu Sabak. Sobak Bernam. Sabak Bernam. Malaysia,0,0,0,0,0,0,1,2021-10-27T08:15:37.1307598Z,0
3.7695498,101.016284,Daerah: Sabak Bernam<br>No:74<br>Hex coord:(15;6),Teluk Sepintas. Selangor. Malaysia,0,0,0,0,0,0,1,2021-10-27T08:15:37.9756011Z,0
3.7773298,101.029774,Daerah: Sabak Bernam<br>No:75<br>Hex coord:(16;6),Sungai Sepintas. Sabak Bernam. Malaysia,0,0,0,0,0,0,1,2021-10-27T08:15:39.0743816Z,0
3.7695498,101.043264,Daerah: Sabak Bernam<br>No:76<br>Hex coord:(17;6),Teluk Sepintas. Selangor. Malaysia,0,0,0,0,0,0,1,2021-10-27T08:15:39.8390887Z,0
3.7773298,101.083734,Daerah: Sabak Bernam<br>No:77<br>Hex coord:(20;6),Sungai Samak Kechil. Hilir Perak. Malaysia,0,0,0,0,0,0,1,2021-10-27T08:15:40.6027852Z,0
3.7617698,100.894874,Daerah: Sabak Bernam<br>No:78<br>Hex coord:(6;7),Rizab Melayu Sungai Lang. Sobak Bernam. Sabak Bernam. Malaysia,1 ,0,0,0,0,0,1,2021-10-27T08:15:41.3773162Z,0
3.7539898,100.908364,Daerah: Sabak Bernam<br>No:79<br>Hex coord:(7;7),Jalan Ghazali. Sobak Bernam. Selangor. Malaysia,1 ,0,0,0,0,0,1,2021-10-27T08:15:42.1303733Z,0
3.7617698,100.921854,Daerah: Sabak Bernam<br>No:80<br>Hex coord:(8;7),Jalan Kubur. Sobak Bernam. Selangor. Malaysia,0,0,0,0,0,0,1,2021-10-27T08:15:42.9108040Z,0
3.7539898,100.935344,Daerah: Sabak Bernam<br>No:81<br>Hex coord:(9;7),Jalan Haji Sadri. Sobak Bernam. Selangor. Malaysia,0,0,0,0,0,0,1,2021-10-27T08:15:43.6757385Z,0
3.7617698,100.948834,Daerah: Sabak Bernam<br>No:82<br>Hex coord:(10;7),Jalan Haji Saion. Bagan Sungai Pulai. 45200. Selangor. Malaysia,0,0,0,0,0,0,1,2021-10-27T08:15:44.6110911Z,0
3.7539898,100.962324,Daerah: Sabak Bernam<br>No:83<br>Hex coord:(11;7),Jalan Wan Mood. Sobak Bernam. Selangor. Malaysia,3 ,0,0,0,0,0,1,2021-10-27T08:15:45.5034938Z,0
3.7617698,100.975814,Daerah: Sabak Bernam<br>No:84<br>Hex coord:(12;7),SAM Muhammadiah Pekan Sabak. Jalan Kuala Selangor-Teluk Intan. Sabak Bernam. 45200 Sobak Bernam. Selangor. Malaysia,3 ,0,0,0,0,0,1,2021-10-27T08:15:46.2653603Z,0
3.7539898,100.989304,Daerah: Sabak Bernam<br>No:85<br>Hex coord:(13;7),K&K HARDWARE AND PHONE. Sobak Bernam. Sabak Bernam. Malaysia,4 ,0,0,0,0,0,1,2021-10-27T08:15:47.0263139Z,0
3.7617698,101.002794,Daerah: Sabak Bernam<br>No:86<br>Hex coord:(14;7),Teluk Sepintas. 45200. Selangor. Malaysia,0,0,0,0,0,0,1,2021-10-27T08:15:48.8613027Z,0
3.7539898,101.016284,Daerah: Sabak Bernam<br>No:87<br>Hex coord:(15;7),Parit Alur Raja Hitam Lama. Sobak Bernam. Sabak Bernam. Malaysia,0,0,0,0,0,0,1,2021-10-27T08:15:50.6833479Z,0
3.7617698,101.029774,Daerah: Sabak Bernam<br>No:88<br>Hex coord:(16;7),Teluk Sepintas. Selangor. Malaysia,0,0,0,0,0,0,1,2021-10-27T08:15:51.4587443Z,0
3.7539898,101.043264,Daerah: Sabak Bernam<br>No:89<br>Hex coord:(17;7),Ladang Sungai Bernam. Sobak Bernam. Sabak Bernam. Malaysia,2 ,0,0,0,0,0,1,2021-10-27T08:15:52.2272640Z,0
3.7617698,101.056754,Daerah: Sabak Bernam<br>No:90<br>Hex coord:(18;7),Ladang Antara. Sobak Bernam. Sabak Bernam. Malaysia,0,0,0,0,0,0,1,2021-10-27T08:15:53.4962150Z,0
3.7539898,101.070244,Daerah: Sabak Bernam<br>No:91<br>Hex coord:(19;7),Teluk Sepintas. Selangor. Malaysia,0,0,0,0,0,0,1,2021-10-27T08:15:54.2683334Z,0
3.7617698,101.083734,Daerah: Sabak Bernam<br>No:92<br>Hex coord:(20;7),Kampung Binjai Patah. Selangor. Malaysia,0,0,0,0,0,0,1,2021-10-27T08:15:55.1953421Z,0
3.7539898,101.097224,Daerah: Sabak Bernam<br>No:93<br>Hex coord:(21;7),Kampung Binjai Patah. Selangor. Malaysia,0,0,0,0,0,0,1,2021-10-27T08:15:55.9818277Z,0
3.7384298,100.908364,Daerah: Sabak Bernam<br>No:94<br>Hex coord:(7;8),Bagan Sungai Pulai. 45200. Selangor. Malaysia,0,0,0,0,0,0,1,2021-10-27T08:15:56.7476673Z,0
3.7462098,100.921854,Daerah: Sabak Bernam<br>No:95<br>Hex coord:(8;8),Parit Banting. Sabak Bernam. Malaysia,0,0,0,0,0,0,1,2021-10-27T08:15:57.5104576Z,0
3.7384298,100.935344,Daerah: Sabak Bernam<br>No:96<br>Hex coord:(9;8),Bagan Sungai Pulai. 45200. Selangor. Malaysia,1 ,0,0,0,0,0,1,2021-10-27T08:15:58.2718346Z,0
3.7462098,100.948834,Daerah: Sabak Bernam<br>No:97<br>Hex coord:(10;8),Jalan Haji Siraj. Bagan Sungai Pulai. 45200. Selangor. Malaysia,1 ,0,0,0,0,0,1,2021-10-27T08:15:59.0392533Z,0
3.7384298,100.962324,Daerah: Sabak Bernam<br>No:98<br>Hex coord:(11;8),Jalan Haji Mansur. Panchang Bedena. 45200 Sobak Bernam. Selangor. Malaysia,0,0,0,0,0,0,1,2021-10-27T08:15:59.9650472Z,0
3.7462098,100.975814,Daerah: Sabak Bernam<br>No:99<br>Hex coord:(12;8),Surau Ar-Rahmaniah. Jalan Kuala Selangor-Teluk Intan. Parit Enam. 45200 Sobak Bernam. Selangor. Malaysia,3 ,0,0,0,0,0,1,2021-10-27T08:16:00.7335264Z,0
3.7384298,100.989304,Daerah: Sabak Bernam<br>No:100<br>Hex coord:(13;8),Sabak Bernam. 45200 Sabak Bernam. Selangor. Malaysia,0,0,0,0,0,0,1,2021-10-27T08:16:01.6125046Z,0
3.7462098,101.002794,Daerah: Sabak Bernam<br>No:101<br>Hex coord:(14;8),Ladang Torkington. Sobak Bernam. Sabak Bernam. Malaysia,0,0,0,0,0,0,1,2021-10-27T08:16:03.9339191Z,0
3.7384298,101.016284,Daerah: Sabak Bernam<br>No:102<br>Hex coord:(15;8),Parit Enam. Selangor. Malaysia,0,0,0,0,0,0,1,2021-10-27T08:16:05.7643813Z,0
3.7462098,101.029774,Daerah: Sabak Bernam<br>No:103<br>Hex coord:(16;8),Teluk Sepintas. Selangor. Malaysia,0,0,0,0,0,0,1,2021-10-27T08:16:07.4418398Z,0
3.7384298,101.043264,Daerah: Sabak Bernam<br>No:104<br>Hex coord:(17;8),Parit Sebelas Barat. Sobak Bernam. Sabak Bernam. Malaysia,3 ,0,0,0,0,0,1,2021-10-27T08:16:09.1374233Z,0
3.7462098,101.056754,Daerah: Sabak Bernam<br>No:105<br>Hex coord:(18;8),Teluk Sepintas. Selangor. Malaysia,4 ,0,0,0,0,0,1,2021-10-27T08:16:10.2441804Z,0
3.7384298,101.070244,Daerah: Sabak Bernam<br>No:106<br>Hex coord:(19;8),Jalan Tok Khalifah. Kampung Permatang. Selangor. Malaysia,0,0,0,0,0,0,1,2021-10-27T08:16:11.9433910Z,0
3.7384298,101.097224,Daerah: Sabak Bernam<br>No:107<br>Hex coord:(21;8),Sungai Panjang. Sobak Bernam. Sabak Bernam. Malaysia,0,0,0,0,0,0,1,2021-10-27T08:16:13.0648419Z,0
3.7462098,101.110714,Daerah: Sabak Bernam<br>No:108<br>Hex coord:(22;8),Sungai Bugis. Hilir Perak. Malaysia,0,0,0,0,0,0,1,2021-10-27T08:16:14.1726593Z,0
3.7384298,101.124204,Daerah: Sabak Bernam<br>No:109<br>Hex coord:(23;8),Kampung Binjai Patah. Selangor. Malaysia,0,0,0,0,0,0,1,2021-10-27T08:16:15.2795420Z,0
3.7462098,101.137694,Daerah: Sabak Bernam<br>No:110<br>Hex coord:(24;8),Sungai Samak. Sabak Bernam. Malaysia,0,0,0,0,0,0,1,2021-10-27T08:16:16.3960184Z,0
3.7462098,101.164674,Daerah: Sabak Bernam<br>No:111<br>Hex coord:(26;8),Hospital Ulu Sungai Bernam. Hilir Perak. Malaysia,0,0,0,0,0,0,1,2021-10-27T08:16:17.5134538Z,0
3.7306498,100.921854,Daerah: Sabak Bernam<br>No:112<br>Hex coord:(8;9),SJK(C) Phooi Tee. Bagan Sungai Pulai. Jalan Haji Muhammad. Panchang Bedena. 45200. Selangor. Malaysia,0,0,0,0,0,0,1,2021-10-27T08:16:19.2044337Z,0
3.7228698,100.935344,Daerah: Sabak Bernam<br>No:113<br>Hex coord:(9;9),Parit Pulai. Sobak Bernam. Sabak Bernam. Malaysia,0,0,0,0,0,0,1,2021-10-27T08:16:20.9931712Z,0
3.7306498,100.948834,Daerah: Sabak Bernam<br>No:114<br>Hex coord:(10;9),Bagan Sungai Pulai. 45200. Selangor. Malaysia,1 ,0,0,0,0,0,1,2021-10-27T08:16:23.6952371Z,0
3.7228698,100.962324,Daerah: Sabak Bernam<br>No:115<br>Hex coord:(11;9),Jalan Jentera. Panchang Bedena. 45200. Selangor. Malaysia,2 ,0,0,0,0,0,1,2021-10-27T08:16:25.3847180Z,0
3.7306498,100.975814,Daerah: Sabak Bernam<br>No:116<br>Hex coord:(12;9),Jalan Kuala Selangor-Teluk Intan. Panchang Bedena. 45200. Selangor. Malaysia,1 ,0,0,0,0,0,1,2021-10-27T08:16:26.4929324Z,0
3.7228698,100.989304,Daerah: Sabak Bernam<br>No:117<br>Hex coord:(13;9),Parit Enam. 45200. Selangor. Malaysia,0,0,0,0,0,0,1,2021-10-27T08:16:28.2026368Z,0
3.7306498,101.002794,Daerah: Sabak Bernam<br>No:118<br>Hex coord:(14;9),Ladang Lim Kooi Hua Sungai Bernam. Sabak Bernam. Malaysia,0,0,0,0,0,0,1,2021-10-27T08:16:29.8981902Z,0
3.7228698,101.016284,Daerah: Sabak Bernam<br>No:119<br>Hex coord:(15;9),Parit Enam. Selangor. Malaysia,0,0,0,0,0,0,1,2021-10-27T08:16:31.6021070Z,0
3.7306498,101.029774,Daerah: Sabak Bernam<br>No:120<br>Hex coord:(16;9),B51. Selangor. Malaysia,0,0,0,0,0,0,1,2021-10-27T08:16:33.2918014Z,0
3.7228698,101.043264,Daerah: Sabak Bernam<br>No:121<br>Hex coord:(17;9),Kampung Permatang. Selangor. Malaysia,3 ,0,0,0,0,0,1,2021-10-27T08:16:34.9967914Z,0
3.7306498,101.056754,Daerah: Sabak Bernam<br>No:122<br>Hex coord:(18;9),Kampung Permatang. Selangor. Malaysia,5 ,0,0,0,0,0,1,2021-10-27T08:16:37.7090693Z,0
3.7228698,101.070244,Daerah: Sabak Bernam<br>No:123<br>Hex coord:(19;9),Kampung Permatang. Selangor. Malaysia,3 ,0,0,0,0,0,1,2021-10-27T08:16:40.4111123Z,0
3.7306498,101.083734,Daerah: Sabak Bernam<br>No:124<br>Hex coord:(20;9),B44. Sungai Besar. Selangor. Malaysia,3 ,0,0,0,0,0,1,2021-10-27T08:16:41.5273712Z,0
3.7228698,101.097224,Daerah: Sabak Bernam<br>No:125<br>Hex coord:(21;9),Kampung Binjai Patah. Selangor. Malaysia,1 ,0,0,0,0,0,1,2021-10-27T08:16:42.6415984Z,0
3.7306498,101.110714,Daerah: Sabak Bernam<br>No:126<br>Hex coord:(22;9),Kampung Binjai Patah. Selangor. Malaysia,0,0,0,0,0,0,1,2021-10-27T08:16:43.7520848Z,0
3.7228698,101.124204,Daerah: Sabak Bernam<br>No:127<br>Hex coord:(23;9),Kampung Binjai Patah. Selangor. Malaysia,4 ,0,0,0,0,0,1,2021-10-27T08:16:45.4440988Z,0
3.7306498,101.137694,Daerah: Sabak Bernam<br>No:128<br>Hex coord:(24;9),Sungai Telok. Hulu Bemam. Sabak Bernam. Malaysia,0,0,0,0,0,0,1,2021-10-27T08:16:47.5613572Z,0
3.7228698,101.151184,Daerah: Sabak Bernam<br>No:129<br>Hex coord:(25;9),Kemajuan Tanah Belia Merbau Berdarah. Sabak Bernam. Malaysia,0,0,0,0,0,0,1,2021-10-27T08:16:49.2626509Z,0
3.7306498,101.164674,Daerah: Sabak Bernam<br>No:130<br>Hex coord:(26;9),Rantau Panjang. Hilir Perak. Malaysia,0,0,0,0,0,0,1,2021-10-27T08:16:50.3709519Z,0
3.7228698,101.178164,Daerah: Sabak Bernam<br>No:131<br>Hex coord:(27;9),Ulu Bernam Bahagian Selangor. Sabak Bernam. Malaysia,0,0,0,0,0,0,1,2021-10-27T08:16:52.2058867Z,0
3.7150898,100.921854,Daerah: Sabak Bernam<br>No:132<br>Hex coord:(8;10),Bagan Sungai Pulai. Selangor. Malaysia,0,0,0,0,0,0,1,2021-10-27T08:16:53.9753251Z,0
3.7073098,100.935344,Daerah: Sabak Bernam<br>No:133<br>Hex coord:(9;10),Sabak Bernam. Bagan Sungai Burung. Selangor. Malaysia,0,0,0,0,0,0,1,2021-10-27T08:16:55.0977508Z,0
3.7150898,100.948834,Daerah: Sabak Bernam<br>No:134<br>Hex coord:(10;10),Panchang Bedena. 45300. Selangor. Malaysia,0,0,0,0,0,0,1,2021-10-27T08:16:56.8146810Z,0
3.7073098,100.962324,Daerah: Sabak Bernam<br>No:135<br>Hex coord:(11;10),Jalan Surau Suluk. Sungai Besar. Selangor. Malaysia,2 ,0,0,0,0,0,1,2021-10-27T08:16:58.5363812Z,0
3.7150898,100.975814,Daerah: Sabak Bernam<br>No:136<br>Hex coord:(12;10),Ladang Lingam. Sobak Bernam. Sabak Bernam. Malaysia,0,0,0,0,0,0,1,2021-10-27T08:16:59.6576360Z,0
3.7073098,100.989304,Daerah: Sabak Bernam<br>No:137<br>Hex coord:(13;10),Parit Enam. 45300. Selangor. Malaysia,0,0,0,0,0,0,1,2021-10-27T08:17:00.8062595Z,0
3.7150898,101.002794,Daerah: Sabak Bernam<br>No:138<br>Hex coord:(14;10),Sekolah Kebangsaan Parit Enam. Sungai Besar. Sabak Bernam. Malaysia,0,0,0,0,0,0,1,2021-10-27T08:17:01.9238376Z,0
3.7073098,101.016284,Daerah: Sabak Bernam<br>No:139<br>Hex coord:(15;10),Parit Enam. 45300. Selangor. Malaysia,0,0,0,0,0,0,1,2021-10-27T08:17:03.6085086Z,0
3.7150898,101.029774,Daerah: Sabak Bernam<br>No:140<br>Hex coord:(16;10),Kampung Permatang. Selangor. Malaysia,1 ,0,0,0,0,0,1,2021-10-27T08:17:05.2935164Z,0
3.7073098,101.043264,Daerah: Sabak Bernam<br>No:141<br>Hex coord:(17;10),Kampung Permatang. Selangor. Malaysia,1 ,0,0,0,0,0,1,2021-10-27T08:17:07.0009912Z,0
3.7150898,101.056754,Daerah: Sabak Bernam<br>No:142<br>Hex coord:(18;10),Jalan Sabak Bernam - Hulu Selangor. Kampung Permatang. Selangor. Malaysia,3 ,0,0,0,0,0,1,2021-10-27T08:17:08.6976110Z,0
3.7073098,101.070244,Daerah: Sabak Bernam<br>No:143<br>Hex coord:(19;10),Kampung Permatang. Selangor. Malaysia,0,0,0,0,0,0,1,2021-10-27T08:17:10.1765336Z,0
3.7150898,101.083734,Daerah: Sabak Bernam<br>No:144<br>Hex coord:(20;10),Parit Tiga Belas. Sabak Bernam. Malaysia,10 ,0,0,0,0,0,1,2021-10-27T08:17:11.8801560Z,0
3.7073098,101.097224,Daerah: Sabak Bernam<br>No:145<br>Hex coord:(21;10),Kampung Binjai Patah. Selangor. Malaysia,0,0,0,0,0,0,1,2021-10-27T08:17:13.5829546Z,0
3.7150898,101.110714,Daerah: Sabak Bernam<br>No:146<br>Hex coord:(22;10),Kampung Binjai Patah. Selangor. Malaysia,0,0,0,0,0,0,1,2021-10-27T08:17:15.2939231Z,0
3.7073098,101.124204,Daerah: Sabak Bernam<br>No:147<br>Hex coord:(23;10),Kampung Belia Satu. Selangor. Malaysia,1 ,0,0,0,0,0,1,2021-10-27T08:17:17.0038160Z,0
3.7150898,101.137694,Daerah: Sabak Bernam<br>No:148<br>Hex coord:(24;10),Kampung Belia Satu. Selangor. Malaysia,0,0,0,0,0,0,1,2021-10-27T08:17:18.1106682Z,0
3.7073098,101.151184,Daerah: Sabak Bernam<br>No:149<br>Hex coord:(25;10),Rizab Melayu Sungai Panjang. Sabak Bernam. Malaysia,0,0,0,0,0,0,1,2021-10-27T08:17:19.8156883Z,0
3.7150898,101.164674,Daerah: Sabak Bernam<br>No:150<br>Hex coord:(26;10),Telok Mahang. Sabak Bernam. Malaysia,1 ,0,0,0,0,0,1,2021-10-27T08:17:20.9225534Z,0
3.7073098,101.178164,Daerah: Sabak Bernam<br>No:151<br>Hex coord:(27;10),Tanjung Merbau Berdarah. Sabak Bernam. Malaysia,1 ,0,0,0,0,0,1,2021-10-27T08:17:22.0332095Z,0
3.7150898,101.191654,Daerah: Sabak Bernam<br>No:152<br>Hex coord:(28;10),Kampung Belia Dua. Selangor. Malaysia,0,0,0,0,0,0,1,2021-10-27T08:17:23.7334309Z,0
3.7073098,101.205144,Daerah: Sabak Bernam<br>No:153<br>Hex coord:(29;10),Kampung Belia Dua. Selangor. Malaysia,0,0,0,0,0,0,1,2021-10-27T08:17:25.4197078Z,0
3.7073098,101.232124,Daerah: Sabak Bernam<br>No:154<br>Hex coord:(31;10),Sabak Bernam. Selangor. Malaysia,0,0,0,0,0,0,1,2021-10-27T08:17:27.1209090Z,0
3.7150898,101.245614,Daerah: Sabak Bernam<br>No:155<br>Hex coord:(32;10),Sabak Bernam. Selangor. Malaysia,0,0,0,0,0,0,1,2021-10-27T08:17:28.8224089Z,0
3.6917498,100.935344,Daerah: Sabak Bernam<br>No:156<br>Hex coord:(9;11),Panchang Bedena. Selangor. Malaysia,1 ,0,0,0,0,0,1,2021-10-27T08:17:29.9389243Z,0
3.6995298,100.948834,Daerah: Sabak Bernam<br>No:157<br>Hex coord:(10;11),Panchang Bedena. 45300. Selangor. Malaysia,1 ,0,0,0,0,0,1,2021-10-27T08:17:32.6446748Z,0
3.6917498,100.962324,Daerah: Sabak Bernam<br>No:158<br>Hex coord:(11;11),Jalan Haji Muhammad. Taman Cahaya. 45300. Selangor. Malaysia,14 ,0,0,0,0,0,1,2021-10-27T08:17:33.7516020Z,0
