lat,lon,label,placename,weeklyactive,totalactive,weeklyrecovered,totalrecovered,weeklydeaths,totaldeaths,weight,timestamp,reserved
3.8629098,100.935344,Daerah: Sabak Bernam<br>No:1<br>Hex coord:(9;0),Hutan Melintang. Hilir Perak. Malaysia,0,0,0,0,0,0,1,2022-07-21T19:30:11.1361988Z,0
3.8473498,100.827424,Daerah: Sabak Bernam<br>No:2<br>Hex coord:(1;1),Sungai Lang. Sobak Bernam. Sabak Bernam. Malaysia,0,0,0,0,0,0,1,2022-07-21T19:30:11.8553102Z,0
3.8473498,100.854404,Daerah: Sabak Bernam<br>No:3<br>Hex coord:(3;1),Sabak Bernam. 45100. Selangor. Malaysia,0,0,0,0,0,0,1,2022-07-21T19:30:12.5745195Z,0
3.8551298,100.867894,Daerah: Sabak Bernam<br>No:4<br>Hex coord:(4;1),Sabak Bernam. Selangor. Malaysia,0,0,0,0,0,0,1,2022-07-21T19:30:13.2700192Z,0
3.8473498,100.881384,Daerah: Sabak Bernam<br>No:5<br>Hex coord:(5;1),Sabak Bernam. Selangor. Malaysia,0,0,0,0,0,0,1,2022-07-21T19:30:13.9610000Z,0
3.8551298,100.894874,Daerah: Sabak Bernam<br>No:6<br>Hex coord:(6;1),Sabak Bernam. Selangor. Malaysia,0,0,0,0,0,0,1,2022-07-21T19:30:14.6595669Z,0
3.8473498,100.908364,Daerah: Sabak Bernam<br>No:7<br>Hex coord:(7;1),Sabak Bernam. 36400. Selangor. Malaysia,0,0,0,0,0,0,1,2022-07-21T19:30:15.3661766Z,0
3.8551298,100.921854,Daerah: Sabak Bernam<br>No:8<br>Hex coord:(8;1),Ladang Sabak Bernam Bahagian Satu. Sabak Bernam. Malaysia,0,0,0,0,0,0,1,2022-07-21T19:30:16.1686269Z,0
3.8473498,100.935344,Daerah: Sabak Bernam<br>No:9<br>Hex coord:(9;1),Sabak Bernam. 36400. Selangor. Malaysia,0,0,0,0,0,0,1,2022-07-21T19:30:16.8658688Z,0
3.8395698,100.813934,Daerah: Sabak Bernam<br>No:10<br>Hex coord:(0;2),Sungai Telok Belanga Kechil. Sobak Bernam. Sabak Bernam. Malaysia,0,0,0,0,0,0,1,2022-07-21T19:30:17.5660883Z,0
3.8317898,100.827424,Daerah: Sabak Bernam<br>No:11<br>Hex coord:(1;2),Sabak Bernam. 45100. Selangor. Malaysia,0,0,0,0,0,0,1,2022-07-21T19:30:18.2582233Z,0
3.8395698,100.840914,Daerah: Sabak Bernam<br>No:12<br>Hex coord:(2;2),Sabak Bernam. 45100. Selangor. Malaysia,0,0,0,0,0,0,1,2022-07-21T19:30:18.9473061Z,0
3.8317898,100.854404,Daerah: Sabak Bernam<br>No:13<br>Hex coord:(3;2),Sabak Bernam. 45100. Selangor. Malaysia,1,0,0,0,0,0,1,2022-07-21T19:30:19.6417751Z,0
3.8395698,100.867894,Daerah: Sabak Bernam<br>No:14<br>Hex coord:(4;2),Sabak Bernam. 45100. Selangor. Malaysia,0,0,0,0,0,0,1,2022-07-21T19:30:20.3509190Z,0
3.8317898,100.881384,Daerah: Sabak Bernam<br>No:15<br>Hex coord:(5;2),Sabak Bernam. Selangor. Malaysia,1,0,0,0,0,0,1,2022-07-21T19:30:21.0888694Z,0
3.8395698,100.894874,Daerah: Sabak Bernam<br>No:16<br>Hex coord:(6;2),Sabak Bernam. Selangor. Malaysia,0,0,0,0,0,0,1,2022-07-21T19:30:21.7836848Z,0
3.8317898,100.908364,Daerah: Sabak Bernam<br>No:17<br>Hex coord:(7;2),Jalan Haji Abdul Karim. Sobak Bernam. Selangor. Malaysia,0,0,0,0,0,0,1,2022-07-21T19:30:22.4862461Z,0
3.8395698,100.921854,Daerah: Sabak Bernam<br>No:18<br>Hex coord:(8;2),Ladang Sungai Bernam Bahagian Dua. Sabak Bernam. Malaysia,0,0,0,0,0,0,1,2022-07-21T19:30:23.1900493Z,0
3.8317898,100.935344,Daerah: Sabak Bernam<br>No:19<br>Hex coord:(9;2),Sabak Bernam. 36400. Selangor. Malaysia,0,0,0,0,0,0,1,2022-07-21T19:30:59.9417055Z,0
3.8240098,100.813934,Daerah: Sabak Bernam<br>No:20<br>Hex coord:(0;3),Balai Cerap Selangor. 45100 Sobak Bernam. Selangor. Malaysia,0,0,0,0,0,0,1,2022-07-21T19:31:00.6444247Z,0
3.8162298,100.827424,Daerah: Sabak Bernam<br>No:21<br>Hex coord:(1;3),Institut Latihan Dakwah Selangor. 45100 Sobak Bernam. Selangor. Malaysia,1,0,0,0,0,0,1,2022-07-21T19:31:01.4764428Z,0
3.8240098,100.840914,Daerah: Sabak Bernam<br>No:22<br>Hex coord:(2;3),Bagan Beting Kepah. 45100. Selangor. Malaysia,1,0,0,0,0,0,1,2022-07-21T19:31:02.1782008Z,0
3.8162298,100.854404,Daerah: Sabak Bernam<br>No:23<br>Hex coord:(3;3),Sungai Tangar. Sobak Bernam. Sabak Bernam. Malaysia,1,0,0,0,0,0,1,2022-07-21T19:31:02.8752531Z,0
3.8240098,100.867894,Daerah: Sabak Bernam<br>No:24<br>Hex coord:(4;3),Rizab Melayu Sungai Lang. Sobak Bernam. Sabak Bernam. Malaysia,2,0,0,0,0,0,1,2022-07-21T19:31:03.5829800Z,0
3.8162298,100.881384,Daerah: Sabak Bernam<br>No:25<br>Hex coord:(5;3),Sabak Bernam. Selangor. Malaysia,0,0,0,0,0,0,1,2022-07-21T19:31:04.2855616Z,0
3.8240098,100.894874,Daerah: Sabak Bernam<br>No:26<br>Hex coord:(6;3),Bagan Telok Ru. 45100. Selangor. Malaysia,0,0,0,0,0,0,1,2022-07-21T19:31:04.9870033Z,0
3.8162298,100.908364,Daerah: Sabak Bernam<br>No:27<br>Hex coord:(7;3),Jalan Haji Yusof. Sobak Bernam. Selangor. Malaysia,1,0,0,0,0,0,1,2022-07-21T19:31:05.6800411Z,0
3.8240098,100.921854,Daerah: Sabak Bernam<br>No:28<br>Hex coord:(8;3),Jalan Haji Mahfud. Selangor. Malaysia,0,0,0,0,0,0,1,2022-07-21T19:31:06.3923152Z,0
3.8162298,100.935344,Daerah: Sabak Bernam<br>No:29<br>Hex coord:(9;3),Ladang Sabak Berna Bahagian Tiga. Sabak Bernam. Malaysia,0,0,0,0,0,0,1,2022-07-21T19:31:07.0870952Z,0
3.8240098,100.948834,Daerah: Sabak Bernam<br>No:30<br>Hex coord:(10;3),Ladang Sabak Berna Bahagian Tiga. Sabak Bernam. Malaysia,0,0,0,0,0,0,1,2022-07-21T19:31:07.7794809Z,0
3.8162298,100.962324,Daerah: Sabak Bernam<br>No:31<br>Hex coord:(11;3),Sabak Bernam. 45200. Selangor. Malaysia,0,0,0,0,0,0,1,2022-07-21T19:31:10.8942898Z,0
3.8084498,100.813934,Daerah: Sabak Bernam<br>No:32<br>Hex coord:(0;4),SBP Integrasi Sabak Bernam. 45100 Sobak Bernam. Selangor. Malaysia,1,0,0,0,0,0,1,2022-07-21T19:31:11.5982738Z,0
3.8006698,100.827424,Daerah: Sabak Bernam<br>No:33<br>Hex coord:(1;4),Bagan Beting Kepah. 45100. Selangor. Malaysia,1,0,0,0,0,0,1,2022-07-21T19:31:12.2951870Z,0
3.8084498,100.840914,Daerah: Sabak Bernam<br>No:34<br>Hex coord:(2;4),Bagan Telok Ru. 45100. Selangor. Malaysia,1,0,0,0,0,0,1,2022-07-21T19:31:12.9867342Z,0
3.8006698,100.854404,Daerah: Sabak Bernam<br>No:35<br>Hex coord:(3;4),Kemajuan Tanah Parit Baharu. Sobak Bernam. Sabak Bernam. Malaysia,0,0,0,0,0,0,1,2022-07-21T19:31:13.6845980Z,0
3.8084498,100.867894,Daerah: Sabak Bernam<br>No:36<br>Hex coord:(4;4),Bagan Telok Ru. Selangor. Malaysia,0,0,0,0,0,0,1,2022-07-21T19:31:14.4542143Z,0
3.8006698,100.881384,Daerah: Sabak Bernam<br>No:37<br>Hex coord:(5;4),Bagan Telok Ru. Selangor. Malaysia,0,0,0,0,0,0,1,2022-07-21T19:31:15.1683168Z,0
3.8084498,100.894874,Daerah: Sabak Bernam<br>No:38<br>Hex coord:(6;4),Sabak Bernam. Selangor. Malaysia,0,0,0,0,0,0,1,2022-07-21T19:31:15.8660994Z,0
3.8006698,100.908364,Daerah: Sabak Bernam<br>No:39<br>Hex coord:(7;4),Sabak Bernam. Selangor. Malaysia,0,0,0,0,0,0,1,2022-07-21T19:31:16.6035234Z,0
3.8084498,100.921854,Daerah: Sabak Bernam<br>No:40<br>Hex coord:(8;4),Sabak Bernam. 45200. Selangor. Malaysia,0,0,0,0,0,0,1,2022-07-21T19:31:17.3081932Z,0
3.8006698,100.935344,Daerah: Sabak Bernam<br>No:41<br>Hex coord:(9;4),Ladang Sungai Bernam Bahagian Empat. Sabak Bernam. Malaysia,0,0,0,0,0,0,1,2022-07-21T19:31:18.0046909Z,0
3.8084498,100.948834,Daerah: Sabak Bernam<br>No:42<br>Hex coord:(10;4),Sabak Bernam. 36400. Selangor. Malaysia,0,0,0,0,0,0,1,2022-07-21T19:31:18.7081667Z,0
3.8006698,100.962324,Daerah: Sabak Bernam<br>No:43<br>Hex coord:(11;4),Sungai Keli Besar. Hilir Perak. Malaysia,0,0,0,0,0,0,1,2022-07-21T19:31:19.3976854Z,0
3.8084498,100.975814,Daerah: Sabak Bernam<br>No:44<br>Hex coord:(12;4),Tanjung Jawa. Sabak Bernam. Malaysia,0,0,0,0,0,0,1,2022-07-21T19:31:20.0957943Z,0
3.8006698,101.016284,Daerah: Sabak Bernam<br>No:45<br>Hex coord:(15;4),Teluk Sepintas. Selangor. Malaysia,0,0,0,0,0,0,1,2022-07-21T19:31:20.7983778Z,0
3.7928898,100.813934,Daerah: Sabak Bernam<br>No:46<br>Hex coord:(0;5),Sungai Apong. Sobak Bernam. Sabak Bernam. Malaysia,0,0,0,0,0,0,1,2022-07-21T19:31:21.5351905Z,0
3.7851098,100.827424,Daerah: Sabak Bernam<br>No:47<br>Hex coord:(1;5),Bagan Beting Kepah. 45100. Selangor. Malaysia,0,0,0,0,0,0,1,2022-07-21T19:31:58.2595156Z,0
3.7928898,100.840914,Daerah: Sabak Bernam<br>No:48<br>Hex coord:(2;5),Bagan Telok Ru. 45100. Selangor. Malaysia,0,0,0,0,0,0,1,2022-07-21T19:31:58.9549162Z,0
3.7851098,100.854404,Daerah: Sabak Bernam<br>No:49<br>Hex coord:(3;5),Bagan Telok Ru. 45100. Selangor. Malaysia,0,0,0,0,0,0,1,2022-07-21T19:31:59.6510518Z,0
3.7928898,100.867894,Daerah: Sabak Bernam<br>No:50<br>Hex coord:(4;5),Bagan Telok Ru. Selangor. Malaysia,0,0,0,0,0,0,1,2022-07-21T19:32:00.3422068Z,0
3.7851098,100.881384,Daerah: Sabak Bernam<br>No:51<br>Hex coord:(5;5),Bagan Telok Ru. Selangor. Malaysia,0,0,0,0,0,0,1,2022-07-21T19:32:01.0455945Z,0
3.7928898,100.894874,Daerah: Sabak Bernam<br>No:52<br>Hex coord:(6;5),Sabak Bernam. Selangor. Malaysia,0,0,0,0,0,0,1,2022-07-21T19:32:01.7287242Z,0
3.7851098,100.908364,Daerah: Sabak Bernam<br>No:53<br>Hex coord:(7;5),Masjid Al-Islakhiah. 45200. Selangor. Malaysia,0,0,0,0,0,0,1,2022-07-21T19:32:02.4378049Z,0
3.7928898,100.921854,Daerah: Sabak Bernam<br>No:54<br>Hex coord:(8;5),Sabak Bernam. 45200. Selangor. Malaysia,1,0,0,0,0,0,1,2022-07-21T19:32:03.1243576Z,0
3.7851098,100.935344,Daerah: Sabak Bernam<br>No:55<br>Hex coord:(9;5),Sabak Bernam. 45200. Selangor. Malaysia,0,0,0,0,0,0,1,2022-07-21T19:32:03.8197908Z,0
3.7928898,100.948834,Daerah: Sabak Bernam<br>No:56<br>Hex coord:(10;5),SK Kampung Baharu. Jalan Pekan Kampung Baru. Sabak Bernam. 45200. Selangor. Malaysia,0,0,0,0,0,0,1,2022-07-21T19:32:04.5063337Z,0
3.7851098,100.989304,Daerah: Sabak Bernam<br>No:57<br>Hex coord:(13;5),Teluk Sepintas. 45200. Selangor. Malaysia,0,0,0,0,0,0,1,2022-07-21T19:32:05.2066305Z,0
3.7928898,101.002794,Daerah: Sabak Bernam<br>No:58<br>Hex coord:(14;5),Teluk Sepintas. Selangor. Malaysia,0,0,0,0,0,0,1,2022-07-21T19:32:05.9153848Z,0
3.7851098,101.016284,Daerah: Sabak Bernam<br>No:59<br>Hex coord:(15;5),Teluk Sepintas. Selangor. Malaysia,0,0,0,0,0,0,1,2022-07-21T19:32:06.6241724Z,0
3.7928898,101.029774,Daerah: Sabak Bernam<br>No:60<br>Hex coord:(16;5),Teluk Sepintas. Selangor. Malaysia,0,0,0,0,0,0,1,2022-07-21T19:32:07.3193580Z,0
3.7851098,101.043264,Daerah: Sabak Bernam<br>No:61<br>Hex coord:(17;5),Teluk Sepintas. Selangor. Malaysia,0,0,0,0,0,0,1,2022-07-21T19:32:08.0202403Z,0
3.7928898,101.056754,Daerah: Sabak Bernam<br>No:62<br>Hex coord:(18;5),Tanjung Ketom. Hilir Perak. Malaysia,0,0,0,0,0,0,1,2022-07-21T19:32:08.7270070Z,0
3.7773298,100.840914,Daerah: Sabak Bernam<br>No:63<br>Hex coord:(2;6),Kuala Bernam Forest Reserve. Jalan Sungai Ayer Tawar. Bagan Beting Kepah. 45100. Selangor. Malaysia,0,0,0,0,0,0,1,2022-07-21T19:32:09.4194616Z,0
3.7773298,100.867894,Daerah: Sabak Bernam<br>No:64<br>Hex coord:(4;6),Bagan Telok Ru. Selangor. Malaysia,0,0,0,0,0,0,1,2022-07-21T19:32:10.1087999Z,0
3.7695498,100.881384,Daerah: Sabak Bernam<br>No:65<br>Hex coord:(5;6),Sabak Bernam. Selangor. Malaysia,1,0,0,0,0,0,1,2022-07-21T19:32:10.7975417Z,0
3.7773298,100.894874,Daerah: Sabak Bernam<br>No:66<br>Hex coord:(6;6),Sabak Bernam. Selangor. Malaysia,0,0,0,0,0,0,1,2022-07-21T19:32:11.5099862Z,0
3.7695498,100.908364,Daerah: Sabak Bernam<br>No:67<br>Hex coord:(7;6),Jalan Tebuk Jawa. Bagan Sungai Pulai. 45200 Sobak Bernam. Selangor. Malaysia,3,0,0,0,0,0,1,2022-07-21T19:32:12.1944654Z,0
3.7773298,100.921854,Daerah: Sabak Bernam<br>No:68<br>Hex coord:(8;6),Rizab Melayu Raja Hitam. Sabak Bernam. Malaysia,1,0,0,0,0,0,1,2022-07-21T19:32:12.8881629Z,0
3.7695498,100.935344,Daerah: Sabak Bernam<br>No:69<br>Hex coord:(9;6),Bagan Sungai Pulai. 45200. Selangor. Malaysia,0,0,0,0,0,0,1,2022-07-21T19:32:13.5765512Z,0
3.7773298,100.948834,Daerah: Sabak Bernam<br>No:70<br>Hex coord:(10;6),Sabak Bernam. 45200. Selangor. Malaysia,0,0,0,0,0,0,1,2022-07-21T19:32:14.2672183Z,0
3.7695498,100.962324,Daerah: Sabak Bernam<br>No:71<br>Hex coord:(11;6),Jalan Kampung Baru. Sabak Bernam. 45200. Selangor. Malaysia,1,0,0,0,0,0,1,2022-07-21T19:32:14.9633320Z,0
3.7695498,100.989304,Daerah: Sabak Bernam<br>No:72<br>Hex coord:(13;6),Teluk Sepintas. 45200. Selangor. Malaysia,4,0,0,0,0,0,1,2022-07-21T19:32:15.6570050Z,0
3.7773298,101.002794,Daerah: Sabak Bernam<br>No:73<br>Hex coord:(14;6),Rizab Melayu Sabak. Sobak Bernam. Sabak Bernam. Malaysia,1,0,0,0,0,0,1,2022-07-21T19:32:16.3571933Z,0
3.7695498,101.016284,Daerah: Sabak Bernam<br>No:74<br>Hex coord:(15;6),Teluk Sepintas. Selangor. Malaysia,0,0,0,0,0,0,1,2022-07-21T19:32:17.0449466Z,0
3.7773298,101.029774,Daerah: Sabak Bernam<br>No:75<br>Hex coord:(16;6),Sungai Sepintas. Sabak Bernam. Malaysia,0,0,0,0,0,0,1,2022-07-21T19:32:17.7298736Z,0
3.7695498,101.043264,Daerah: Sabak Bernam<br>No:76<br>Hex coord:(17;6),Teluk Sepintas. Selangor. Malaysia,0,0,0,0,0,0,1,2022-07-21T19:32:18.4089773Z,0
3.7773298,101.083734,Daerah: Sabak Bernam<br>No:77<br>Hex coord:(20;6),Sungai Samak Kechil. Hilir Perak. Malaysia,0,0,0,0,0,0,1,2022-07-21T19:32:19.0990624Z,0
3.7617698,100.894874,Daerah: Sabak Bernam<br>No:78<br>Hex coord:(6;7),Rizab Melayu Sungai Lang. Sobak Bernam. Sabak Bernam. Malaysia,0,0,0,0,0,0,1,2022-07-21T19:32:19.7649173Z,0
3.7539898,100.908364,Daerah: Sabak Bernam<br>No:79<br>Hex coord:(7;7),Jalan Ghazali. Sobak Bernam. Selangor. Malaysia,0,0,0,0,0,0,1,2022-07-21T19:32:20.4525138Z,0
3.7617698,100.921854,Daerah: Sabak Bernam<br>No:80<br>Hex coord:(8;7),Jalan Kubur. Sobak Bernam. Selangor. Malaysia,2,0,0,0,0,0,1,2022-07-21T19:32:21.1796023Z,0
3.7539898,100.935344,Daerah: Sabak Bernam<br>No:81<br>Hex coord:(9;7),Jalan Haji Sadri. Sobak Bernam. Selangor. Malaysia,1,0,0,0,0,0,1,2022-07-21T19:32:21.9294680Z,0
3.7617698,100.948834,Daerah: Sabak Bernam<br>No:82<br>Hex coord:(10;7),Jalan Haji Saion. Bagan Sungai Pulai. 45200. Selangor. Malaysia,0,0,0,0,0,0,1,2022-07-21T19:32:22.6320569Z,0
3.7539898,100.962324,Daerah: Sabak Bernam<br>No:83<br>Hex coord:(11;7),Jalan Wan Mood. Sobak Bernam. Selangor. Malaysia,3,0,0,0,0,0,1,2022-07-21T19:32:23.3560743Z,0
3.7617698,100.975814,Daerah: Sabak Bernam<br>No:84<br>Hex coord:(12;7),SAM Muhammadiah Pekan Sabak. Jalan Kuala Selangor-Teluk Intan. Sabak Bernam. 45200 Sobak Bernam. Selangor. Malaysia,8,0,0,0,0,0,1,2022-07-21T19:32:24.0474030Z,0
3.7539898,100.989304,Daerah: Sabak Bernam<br>No:85<br>Hex coord:(13;7),K&K HARDWARE AND PHONE. Sobak Bernam. Sabak Bernam. Malaysia,4,0,0,0,0,0,1,2022-07-21T19:32:24.7348798Z,0
3.7617698,101.002794,Daerah: Sabak Bernam<br>No:86<br>Hex coord:(14;7),Teluk Sepintas. 45200. Selangor. Malaysia,0,0,0,0,0,0,1,2022-07-21T19:32:25.4427309Z,0
3.7539898,101.016284,Daerah: Sabak Bernam<br>No:87<br>Hex coord:(15;7),Parit Alur Raja Hitam Lama. Sobak Bernam. Sabak Bernam. Malaysia,0,0,0,0,0,0,1,2022-07-21T19:32:26.1574821Z,0
3.7617698,101.029774,Daerah: Sabak Bernam<br>No:88<br>Hex coord:(16;7),Teluk Sepintas. Selangor. Malaysia,0,0,0,0,0,0,1,2022-07-21T19:32:26.8466728Z,0
3.7539898,101.043264,Daerah: Sabak Bernam<br>No:89<br>Hex coord:(17;7),Ladang Sungai Bernam. Sobak Bernam. Sabak Bernam. Malaysia,0,0,0,0,0,0,1,2022-07-21T19:32:27.5321853Z,0
3.7617698,101.056754,Daerah: Sabak Bernam<br>No:90<br>Hex coord:(18;7),Ladang Antara. Sobak Bernam. Sabak Bernam. Malaysia,0,0,0,0,0,0,1,2022-07-21T19:32:28.2261072Z,0
3.7539898,101.070244,Daerah: Sabak Bernam<br>No:91<br>Hex coord:(19;7),Teluk Sepintas. Selangor. Malaysia,0,0,0,0,0,0,1,2022-07-21T19:32:28.9169634Z,0
3.7617698,101.083734,Daerah: Sabak Bernam<br>No:92<br>Hex coord:(20;7),Kampung Binjai Patah. Selangor. Malaysia,0,0,0,0,0,0,1,2022-07-21T19:32:29.5980627Z,0
3.7539898,101.097224,Daerah: Sabak Bernam<br>No:93<br>Hex coord:(21;7),Kampung Binjai Patah. Selangor. Malaysia,0,0,0,0,0,0,1,2022-07-21T19:32:30.2938118Z,0
3.7384298,100.908364,Daerah: Sabak Bernam<br>No:94<br>Hex coord:(7;8),Bagan Sungai Pulai. 45200. Selangor. Malaysia,0,0,0,0,0,0,1,2022-07-21T19:32:30.9969519Z,0
3.7462098,100.921854,Daerah: Sabak Bernam<br>No:95<br>Hex coord:(8;8),Parit Banting. Sabak Bernam. Malaysia,2,0,0,0,0,0,1,2022-07-21T19:32:31.6779351Z,0
3.7384298,100.935344,Daerah: Sabak Bernam<br>No:96<br>Hex coord:(9;8),Bagan Sungai Pulai. 45200. Selangor. Malaysia,3,0,0,0,0,0,1,2022-07-21T19:32:32.3726298Z,0
3.7462098,100.948834,Daerah: Sabak Bernam<br>No:97<br>Hex coord:(10;8),Jalan Haji Siraj. Bagan Sungai Pulai. 45200. Selangor. Malaysia,0,0,0,0,0,0,1,2022-07-21T19:32:33.0674411Z,0
3.7384298,100.962324,Daerah: Sabak Bernam<br>No:98<br>Hex coord:(11;8),Jalan Haji Mansur. Panchang Bedena. 45200 Sobak Bernam. Selangor. Malaysia,0,0,0,0,0,0,1,2022-07-21T19:32:33.7615639Z,0
3.7462098,100.975814,Daerah: Sabak Bernam<br>No:99<br>Hex coord:(12;8),Surau Ar-Rahmaniah. Jalan Kuala Selangor-Teluk Intan. Parit Enam. 45200 Sobak Bernam. Selangor. Malaysia,2,0,0,0,0,0,1,2022-07-21T19:32:34.4532276Z,0
3.7384298,100.989304,Daerah: Sabak Bernam<br>No:100<br>Hex coord:(13;8),Sabak Bernam. 45200 Sabak Bernam. Selangor. Malaysia,0,0,0,0,0,0,1,2022-07-21T19:32:35.1570205Z,0
3.7462098,101.002794,Daerah: Sabak Bernam<br>No:101<br>Hex coord:(14;8),Ladang Torkington. Sobak Bernam. Sabak Bernam. Malaysia,0,0,0,0,0,0,1,2022-07-21T19:32:35.8576891Z,0
3.7384298,101.016284,Daerah: Sabak Bernam<br>No:102<br>Hex coord:(15;8),Parit Enam. Selangor. Malaysia,0,0,0,0,0,0,1,2022-07-21T19:32:36.5528132Z,0
3.7462098,101.029774,Daerah: Sabak Bernam<br>No:103<br>Hex coord:(16;8),Teluk Sepintas. Selangor. Malaysia,2,0,0,0,0,0,1,2022-07-21T19:32:37.2467154Z,0
3.7384298,101.043264,Daerah: Sabak Bernam<br>No:104<br>Hex coord:(17;8),Parit Sebelas Barat. Sobak Bernam. Sabak Bernam. Malaysia,2,0,0,0,0,0,1,2022-07-21T19:32:37.9350701Z,0
3.7462098,101.056754,Daerah: Sabak Bernam<br>No:105<br>Hex coord:(18;8),Teluk Sepintas. Selangor. Malaysia,1,0,0,0,0,0,1,2022-07-21T19:32:38.6245188Z,0
3.7384298,101.070244,Daerah: Sabak Bernam<br>No:106<br>Hex coord:(19;8),Jalan Tok Khalifah. Kampung Permatang. Selangor. Malaysia,3,0,0,0,0,0,1,2022-07-21T19:32:39.3224989Z,0
3.7384298,101.097224,Daerah: Sabak Bernam<br>No:107<br>Hex coord:(21;8),Sungai Panjang. Sobak Bernam. Sabak Bernam. Malaysia,0,0,0,0,0,0,1,2022-07-21T19:32:40.0110401Z,0
3.7462098,101.110714,Daerah: Sabak Bernam<br>No:108<br>Hex coord:(22;8),Sungai Bugis. Hilir Perak. Malaysia,0,0,0,0,0,0,1,2022-07-21T19:32:40.6952138Z,0
3.7384298,101.124204,Daerah: Sabak Bernam<br>No:109<br>Hex coord:(23;8),Kampung Binjai Patah. Selangor. Malaysia,2,0,0,0,0,0,1,2022-07-21T19:32:41.3996809Z,0
3.7462098,101.137694,Daerah: Sabak Bernam<br>No:110<br>Hex coord:(24;8),Sungai Samak. Sabak Bernam. Malaysia,1,0,0,0,0,0,1,2022-07-21T19:32:42.0884623Z,0
3.7462098,101.164674,Daerah: Sabak Bernam<br>No:111<br>Hex coord:(26;8),Hospital Ulu Sungai Bernam. Hilir Perak. Malaysia,0,0,0,0,0,0,1,2022-07-21T19:32:42.7869381Z,0
3.7306498,100.921854,Daerah: Sabak Bernam<br>No:112<br>Hex coord:(8;9),SJK(C) Phooi Tee. Bagan Sungai Pulai. Jalan Haji Muhammad. Panchang Bedena. 45200. Selangor. Malaysia,0,0,0,0,0,0,1,2022-07-21T19:32:43.4807546Z,0
3.7228698,100.935344,Daerah: Sabak Bernam<br>No:113<br>Hex coord:(9;9),Parit Pulai. Sobak Bernam. Sabak Bernam. Malaysia,0,0,0,0,0,0,1,2022-07-21T19:32:44.1622906Z,0
3.7306498,100.948834,Daerah: Sabak Bernam<br>No:114<br>Hex coord:(10;9),Bagan Sungai Pulai. 45200. Selangor. Malaysia,0,0,0,0,0,0,1,2022-07-21T19:32:44.8476466Z,0
3.7228698,100.962324,Daerah: Sabak Bernam<br>No:115<br>Hex coord:(11;9),Jalan Jentera. Panchang Bedena. 45200. Selangor. Malaysia,1,0,0,0,0,0,1,2022-07-21T19:32:45.5386546Z,0
3.7306498,100.975814,Daerah: Sabak Bernam<br>No:116<br>Hex coord:(12;9),Jalan Kuala Selangor-Teluk Intan. Panchang Bedena. 45200. Selangor. Malaysia,0,0,0,0,0,0,1,2022-07-21T19:32:46.2513032Z,0
3.7228698,100.989304,Daerah: Sabak Bernam<br>No:117<br>Hex coord:(13;9),Parit Enam. 45200. Selangor. Malaysia,0,0,0,0,0,0,1,2022-07-21T19:32:46.9483090Z,0
3.7306498,101.002794,Daerah: Sabak Bernam<br>No:118<br>Hex coord:(14;9),Ladang Lim Kooi Hua Sungai Bernam. Sabak Bernam. Malaysia,0,0,0,0,0,0,1,2022-07-21T19:32:47.6448231Z,0
3.7228698,101.016284,Daerah: Sabak Bernam<br>No:119<br>Hex coord:(15;9),Parit Enam. Selangor. Malaysia,1,0,0,0,0,0,1,2022-07-21T19:32:48.3472585Z,0
3.7306498,101.029774,Daerah: Sabak Bernam<br>No:120<br>Hex coord:(16;9),B51. Selangor. Malaysia,1,0,0,0,0,0,1,2022-07-21T19:32:49.0527285Z,0
3.7228698,101.043264,Daerah: Sabak Bernam<br>No:121<br>Hex coord:(17;9),Kampung Permatang. Selangor. Malaysia,3,0,0,0,0,0,1,2022-07-21T19:32:49.7449267Z,0
3.7306498,101.056754,Daerah: Sabak Bernam<br>No:122<br>Hex coord:(18;9),Kampung Permatang. Selangor. Malaysia,0,0,0,0,0,0,1,2022-07-21T19:32:50.4262609Z,0
3.7228698,101.070244,Daerah: Sabak Bernam<br>No:123<br>Hex coord:(19;9),Kampung Permatang. Selangor. Malaysia,0,0,0,0,0,0,1,2022-07-21T19:32:51.1256692Z,0
3.7306498,101.083734,Daerah: Sabak Bernam<br>No:124<br>Hex coord:(20;9),B44. Sungai Besar. Selangor. Malaysia,0,0,0,0,0,0,1,2022-07-21T19:32:51.8092838Z,0
3.7228698,101.097224,Daerah: Sabak Bernam<br>No:125<br>Hex coord:(21;9),Kampung Binjai Patah. Selangor. Malaysia,0,0,0,0,0,0,1,2022-07-21T19:32:52.5065008Z,0
3.7306498,101.110714,Daerah: Sabak Bernam<br>No:126<br>Hex coord:(22;9),Kampung Binjai Patah. Selangor. Malaysia,1,0,0,0,0,0,1,2022-07-21T19:32:53.2071402Z,0
3.7228698,101.124204,Daerah: Sabak Bernam<br>No:127<br>Hex coord:(23;9),Kampung Binjai Patah. Selangor. Malaysia,4,0,0,0,0,0,1,2022-07-21T19:32:53.9078101Z,0
3.7306498,101.137694,Daerah: Sabak Bernam<br>No:128<br>Hex coord:(24;9),Sungai Telok. Hulu Bemam. Sabak Bernam. Malaysia,0,0,0,0,0,0,1,2022-07-21T19:32:54.6016738Z,0
3.7228698,101.151184,Daerah: Sabak Bernam<br>No:129<br>Hex coord:(25;9),Kemajuan Tanah Belia Merbau Berdarah. Sabak Bernam. Malaysia,0,0,0,0,0,0,1,2022-07-21T19:32:55.2938917Z,0
3.7306498,101.164674,Daerah: Sabak Bernam<br>No:130<br>Hex coord:(26;9),Rantau Panjang. Hilir Perak. Malaysia,0,0,0,0,0,0,1,2022-07-21T19:32:55.9945849Z,0
3.7228698,101.178164,Daerah: Sabak Bernam<br>No:131<br>Hex coord:(27;9),Ulu Bernam Bahagian Selangor. Sabak Bernam. Malaysia,0,0,0,0,0,0,1,2022-07-21T19:33:32.7754474Z,0
3.7150898,100.921854,Daerah: Sabak Bernam<br>No:132<br>Hex coord:(8;10),Bagan Sungai Pulai. Selangor. Malaysia,0,0,0,0,0,0,1,2022-07-21T19:33:33.4794207Z,0
3.7073098,100.935344,Daerah: Sabak Bernam<br>No:133<br>Hex coord:(9;10),Sabak Bernam. Bagan Sungai Burung. Selangor. Malaysia,2,0,0,0,0,0,1,2022-07-21T19:33:34.1831868Z,0
3.7150898,100.948834,Daerah: Sabak Bernam<br>No:134<br>Hex coord:(10;10),Panchang Bedena. 45300. Selangor. Malaysia,2,0,0,0,0,0,1,2022-07-21T19:33:34.8787899Z,0
3.7073098,100.962324,Daerah: Sabak Bernam<br>No:135<br>Hex coord:(11;10),Jalan Surau Suluk. Sungai Besar. Selangor. Malaysia,0,0,0,0,0,0,1,2022-07-21T19:33:35.5811671Z,0
3.7150898,100.975814,Daerah: Sabak Bernam<br>No:136<br>Hex coord:(12;10),Ladang Lingam. Sobak Bernam. Sabak Bernam. Malaysia,0,0,0,0,0,0,1,2022-07-21T19:33:36.2831586Z,0
3.7073098,100.989304,Daerah: Sabak Bernam<br>No:137<br>Hex coord:(13;10),Parit Enam. 45300. Selangor. Malaysia,2,0,0,0,0,0,1,2022-07-21T19:33:37.0187716Z,0
3.7150898,101.002794,Daerah: Sabak Bernam<br>No:138<br>Hex coord:(14;10),Sekolah Kebangsaan Parit Enam. Sungai Besar. Sabak Bernam. Malaysia,0,0,0,0,0,0,1,2022-07-21T19:33:37.7517961Z,0
3.7073098,101.016284,Daerah: Sabak Bernam<br>No:139<br>Hex coord:(15;10),Parit Enam. 45300. Selangor. Malaysia,1,0,0,0,0,0,1,2022-07-21T19:33:39.5628894Z,0
3.7150898,101.029774,Daerah: Sabak Bernam<br>No:140<br>Hex coord:(16;10),Kampung Permatang. Selangor. Malaysia,1,0,0,0,0,0,1,2022-07-21T19:33:40.4615736Z,0
3.7073098,101.043264,Daerah: Sabak Bernam<br>No:141<br>Hex coord:(17;10),Kampung Permatang. Selangor. Malaysia,3,0,0,0,0,0,1,2022-07-21T19:33:41.2329999Z,0
3.7150898,101.056754,Daerah: Sabak Bernam<br>No:142<br>Hex coord:(18;10),Jalan Sabak Bernam - Hulu Selangor. Kampung Permatang. Selangor. Malaysia,0,0,0,0,0,0,1,2022-07-21T19:33:42.0055490Z,0
3.7073098,101.070244,Daerah: Sabak Bernam<br>No:143<br>Hex coord:(19;10),Kampung Permatang. Selangor. Malaysia,0,0,0,0,0,0,1,2022-07-21T19:33:42.7710702Z,0
3.7150898,101.083734,Daerah: Sabak Bernam<br>No:144<br>Hex coord:(20;10),Parit Tiga Belas. Sabak Bernam. Malaysia,0,0,0,0,0,0,1,2022-07-21T19:33:43.4711711Z,0
3.7073098,101.097224,Daerah: Sabak Bernam<br>No:145<br>Hex coord:(21;10),Kampung Binjai Patah. Selangor. Malaysia,0,0,0,0,0,0,1,2022-07-21T19:33:44.1635220Z,0
3.7150898,101.110714,Daerah: Sabak Bernam<br>No:146<br>Hex coord:(22;10),Kampung Binjai Patah. Selangor. Malaysia,0,0,0,0,0,0,1,2022-07-21T19:33:44.8600794Z,0
3.7073098,101.124204,Daerah: Sabak Bernam<br>No:147<br>Hex coord:(23;10),Kampung Belia Satu. Selangor. Malaysia,1,0,0,0,0,0,1,2022-07-21T19:33:45.5647625Z,0
3.7150898,101.137694,Daerah: Sabak Bernam<br>No:148<br>Hex coord:(24;10),Kampung Belia Satu. Selangor. Malaysia,1,0,0,0,0,0,1,2022-07-21T19:33:46.2643894Z,0
3.7073098,101.151184,Daerah: Sabak Bernam<br>No:149<br>Hex coord:(25;10),Rizab Melayu Sungai Panjang. Sabak Bernam. Malaysia,1,0,0,0,0,0,1,2022-07-21T19:33:47.0435020Z,0
3.7150898,101.164674,Daerah: Sabak Bernam<br>No:150<br>Hex coord:(26;10),Telok Mahang. Sabak Bernam. Malaysia,0,0,0,0,0,0,1,2022-07-21T19:33:47.7298238Z,0
3.7073098,101.178164,Daerah: Sabak Bernam<br>No:151<br>Hex coord:(27;10),Tanjung Merbau Berdarah. Sabak Bernam. Malaysia,1,0,0,0,0,0,1,2022-07-21T19:33:48.4646380Z,0
3.7150898,101.191654,Daerah: Sabak Bernam<br>No:152<br>Hex coord:(28;10),Kampung Belia Dua. Selangor. Malaysia,0,0,0,0,0,0,1,2022-07-21T19:33:49.2002953Z,0
3.7073098,101.205144,Daerah: Sabak Bernam<br>No:153<br>Hex coord:(29;10),Kampung Belia Dua. Selangor. Malaysia,1,0,0,0,0,0,1,2022-07-21T19:33:49.8856576Z,0
3.7073098,101.232124,Daerah: Sabak Bernam<br>No:154<br>Hex coord:(31;10),Sabak Bernam. Selangor. Malaysia,0,0,0,0,0,0,1,2022-07-21T19:33:50.5869079Z,0
3.7150898,101.245614,Daerah: Sabak Bernam<br>No:155<br>Hex coord:(32;10),Sabak Bernam. Selangor. Malaysia,0,0,0,0,0,0,1,2022-07-21T19:33:51.2895180Z,0
3.6917498,100.935344,Daerah: Sabak Bernam<br>No:156<br>Hex coord:(9;11),Panchang Bedena. Selangor. Malaysia,0,0,0,0,0,0,1,2022-07-21T19:33:52.1483055Z,0
3.6995298,100.948834,Daerah: Sabak Bernam<br>No:157<br>Hex coord:(10;11),Panchang Bedena. 45300. Selangor. Malaysia,3,0,0,0,0,0,1,2022-07-21T19:33:52.8483014Z,0
3.6917498,100.962324,Daerah: Sabak Bernam<br>No:158<br>Hex coord:(11;11),Jalan Haji Muhammad. Taman Cahaya. 45300. Selangor. Malaysia,1,0,0,0,0,0,1,2022-07-21T19:33:53.5566842Z,0
