lat,lon,label,placename,weeklyactive,totalactive,weeklyrecovered,totalrecovered,weeklydeaths,totaldeaths,weight,timestamp,reserved
3.8629098,100.935344,Daerah: Sabak Bernam<br>No:1<br>Hex coord:(9;0),Hutan Melintang. Hilir Perak. Malaysia,0,0,0,0,0,0,1,2022-02-16T06:35:11.8253280Z,0
3.8473498,100.827424,Daerah: Sabak Bernam<br>No:2<br>Hex coord:(1;1),Sungai Lang. Sobak Bernam. Sabak Bernam. Malaysia,0,0,0,0,0,0,1,2022-02-16T06:35:12.5497776Z,0
3.8473498,100.854404,Daerah: Sabak Bernam<br>No:3<br>Hex coord:(3;1),Sabak Bernam. 45100. Selangor. Malaysia,0,0,0,0,0,0,1,2022-02-16T06:35:13.2197107Z,0
3.8551298,100.867894,Daerah: Sabak Bernam<br>No:4<br>Hex coord:(4;1),Sabak Bernam. Selangor. Malaysia,0,0,0,0,0,0,1,2022-02-16T06:35:13.8941704Z,0
3.8473498,100.881384,Daerah: Sabak Bernam<br>No:5<br>Hex coord:(5;1),Sabak Bernam. Selangor. Malaysia,0,0,0,0,0,0,1,2022-02-16T06:35:14.5688154Z,0
3.8551298,100.894874,Daerah: Sabak Bernam<br>No:6<br>Hex coord:(6;1),Sabak Bernam. Selangor. Malaysia,2 ,0,0,0,0,0,1,2022-02-16T06:35:15.9200735Z,0
3.8473498,100.908364,Daerah: Sabak Bernam<br>No:7<br>Hex coord:(7;1),Sabak Bernam. 36400. Selangor. Malaysia,1 ,0,0,0,0,0,1,2022-02-16T06:35:16.7500192Z,0
3.8551298,100.921854,Daerah: Sabak Bernam<br>No:8<br>Hex coord:(8;1),Ladang Sabak Bernam Bahagian Satu. Sabak Bernam. Malaysia,0,0,0,0,0,0,1,2022-02-16T06:35:17.4216545Z,0
3.8473498,100.935344,Daerah: Sabak Bernam<br>No:9<br>Hex coord:(9;1),Sabak Bernam. 36400. Selangor. Malaysia,0,0,0,0,0,0,1,2022-02-16T06:35:18.3258766Z,0
3.8395698,100.813934,Daerah: Sabak Bernam<br>No:10<br>Hex coord:(0;2),Sungai Telok Belanga Kechil. Sobak Bernam. Sabak Bernam. Malaysia,0,0,0,0,0,0,1,2022-02-16T06:35:19.0037286Z,0
3.8317898,100.827424,Daerah: Sabak Bernam<br>No:11<br>Hex coord:(1;2),Sabak Bernam. 45100. Selangor. Malaysia,0,0,0,0,0,0,1,2022-02-16T06:35:19.6733875Z,0
3.8395698,100.840914,Daerah: Sabak Bernam<br>No:12<br>Hex coord:(2;2),Sabak Bernam. 45100. Selangor. Malaysia,2 ,0,0,0,0,0,1,2022-02-16T06:35:20.5675519Z,0
3.8317898,100.854404,Daerah: Sabak Bernam<br>No:13<br>Hex coord:(3;2),Sabak Bernam. 45100. Selangor. Malaysia,0,0,0,0,0,0,1,2022-02-16T06:35:21.2336359Z,0
3.8395698,100.867894,Daerah: Sabak Bernam<br>No:14<br>Hex coord:(4;2),Sabak Bernam. 45100. Selangor. Malaysia,0,0,0,0,0,0,1,2022-02-16T06:35:22.1110691Z,0
3.8317898,100.881384,Daerah: Sabak Bernam<br>No:15<br>Hex coord:(5;2),Sabak Bernam. Selangor. Malaysia,0,0,0,0,0,0,1,2022-02-16T06:35:22.7783041Z,0
3.8395698,100.894874,Daerah: Sabak Bernam<br>No:16<br>Hex coord:(6;2),Sabak Bernam. Selangor. Malaysia,9 ,0,0,0,0,0,1,2022-02-16T06:35:23.4436852Z,0
3.8317898,100.908364,Daerah: Sabak Bernam<br>No:17<br>Hex coord:(7;2),Jalan Haji Abdul Karim. Sobak Bernam. Selangor. Malaysia,0,0,0,0,0,0,1,2022-02-16T06:35:24.1062371Z,0
3.8395698,100.921854,Daerah: Sabak Bernam<br>No:18<br>Hex coord:(8;2),Ladang Sungai Bernam Bahagian Dua. Sabak Bernam. Malaysia,0,0,0,0,0,0,1,2022-02-16T06:35:24.8409810Z,0
3.8317898,100.935344,Daerah: Sabak Bernam<br>No:19<br>Hex coord:(9;2),Sabak Bernam. 36400. Selangor. Malaysia,0,0,0,0,0,0,1,2022-02-16T06:35:25.5143479Z,0
3.8240098,100.813934,Daerah: Sabak Bernam<br>No:20<br>Hex coord:(0;3),Balai Cerap Selangor. 45100 Sobak Bernam. Selangor. Malaysia,0,0,0,0,0,0,1,2022-02-16T06:35:26.1895457Z,0
3.8162298,100.827424,Daerah: Sabak Bernam<br>No:21<br>Hex coord:(1;3),Institut Latihan Dakwah Selangor. 45100 Sobak Bernam. Selangor. Malaysia,4 ,0,0,0,0,0,1,2022-02-16T06:35:26.9126924Z,0
3.8240098,100.840914,Daerah: Sabak Bernam<br>No:22<br>Hex coord:(2;3),Bagan Beting Kepah. 45100. Selangor. Malaysia,2 ,0,0,0,0,0,1,2022-02-16T06:35:27.8069611Z,0
3.8162298,100.854404,Daerah: Sabak Bernam<br>No:23<br>Hex coord:(3;3),Sungai Tangar. Sobak Bernam. Sabak Bernam. Malaysia,1 ,0,0,0,0,0,1,2022-02-16T06:35:28.4708039Z,0
3.8240098,100.867894,Daerah: Sabak Bernam<br>No:24<br>Hex coord:(4;3),Rizab Melayu Sungai Lang. Sobak Bernam. Sabak Bernam. Malaysia,1 ,0,0,0,0,0,1,2022-02-16T06:35:29.1396118Z,0
3.8162298,100.881384,Daerah: Sabak Bernam<br>No:25<br>Hex coord:(5;3),Sabak Bernam. Selangor. Malaysia,0,0,0,0,0,0,1,2022-02-16T06:35:30.0331268Z,0
3.8240098,100.894874,Daerah: Sabak Bernam<br>No:26<br>Hex coord:(6;3),Bagan Telok Ru. 45100. Selangor. Malaysia,9 ,0,0,0,0,0,1,2022-02-16T06:35:31.7011492Z,0
3.8162298,100.908364,Daerah: Sabak Bernam<br>No:27<br>Hex coord:(7;3),Jalan Haji Yusof. Sobak Bernam. Selangor. Malaysia,0,0,0,0,0,0,1,2022-02-16T06:35:33.3801789Z,0
3.8240098,100.921854,Daerah: Sabak Bernam<br>No:28<br>Hex coord:(8;3),Jalan Haji Mahfud. Selangor. Malaysia,0,0,0,0,0,0,1,2022-02-16T06:35:34.0502379Z,0
3.8162298,100.935344,Daerah: Sabak Bernam<br>No:29<br>Hex coord:(9;3),Ladang Sabak Berna Bahagian Tiga. Sabak Bernam. Malaysia,0,0,0,0,0,0,1,2022-02-16T06:35:34.7197255Z,0
3.8240098,100.948834,Daerah: Sabak Bernam<br>No:30<br>Hex coord:(10;3),Ladang Sabak Berna Bahagian Tiga. Sabak Bernam. Malaysia,0,0,0,0,0,0,1,2022-02-16T06:35:35.3992037Z,0
3.8162298,100.962324,Daerah: Sabak Bernam<br>No:31<br>Hex coord:(11;3),Sabak Bernam. 45200. Selangor. Malaysia,0,0,0,0,0,0,1,2022-02-16T06:35:36.0709871Z,0
3.8084498,100.813934,Daerah: Sabak Bernam<br>No:32<br>Hex coord:(0;4),SBP Integrasi Sabak Bernam. 45100 Sobak Bernam. Selangor. Malaysia,2 ,0,0,0,0,0,1,2022-02-16T06:35:36.7342103Z,0
3.8006698,100.827424,Daerah: Sabak Bernam<br>No:33<br>Hex coord:(1;4),Bagan Beting Kepah. 45100. Selangor. Malaysia,3 ,0,0,0,0,0,1,2022-02-16T06:35:37.4582781Z,0
3.8084498,100.840914,Daerah: Sabak Bernam<br>No:34<br>Hex coord:(2;4),Bagan Telok Ru. 45100. Selangor. Malaysia,2 ,0,0,0,0,0,1,2022-02-16T06:35:38.1312040Z,0
3.8006698,100.854404,Daerah: Sabak Bernam<br>No:35<br>Hex coord:(3;4),Kemajuan Tanah Parit Baharu. Sobak Bernam. Sabak Bernam. Malaysia,1 ,0,0,0,0,0,1,2022-02-16T06:35:38.8032101Z,0
3.8084498,100.867894,Daerah: Sabak Bernam<br>No:36<br>Hex coord:(4;4),Bagan Telok Ru. Selangor. Malaysia,0,0,0,0,0,0,1,2022-02-16T06:35:39.4787296Z,0
3.8006698,100.881384,Daerah: Sabak Bernam<br>No:37<br>Hex coord:(5;4),Bagan Telok Ru. Selangor. Malaysia,2 ,0,0,0,0,0,1,2022-02-16T06:35:40.1522066Z,0
3.8084498,100.894874,Daerah: Sabak Bernam<br>No:38<br>Hex coord:(6;4),Sabak Bernam. Selangor. Malaysia,1 ,0,0,0,0,0,1,2022-02-16T06:35:40.8142805Z,0
3.8006698,100.908364,Daerah: Sabak Bernam<br>No:39<br>Hex coord:(7;4),Sabak Bernam. Selangor. Malaysia,0,0,0,0,0,0,1,2022-02-16T06:35:41.4804002Z,0
3.8084498,100.921854,Daerah: Sabak Bernam<br>No:40<br>Hex coord:(8;4),Sabak Bernam. 45200. Selangor. Malaysia,2 ,0,0,0,0,0,1,2022-02-16T06:35:42.1451194Z,0
3.8006698,100.935344,Daerah: Sabak Bernam<br>No:41<br>Hex coord:(9;4),Ladang Sungai Bernam Bahagian Empat. Sabak Bernam. Malaysia,0,0,0,0,0,0,1,2022-02-16T06:35:43.8145212Z,0
3.8084498,100.948834,Daerah: Sabak Bernam<br>No:42<br>Hex coord:(10;4),Sabak Bernam. 36400. Selangor. Malaysia,0,0,0,0,0,0,1,2022-02-16T06:35:44.5480987Z,0
3.8006698,100.962324,Daerah: Sabak Bernam<br>No:43<br>Hex coord:(11;4),Sungai Keli Besar. Hilir Perak. Malaysia,0,0,0,0,0,0,1,2022-02-16T06:35:45.2123936Z,0
3.8084498,100.975814,Daerah: Sabak Bernam<br>No:44<br>Hex coord:(12;4),Tanjung Jawa. Sabak Bernam. Malaysia,0,0,0,0,0,0,1,2022-02-16T06:35:47.0960516Z,0
3.8006698,101.016284,Daerah: Sabak Bernam<br>No:45<br>Hex coord:(15;4),Teluk Sepintas. Selangor. Malaysia,1 ,0,0,0,0,0,1,2022-02-16T06:35:47.8160015Z,0
3.7928898,100.813934,Daerah: Sabak Bernam<br>No:46<br>Hex coord:(0;5),Sungai Apong. Sobak Bernam. Sabak Bernam. Malaysia,0,0,0,0,0,0,1,2022-02-16T06:35:48.4849685Z,0
3.7851098,100.827424,Daerah: Sabak Bernam<br>No:47<br>Hex coord:(1;5),Bagan Beting Kepah. 45100. Selangor. Malaysia,1 ,0,0,0,0,0,1,2022-02-16T06:35:49.1517196Z,0
3.7928898,100.840914,Daerah: Sabak Bernam<br>No:48<br>Hex coord:(2;5),Bagan Telok Ru. 45100. Selangor. Malaysia,2 ,0,0,0,0,0,1,2022-02-16T06:35:50.8206322Z,0
3.7851098,100.854404,Daerah: Sabak Bernam<br>No:49<br>Hex coord:(3;5),Bagan Telok Ru. 45100. Selangor. Malaysia,2 ,0,0,0,0,0,1,2022-02-16T06:35:51.4893912Z,0
3.7928898,100.867894,Daerah: Sabak Bernam<br>No:50<br>Hex coord:(4;5),Bagan Telok Ru. Selangor. Malaysia,0,0,0,0,0,0,1,2022-02-16T06:35:52.1525259Z,0
3.7851098,100.881384,Daerah: Sabak Bernam<br>No:51<br>Hex coord:(5;5),Bagan Telok Ru. Selangor. Malaysia,3 ,0,0,0,0,0,1,2022-02-16T06:35:52.8636447Z,0
3.7928898,100.894874,Daerah: Sabak Bernam<br>No:52<br>Hex coord:(6;5),Sabak Bernam. Selangor. Malaysia,1 ,0,0,0,0,0,1,2022-02-16T06:35:53.5439588Z,0
3.7851098,100.908364,Daerah: Sabak Bernam<br>No:53<br>Hex coord:(7;5),Masjid Al-Islakhiah. 45200. Selangor. Malaysia,0,0,0,0,0,0,1,2022-02-16T06:35:54.2108927Z,0
3.7928898,100.921854,Daerah: Sabak Bernam<br>No:54<br>Hex coord:(8;5),Sabak Bernam. 45200. Selangor. Malaysia,6 ,0,0,0,0,0,1,2022-02-16T06:35:54.9045483Z,0
3.7851098,100.935344,Daerah: Sabak Bernam<br>No:55<br>Hex coord:(9;5),Sabak Bernam. 45200. Selangor. Malaysia,1 ,0,0,0,0,0,1,2022-02-16T06:35:55.5846646Z,0
3.7928898,100.948834,Daerah: Sabak Bernam<br>No:56<br>Hex coord:(10;5),SK Kampung Baharu. Jalan Pekan Kampung Baru. Sabak Bernam. 45200. Selangor. Malaysia,0,0,0,0,0,0,1,2022-02-16T06:35:56.2515715Z,0
3.7851098,100.989304,Daerah: Sabak Bernam<br>No:57<br>Hex coord:(13;5),Teluk Sepintas. 45200. Selangor. Malaysia,1 ,0,0,0,0,0,1,2022-02-16T06:35:56.9220066Z,0
3.7928898,101.002794,Daerah: Sabak Bernam<br>No:58<br>Hex coord:(14;5),Teluk Sepintas. Selangor. Malaysia,4 ,0,0,0,0,0,1,2022-02-16T06:35:57.6502355Z,0
3.7851098,101.016284,Daerah: Sabak Bernam<br>No:59<br>Hex coord:(15;5),Teluk Sepintas. Selangor. Malaysia,3 ,0,0,0,0,0,1,2022-02-16T06:35:58.3113069Z,0
3.7928898,101.029774,Daerah: Sabak Bernam<br>No:60<br>Hex coord:(16;5),Teluk Sepintas. Selangor. Malaysia,0,0,0,0,0,0,1,2022-02-16T06:35:59.9970736Z,0
3.7851098,101.043264,Daerah: Sabak Bernam<br>No:61<br>Hex coord:(17;5),Teluk Sepintas. Selangor. Malaysia,0,0,0,0,0,0,1,2022-02-16T06:36:00.7384269Z,0
3.7928898,101.056754,Daerah: Sabak Bernam<br>No:62<br>Hex coord:(18;5),Tanjung Ketom. Hilir Perak. Malaysia,0,0,0,0,0,0,1,2022-02-16T06:36:01.5528466Z,0
3.7773298,100.840914,Daerah: Sabak Bernam<br>No:63<br>Hex coord:(2;6),Kuala Bernam Forest Reserve. Jalan Sungai Ayer Tawar. Bagan Beting Kepah. 45100. Selangor. Malaysia,0,0,0,0,0,0,1,2022-02-16T06:36:02.2216874Z,0
3.7773298,100.867894,Daerah: Sabak Bernam<br>No:64<br>Hex coord:(4;6),Bagan Telok Ru. Selangor. Malaysia,1 ,0,0,0,0,0,1,2022-02-16T06:36:02.9722343Z,0
3.7695498,100.881384,Daerah: Sabak Bernam<br>No:65<br>Hex coord:(5;6),Sabak Bernam. Selangor. Malaysia,4 ,0,0,0,0,0,1,2022-02-16T06:36:03.6434467Z,0
3.7773298,100.894874,Daerah: Sabak Bernam<br>No:66<br>Hex coord:(6;6),Sabak Bernam. Selangor. Malaysia,3 ,0,0,0,0,0,1,2022-02-16T06:36:04.3371952Z,0
3.7695498,100.908364,Daerah: Sabak Bernam<br>No:67<br>Hex coord:(7;6),Jalan Tebuk Jawa. Bagan Sungai Pulai. 45200 Sobak Bernam. Selangor. Malaysia,4 ,0,0,0,0,0,1,2022-02-16T06:36:05.0173886Z,0
3.7773298,100.921854,Daerah: Sabak Bernam<br>No:68<br>Hex coord:(8;6),Rizab Melayu Raja Hitam. Sabak Bernam. Malaysia,0,0,0,0,0,0,1,2022-02-16T06:36:05.6929904Z,0
3.7695498,100.935344,Daerah: Sabak Bernam<br>No:69<br>Hex coord:(9;6),Bagan Sungai Pulai. 45200. Selangor. Malaysia,2 ,0,0,0,0,0,1,2022-02-16T06:36:06.3674673Z,0
3.7773298,100.948834,Daerah: Sabak Bernam<br>No:70<br>Hex coord:(10;6),Sabak Bernam. 45200. Selangor. Malaysia,0,0,0,0,0,0,1,2022-02-16T06:36:07.0275050Z,0
3.7695498,100.962324,Daerah: Sabak Bernam<br>No:71<br>Hex coord:(11;6),Jalan Kampung Baru. Sabak Bernam. 45200. Selangor. Malaysia,3 ,0,0,0,0,0,1,2022-02-16T06:36:07.7436701Z,0
3.7695498,100.989304,Daerah: Sabak Bernam<br>No:72<br>Hex coord:(13;6),Teluk Sepintas. 45200. Selangor. Malaysia,39 ,0,0,0,0,0,1,2022-02-16T06:36:08.4124122Z,0
3.7773298,101.002794,Daerah: Sabak Bernam<br>No:73<br>Hex coord:(14;6),Rizab Melayu Sabak. Sobak Bernam. Sabak Bernam. Malaysia,2 ,0,0,0,0,0,1,2022-02-16T06:36:09.0840035Z,0
3.7695498,101.016284,Daerah: Sabak Bernam<br>No:74<br>Hex coord:(15;6),Teluk Sepintas. Selangor. Malaysia,0,0,0,0,0,0,1,2022-02-16T06:36:09.9733107Z,0
3.7773298,101.029774,Daerah: Sabak Bernam<br>No:75<br>Hex coord:(16;6),Sungai Sepintas. Sabak Bernam. Malaysia,5 ,0,0,0,0,0,1,2022-02-16T06:36:10.6450256Z,0
3.7695498,101.043264,Daerah: Sabak Bernam<br>No:76<br>Hex coord:(17;6),Teluk Sepintas. Selangor. Malaysia,1 ,0,0,0,0,0,1,2022-02-16T06:36:11.3162555Z,0
3.7773298,101.083734,Daerah: Sabak Bernam<br>No:77<br>Hex coord:(20;6),Sungai Samak Kechil. Hilir Perak. Malaysia,0,0,0,0,0,0,1,2022-02-16T06:36:11.9809999Z,0
3.7617698,100.894874,Daerah: Sabak Bernam<br>No:78<br>Hex coord:(6;7),Rizab Melayu Sungai Lang. Sobak Bernam. Sabak Bernam. Malaysia,11 ,0,0,0,0,0,1,2022-02-16T06:36:13.6495455Z,0
3.7539898,100.908364,Daerah: Sabak Bernam<br>No:79<br>Hex coord:(7;7),Jalan Ghazali. Sobak Bernam. Selangor. Malaysia,7 ,0,0,0,0,0,1,2022-02-16T06:36:14.3207314Z,0
3.7617698,100.921854,Daerah: Sabak Bernam<br>No:80<br>Hex coord:(8;7),Jalan Kubur. Sobak Bernam. Selangor. Malaysia,3 ,0,0,0,0,0,1,2022-02-16T06:36:14.9805637Z,0
3.7539898,100.935344,Daerah: Sabak Bernam<br>No:81<br>Hex coord:(9;7),Jalan Haji Sadri. Sobak Bernam. Selangor. Malaysia,0,0,0,0,0,0,1,2022-02-16T06:36:15.6561670Z,0
3.7617698,100.948834,Daerah: Sabak Bernam<br>No:82<br>Hex coord:(10;7),Jalan Haji Saion. Bagan Sungai Pulai. 45200. Selangor. Malaysia,1 ,0,0,0,0,0,1,2022-02-16T06:36:16.3295898Z,0
3.7539898,100.962324,Daerah: Sabak Bernam<br>No:83<br>Hex coord:(11;7),Jalan Wan Mood. Sobak Bernam. Selangor. Malaysia,8 ,0,0,0,0,0,1,2022-02-16T06:36:16.9985227Z,0
3.7617698,100.975814,Daerah: Sabak Bernam<br>No:84<br>Hex coord:(12;7),SAM Muhammadiah Pekan Sabak. Jalan Kuala Selangor-Teluk Intan. Sabak Bernam. 45200 Sobak Bernam. Selangor. Malaysia,54 ,0,0,0,0,0,1,2022-02-16T06:36:17.7212971Z,0
3.7539898,100.989304,Daerah: Sabak Bernam<br>No:85<br>Hex coord:(13;7),K&K HARDWARE AND PHONE. Sobak Bernam. Sabak Bernam. Malaysia,20 ,0,0,0,0,0,1,2022-02-16T06:36:18.3970626Z,0
3.7617698,101.002794,Daerah: Sabak Bernam<br>No:86<br>Hex coord:(14;7),Teluk Sepintas. 45200. Selangor. Malaysia,0,0,0,0,0,0,1,2022-02-16T06:36:19.0658870Z,0
3.7539898,101.016284,Daerah: Sabak Bernam<br>No:87<br>Hex coord:(15;7),Parit Alur Raja Hitam Lama. Sobak Bernam. Sabak Bernam. Malaysia,0,0,0,0,0,0,1,2022-02-16T06:36:19.7402943Z,0
3.7617698,101.029774,Daerah: Sabak Bernam<br>No:88<br>Hex coord:(16;7),Teluk Sepintas. Selangor. Malaysia,0,0,0,0,0,0,1,2022-02-16T06:36:20.4104638Z,0
3.7539898,101.043264,Daerah: Sabak Bernam<br>No:89<br>Hex coord:(17;7),Ladang Sungai Bernam. Sobak Bernam. Sabak Bernam. Malaysia,0,0,0,0,0,0,1,2022-02-16T06:36:21.0760280Z,0
3.7617698,101.056754,Daerah: Sabak Bernam<br>No:90<br>Hex coord:(18;7),Ladang Antara. Sobak Bernam. Sabak Bernam. Malaysia,0,0,0,0,0,0,1,2022-02-16T06:36:22.7478422Z,0
3.7539898,101.070244,Daerah: Sabak Bernam<br>No:91<br>Hex coord:(19;7),Teluk Sepintas. Selangor. Malaysia,0,0,0,0,0,0,1,2022-02-16T06:36:23.4757916Z,0
3.7617698,101.083734,Daerah: Sabak Bernam<br>No:92<br>Hex coord:(20;7),Kampung Binjai Patah. Selangor. Malaysia,0,0,0,0,0,0,1,2022-02-16T06:36:24.1356560Z,0
3.7539898,101.097224,Daerah: Sabak Bernam<br>No:93<br>Hex coord:(21;7),Kampung Binjai Patah. Selangor. Malaysia,0,0,0,0,0,0,1,2022-02-16T06:36:24.8087012Z,0
3.7384298,100.908364,Daerah: Sabak Bernam<br>No:94<br>Hex coord:(7;8),Bagan Sungai Pulai. 45200. Selangor. Malaysia,0,0,0,0,0,0,1,2022-02-16T06:36:25.4781041Z,0
3.7462098,100.921854,Daerah: Sabak Bernam<br>No:95<br>Hex coord:(8;8),Parit Banting. Sabak Bernam. Malaysia,1 ,0,0,0,0,0,1,2022-02-16T06:36:26.1375899Z,0
3.7384298,100.935344,Daerah: Sabak Bernam<br>No:96<br>Hex coord:(9;8),Bagan Sungai Pulai. 45200. Selangor. Malaysia,17 ,0,0,0,0,0,1,2022-02-16T06:36:26.8053562Z,0
3.7462098,100.948834,Daerah: Sabak Bernam<br>No:97<br>Hex coord:(10;8),Jalan Haji Siraj. Bagan Sungai Pulai. 45200. Selangor. Malaysia,1 ,0,0,0,0,0,1,2022-02-16T06:36:27.4787718Z,0
3.7384298,100.962324,Daerah: Sabak Bernam<br>No:98<br>Hex coord:(11;8),Jalan Haji Mansur. Panchang Bedena. 45200 Sobak Bernam. Selangor. Malaysia,1 ,0,0,0,0,0,1,2022-02-16T06:36:28.1422140Z,0
3.7462098,100.975814,Daerah: Sabak Bernam<br>No:99<br>Hex coord:(12;8),Surau Ar-Rahmaniah. Jalan Kuala Selangor-Teluk Intan. Parit Enam. 45200 Sobak Bernam. Selangor. Malaysia,3 ,0,0,0,0,0,1,2022-02-16T06:36:28.8891380Z,0
3.7384298,100.989304,Daerah: Sabak Bernam<br>No:100<br>Hex coord:(13;8),Sabak Bernam. 45200 Sabak Bernam. Selangor. Malaysia,0,0,0,0,0,0,1,2022-02-16T06:36:29.5688956Z,0
3.7462098,101.002794,Daerah: Sabak Bernam<br>No:101<br>Hex coord:(14;8),Ladang Torkington. Sobak Bernam. Sabak Bernam. Malaysia,0,0,0,0,0,0,1,2022-02-16T06:36:30.3080026Z,0
3.7384298,101.016284,Daerah: Sabak Bernam<br>No:102<br>Hex coord:(15;8),Parit Enam. Selangor. Malaysia,0,0,0,0,0,0,1,2022-02-16T06:36:31.0160622Z,0
3.7462098,101.029774,Daerah: Sabak Bernam<br>No:103<br>Hex coord:(16;8),Teluk Sepintas. Selangor. Malaysia,1 ,0,0,0,0,0,1,2022-02-16T06:36:31.6934843Z,0
3.7384298,101.043264,Daerah: Sabak Bernam<br>No:104<br>Hex coord:(17;8),Parit Sebelas Barat. Sobak Bernam. Sabak Bernam. Malaysia,0,0,0,0,0,0,1,2022-02-16T06:36:32.4485071Z,0
3.7462098,101.056754,Daerah: Sabak Bernam<br>No:105<br>Hex coord:(18;8),Teluk Sepintas. Selangor. Malaysia,7 ,0,0,0,0,0,1,2022-02-16T06:36:34.1135740Z,0
3.7384298,101.070244,Daerah: Sabak Bernam<br>No:106<br>Hex coord:(19;8),Jalan Tok Khalifah. Kampung Permatang. Selangor. Malaysia,1 ,0,0,0,0,0,1,2022-02-16T06:36:34.7873576Z,0
3.7384298,101.097224,Daerah: Sabak Bernam<br>No:107<br>Hex coord:(21;8),Sungai Panjang. Sobak Bernam. Sabak Bernam. Malaysia,0,0,0,0,0,0,1,2022-02-16T06:36:35.4583271Z,0
3.7462098,101.110714,Daerah: Sabak Bernam<br>No:108<br>Hex coord:(22;8),Sungai Bugis. Hilir Perak. Malaysia,0,0,0,0,0,0,1,2022-02-16T06:36:36.1256546Z,0
3.7384298,101.124204,Daerah: Sabak Bernam<br>No:109<br>Hex coord:(23;8),Kampung Binjai Patah. Selangor. Malaysia,0,0,0,0,0,0,1,2022-02-16T06:36:36.7989500Z,0
3.7462098,101.137694,Daerah: Sabak Bernam<br>No:110<br>Hex coord:(24;8),Sungai Samak. Sabak Bernam. Malaysia,1 ,0,0,0,0,0,1,2022-02-16T06:36:37.5239905Z,0
3.7462098,101.164674,Daerah: Sabak Bernam<br>No:111<br>Hex coord:(26;8),Hospital Ulu Sungai Bernam. Hilir Perak. Malaysia,0,0,0,0,0,0,1,2022-02-16T06:36:38.1950735Z,0
3.7306498,100.921854,Daerah: Sabak Bernam<br>No:112<br>Hex coord:(8;9),SJK(C) Phooi Tee. Bagan Sungai Pulai. Jalan Haji Muhammad. Panchang Bedena. 45200. Selangor. Malaysia,5 ,0,0,0,0,0,1,2022-02-16T06:36:38.8685702Z,0
3.7228698,100.935344,Daerah: Sabak Bernam<br>No:113<br>Hex coord:(9;9),Parit Pulai. Sobak Bernam. Sabak Bernam. Malaysia,4 ,0,0,0,0,0,1,2022-02-16T06:36:39.5286011Z,0
3.7306498,100.948834,Daerah: Sabak Bernam<br>No:114<br>Hex coord:(10;9),Bagan Sungai Pulai. 45200. Selangor. Malaysia,2 ,0,0,0,0,0,1,2022-02-16T06:36:40.1990321Z,0
3.7228698,100.962324,Daerah: Sabak Bernam<br>No:115<br>Hex coord:(11;9),Jalan Jentera. Panchang Bedena. 45200. Selangor. Malaysia,13 ,0,0,0,0,0,1,2022-02-16T06:36:41.3064938Z,0
3.7306498,100.975814,Daerah: Sabak Bernam<br>No:116<br>Hex coord:(12;9),Jalan Kuala Selangor-Teluk Intan. Panchang Bedena. 45200. Selangor. Malaysia,14 ,0,0,0,0,0,1,2022-02-16T06:36:41.9777531Z,0
3.7228698,100.989304,Daerah: Sabak Bernam<br>No:117<br>Hex coord:(13;9),Parit Enam. 45200. Selangor. Malaysia,0,0,0,0,0,0,1,2022-02-16T06:36:42.7001146Z,0
3.7306498,101.002794,Daerah: Sabak Bernam<br>No:118<br>Hex coord:(14;9),Ladang Lim Kooi Hua Sungai Bernam. Sabak Bernam. Malaysia,0,0,0,0,0,0,1,2022-02-16T06:36:43.3604183Z,0
3.7228698,101.016284,Daerah: Sabak Bernam<br>No:119<br>Hex coord:(15;9),Parit Enam. Selangor. Malaysia,0,0,0,0,0,0,1,2022-02-16T06:36:44.0381711Z,0
3.7306498,101.029774,Daerah: Sabak Bernam<br>No:120<br>Hex coord:(16;9),B51. Selangor. Malaysia,2 ,0,0,0,0,0,1,2022-02-16T06:36:44.7041043Z,0
3.7228698,101.043264,Daerah: Sabak Bernam<br>No:121<br>Hex coord:(17;9),Kampung Permatang. Selangor. Malaysia,1 ,0,0,0,0,0,1,2022-02-16T06:36:45.3699501Z,0
3.7306498,101.056754,Daerah: Sabak Bernam<br>No:122<br>Hex coord:(18;9),Kampung Permatang. Selangor. Malaysia,2 ,0,0,0,0,0,1,2022-02-16T06:36:46.0357912Z,0
3.7228698,101.070244,Daerah: Sabak Bernam<br>No:123<br>Hex coord:(19;9),Kampung Permatang. Selangor. Malaysia,8 ,0,0,0,0,0,1,2022-02-16T06:36:46.7117360Z,0
3.7306498,101.083734,Daerah: Sabak Bernam<br>No:124<br>Hex coord:(20;9),B44. Sungai Besar. Selangor. Malaysia,7 ,0,0,0,0,0,1,2022-02-16T06:36:48.3788549Z,0
3.7228698,101.097224,Daerah: Sabak Bernam<br>No:125<br>Hex coord:(21;9),Kampung Binjai Patah. Selangor. Malaysia,0,0,0,0,0,0,1,2022-02-16T06:36:49.0425325Z,0
3.7306498,101.110714,Daerah: Sabak Bernam<br>No:126<br>Hex coord:(22;9),Kampung Binjai Patah. Selangor. Malaysia,1 ,0,0,0,0,0,1,2022-02-16T06:36:49.7105263Z,0
3.7228698,101.124204,Daerah: Sabak Bernam<br>No:127<br>Hex coord:(23;9),Kampung Binjai Patah. Selangor. Malaysia,4 ,0,0,0,0,0,1,2022-02-16T06:36:50.3681769Z,0
3.7306498,101.137694,Daerah: Sabak Bernam<br>No:128<br>Hex coord:(24;9),Sungai Telok. Hulu Bemam. Sabak Bernam. Malaysia,0,0,0,0,0,0,1,2022-02-16T06:36:51.0418760Z,0
3.7228698,101.151184,Daerah: Sabak Bernam<br>No:129<br>Hex coord:(25;9),Kemajuan Tanah Belia Merbau Berdarah. Sabak Bernam. Malaysia,0,0,0,0,0,0,1,2022-02-16T06:36:51.7137763Z,0
3.7306498,101.164674,Daerah: Sabak Bernam<br>No:130<br>Hex coord:(26;9),Rantau Panjang. Hilir Perak. Malaysia,0,0,0,0,0,0,1,2022-02-16T06:36:52.4342905Z,0
3.7228698,101.178164,Daerah: Sabak Bernam<br>No:131<br>Hex coord:(27;9),Ulu Bernam Bahagian Selangor. Sabak Bernam. Malaysia,0,0,0,0,0,0,1,2022-02-16T06:36:53.0979265Z,0
3.7150898,100.921854,Daerah: Sabak Bernam<br>No:132<br>Hex coord:(8;10),Bagan Sungai Pulai. Selangor. Malaysia,0,0,0,0,0,0,1,2022-02-16T06:36:54.7731084Z,0
3.7073098,100.935344,Daerah: Sabak Bernam<br>No:133<br>Hex coord:(9;10),Sabak Bernam. Bagan Sungai Burung. Selangor. Malaysia,0,0,0,0,0,0,1,2022-02-16T06:36:55.4264457Z,0
3.7150898,100.948834,Daerah: Sabak Bernam<br>No:134<br>Hex coord:(10;10),Panchang Bedena. 45300. Selangor. Malaysia,0,0,0,0,0,0,1,2022-02-16T06:36:56.1325945Z,0
3.7073098,100.962324,Daerah: Sabak Bernam<br>No:135<br>Hex coord:(11;10),Jalan Surau Suluk. Sungai Besar. Selangor. Malaysia,21 ,0,0,0,0,0,1,2022-02-16T06:36:56.8034374Z,0
3.7150898,100.975814,Daerah: Sabak Bernam<br>No:136<br>Hex coord:(12;10),Ladang Lingam. Sobak Bernam. Sabak Bernam. Malaysia,4 ,0,0,0,0,0,1,2022-02-16T06:36:57.5075620Z,0
3.7073098,100.989304,Daerah: Sabak Bernam<br>No:137<br>Hex coord:(13;10),Parit Enam. 45300. Selangor. Malaysia,10 ,0,0,0,0,0,1,2022-02-16T06:36:58.1807169Z,0
3.7150898,101.002794,Daerah: Sabak Bernam<br>No:138<br>Hex coord:(14;10),Sekolah Kebangsaan Parit Enam. Sungai Besar. Sabak Bernam. Malaysia,3 ,0,0,0,0,0,1,2022-02-16T06:36:58.8398838Z,0
3.7073098,101.016284,Daerah: Sabak Bernam<br>No:139<br>Hex coord:(15;10),Parit Enam. 45300. Selangor. Malaysia,0,0,0,0,0,0,1,2022-02-16T06:36:59.5038915Z,0
3.7150898,101.029774,Daerah: Sabak Bernam<br>No:140<br>Hex coord:(16;10),Kampung Permatang. Selangor. Malaysia,0,0,0,0,0,0,1,2022-02-16T06:37:00.2585330Z,0
3.7073098,101.043264,Daerah: Sabak Bernam<br>No:141<br>Hex coord:(17;10),Kampung Permatang. Selangor. Malaysia,4 ,0,0,0,0,0,1,2022-02-16T06:37:00.9321956Z,0
3.7150898,101.056754,Daerah: Sabak Bernam<br>No:142<br>Hex coord:(18;10),Jalan Sabak Bernam - Hulu Selangor. Kampung Permatang. Selangor. Malaysia,1 ,0,0,0,0,0,1,2022-02-16T06:37:01.6601617Z,0
3.7073098,101.070244,Daerah: Sabak Bernam<br>No:143<br>Hex coord:(19;10),Kampung Permatang. Selangor. Malaysia,1 ,0,0,0,0,0,1,2022-02-16T06:37:02.3326305Z,0
3.7150898,101.083734,Daerah: Sabak Bernam<br>No:144<br>Hex coord:(20;10),Parit Tiga Belas. Sabak Bernam. Malaysia,1 ,0,0,0,0,0,1,2022-02-16T06:37:03.0999210Z,0
3.7073098,101.097224,Daerah: Sabak Bernam<br>No:145<br>Hex coord:(21;10),Kampung Binjai Patah. Selangor. Malaysia,0,0,0,0,0,0,1,2022-02-16T06:37:03.7669903Z,0
3.7150898,101.110714,Daerah: Sabak Bernam<br>No:146<br>Hex coord:(22;10),Kampung Binjai Patah. Selangor. Malaysia,0,0,0,0,0,0,1,2022-02-16T06:37:04.4308228Z,0
3.7073098,101.124204,Daerah: Sabak Bernam<br>No:147<br>Hex coord:(23;10),Kampung Belia Satu. Selangor. Malaysia,0,0,0,0,0,0,1,2022-02-16T06:37:05.1141022Z,0
3.7150898,101.137694,Daerah: Sabak Bernam<br>No:148<br>Hex coord:(24;10),Kampung Belia Satu. Selangor. Malaysia,6 ,0,0,0,0,0,1,2022-02-16T06:37:05.7843645Z,0
3.7073098,101.151184,Daerah: Sabak Bernam<br>No:149<br>Hex coord:(25;10),Rizab Melayu Sungai Panjang. Sabak Bernam. Malaysia,0,0,0,0,0,0,1,2022-02-16T06:37:06.4540854Z,0
3.7150898,101.164674,Daerah: Sabak Bernam<br>No:150<br>Hex coord:(26;10),Telok Mahang. Sabak Bernam. Malaysia,7 ,0,0,0,0,0,1,2022-02-16T06:37:07.1261958Z,0
3.7073098,101.178164,Daerah: Sabak Bernam<br>No:151<br>Hex coord:(27;10),Tanjung Merbau Berdarah. Sabak Bernam. Malaysia,8 ,0,0,0,0,0,1,2022-02-16T06:37:07.8538331Z,0
3.7150898,101.191654,Daerah: Sabak Bernam<br>No:152<br>Hex coord:(28;10),Kampung Belia Dua. Selangor. Malaysia,2 ,0,0,0,0,0,1,2022-02-16T06:37:08.5255290Z,0
3.7073098,101.205144,Daerah: Sabak Bernam<br>No:153<br>Hex coord:(29;10),Kampung Belia Dua. Selangor. Malaysia,0,0,0,0,0,0,1,2022-02-16T06:37:09.1868481Z,0
3.7073098,101.232124,Daerah: Sabak Bernam<br>No:154<br>Hex coord:(31;10),Sabak Bernam. Selangor. Malaysia,0,0,0,0,0,0,1,2022-02-16T06:37:09.8566206Z,0
3.7150898,101.245614,Daerah: Sabak Bernam<br>No:155<br>Hex coord:(32;10),Sabak Bernam. Selangor. Malaysia,0,0,0,0,0,0,1,2022-02-16T06:37:10.5296848Z,0
3.6917498,100.935344,Daerah: Sabak Bernam<br>No:156<br>Hex coord:(9;11),Panchang Bedena. Selangor. Malaysia,1 ,0,0,0,0,0,1,2022-02-16T06:37:11.2059551Z,0
3.6995298,100.948834,Daerah: Sabak Bernam<br>No:157<br>Hex coord:(10;11),Panchang Bedena. 45300. Selangor. Malaysia,1 ,0,0,0,0,0,1,2022-02-16T06:37:11.8730021Z,0
3.6917498,100.962324,Daerah: Sabak Bernam<br>No:158<br>Hex coord:(11;11),Jalan Haji Muhammad. Taman Cahaya. 45300. Selangor. Malaysia,26 ,0,0,0,0,0,1,2022-02-16T06:37:12.6881804Z,0
