lat,lon,label,placename,weeklyactive,totalactive,weeklyrecovered,totalrecovered,weeklydeaths,totaldeaths,weight,timestamp,reserved
3.8629098,100.935344,Daerah: Sabak Bernam<br>No:1<br>Hex coord:(9;0),Hutan Melintang. Hilir Perak. Malaysia,0,0,0,0,0,0,1,2022-10-26T18:01:15.9584428Z,0
3.8473498,100.827424,Daerah: Sabak Bernam<br>No:2<br>Hex coord:(1;1),Sungai Lang. Sobak Bernam. Sabak Bernam. Malaysia,0,0,0,0,0,0,1,2022-10-26T18:01:16.6910123Z,0
3.8473498,100.854404,Daerah: Sabak Bernam<br>No:3<br>Hex coord:(3;1),Sabak Bernam. 45100. Selangor. Malaysia,0,0,0,0,0,0,1,2022-10-26T18:01:17.4138718Z,0
3.8551298,100.867894,Daerah: Sabak Bernam<br>No:4<br>Hex coord:(4;1),Sabak Bernam. Selangor. Malaysia,0,0,0,0,0,0,1,2022-10-26T18:01:18.1020652Z,0
3.8473498,100.881384,Daerah: Sabak Bernam<br>No:5<br>Hex coord:(5;1),Sabak Bernam. Selangor. Malaysia,2,0,0,0,0,0,1,2022-10-26T18:01:18.7907745Z,0
3.8551298,100.894874,Daerah: Sabak Bernam<br>No:6<br>Hex coord:(6;1),Sabak Bernam. Selangor. Malaysia,1,0,0,0,0,0,1,2022-10-26T18:01:19.4768887Z,0
3.8473498,100.908364,Daerah: Sabak Bernam<br>No:7<br>Hex coord:(7;1),Sabak Bernam. 36400. Selangor. Malaysia,0,0,0,0,0,0,1,2022-10-26T18:01:20.1657832Z,0
3.8551298,100.921854,Daerah: Sabak Bernam<br>No:8<br>Hex coord:(8;1),Ladang Sabak Bernam Bahagian Satu. Sabak Bernam. Malaysia,0,0,0,0,0,0,1,2022-10-26T18:01:21.0922785Z,0
3.8473498,100.935344,Daerah: Sabak Bernam<br>No:9<br>Hex coord:(9;1),Sabak Bernam. 36400. Selangor. Malaysia,0,0,0,0,0,0,1,2022-10-26T18:01:21.7638382Z,0
3.8395698,100.813934,Daerah: Sabak Bernam<br>No:10<br>Hex coord:(0;2),Sungai Telok Belanga Kechil. Sobak Bernam. Sabak Bernam. Malaysia,0,0,0,0,0,0,1,2022-10-26T18:01:22.4521169Z,0
3.8317898,100.827424,Daerah: Sabak Bernam<br>No:11<br>Hex coord:(1;2),Sabak Bernam. 45100. Selangor. Malaysia,0,0,0,0,0,0,1,2022-10-26T18:01:23.1338217Z,0
3.8395698,100.840914,Daerah: Sabak Bernam<br>No:12<br>Hex coord:(2;2),Sabak Bernam. 45100. Selangor. Malaysia,0,0,0,0,0,0,1,2022-10-26T18:01:23.8187509Z,0
3.8317898,100.854404,Daerah: Sabak Bernam<br>No:13<br>Hex coord:(3;2),Sabak Bernam. 45100. Selangor. Malaysia,0,0,0,0,0,0,1,2022-10-26T18:01:24.5006579Z,0
3.8395698,100.867894,Daerah: Sabak Bernam<br>No:14<br>Hex coord:(4;2),Sabak Bernam. 45100. Selangor. Malaysia,0,0,0,0,0,0,1,2022-10-26T18:01:25.1857214Z,0
3.8317898,100.881384,Daerah: Sabak Bernam<br>No:15<br>Hex coord:(5;2),Sabak Bernam. Selangor. Malaysia,0,0,0,0,0,0,1,2022-10-26T18:01:25.9211512Z,0
3.8395698,100.894874,Daerah: Sabak Bernam<br>No:16<br>Hex coord:(6;2),Sabak Bernam. Selangor. Malaysia,1,0,0,0,0,0,1,2022-10-26T18:01:26.5972319Z,0
3.8317898,100.908364,Daerah: Sabak Bernam<br>No:17<br>Hex coord:(7;2),Jalan Haji Abdul Karim. Sobak Bernam. Selangor. Malaysia,0,0,0,0,0,0,1,2022-10-26T18:01:27.2785688Z,0
3.8395698,100.921854,Daerah: Sabak Bernam<br>No:18<br>Hex coord:(8;2),Ladang Sungai Bernam Bahagian Dua. Sabak Bernam. Malaysia,0,0,0,0,0,0,1,2022-10-26T18:01:27.9659823Z,0
3.8317898,100.935344,Daerah: Sabak Bernam<br>No:19<br>Hex coord:(9;2),Sabak Bernam. 36400. Selangor. Malaysia,0,0,0,0,0,0,1,2022-10-26T18:01:28.6278245Z,0
3.8240098,100.813934,Daerah: Sabak Bernam<br>No:20<br>Hex coord:(0;3),Balai Cerap Selangor. 45100 Sobak Bernam. Selangor. Malaysia,0,0,0,0,0,0,1,2022-10-26T18:01:29.3203149Z,0
3.8162298,100.827424,Daerah: Sabak Bernam<br>No:21<br>Hex coord:(1;3),Institut Latihan Dakwah Selangor. 45100 Sobak Bernam. Selangor. Malaysia,1,0,0,0,0,0,1,2022-10-26T18:01:29.9982470Z,0
3.8240098,100.840914,Daerah: Sabak Bernam<br>No:22<br>Hex coord:(2;3),Bagan Beting Kepah. 45100. Selangor. Malaysia,4,0,0,0,0,0,1,2022-10-26T18:01:30.7371004Z,0
3.8162298,100.854404,Daerah: Sabak Bernam<br>No:23<br>Hex coord:(3;3),Sungai Tangar. Sobak Bernam. Sabak Bernam. Malaysia,0,0,0,0,0,0,1,2022-10-26T18:01:31.4154920Z,0
3.8240098,100.867894,Daerah: Sabak Bernam<br>No:24<br>Hex coord:(4;3),Rizab Melayu Sungai Lang. Sobak Bernam. Sabak Bernam. Malaysia,0,0,0,0,0,0,1,2022-10-26T18:01:32.0931480Z,0
3.8162298,100.881384,Daerah: Sabak Bernam<br>No:25<br>Hex coord:(5;3),Sabak Bernam. Selangor. Malaysia,0,0,0,0,0,0,1,2022-10-26T18:01:32.8461302Z,0
3.8240098,100.894874,Daerah: Sabak Bernam<br>No:26<br>Hex coord:(6;3),Bagan Telok Ru. 45100. Selangor. Malaysia,0,0,0,0,0,0,1,2022-10-26T18:01:33.5259602Z,0
3.8162298,100.908364,Daerah: Sabak Bernam<br>No:27<br>Hex coord:(7;3),Jalan Haji Yusof. Sobak Bernam. Selangor. Malaysia,0,0,0,0,0,0,1,2022-10-26T18:01:34.2006523Z,0
3.8240098,100.921854,Daerah: Sabak Bernam<br>No:28<br>Hex coord:(8;3),Jalan Haji Mahfud. Selangor. Malaysia,0,0,0,0,0,0,1,2022-10-26T18:01:34.8802565Z,0
3.8162298,100.935344,Daerah: Sabak Bernam<br>No:29<br>Hex coord:(9;3),Ladang Sabak Berna Bahagian Tiga. Sabak Bernam. Malaysia,0,0,0,0,0,0,1,2022-10-26T18:01:35.6177768Z,0
3.8240098,100.948834,Daerah: Sabak Bernam<br>No:30<br>Hex coord:(10;3),Ladang Sabak Berna Bahagian Tiga. Sabak Bernam. Malaysia,0,0,0,0,0,0,1,2022-10-26T18:01:36.3017742Z,0
3.8162298,100.962324,Daerah: Sabak Bernam<br>No:31<br>Hex coord:(11;3),Sabak Bernam. 45200. Selangor. Malaysia,0,0,0,0,0,0,1,2022-10-26T18:01:36.9903863Z,0
3.8084498,100.813934,Daerah: Sabak Bernam<br>No:32<br>Hex coord:(0;4),SBP Integrasi Sabak Bernam. 45100 Sobak Bernam. Selangor. Malaysia,2,0,0,0,0,0,1,2022-10-26T18:01:37.6758098Z,0
3.8006698,100.827424,Daerah: Sabak Bernam<br>No:33<br>Hex coord:(1;4),Bagan Beting Kepah. 45100. Selangor. Malaysia,0,0,0,0,0,0,1,2022-10-26T18:01:38.3648948Z,0
3.8084498,100.840914,Daerah: Sabak Bernam<br>No:34<br>Hex coord:(2;4),Bagan Telok Ru. 45100. Selangor. Malaysia,5,0,0,0,0,0,1,2022-10-26T18:01:39.0480272Z,0
3.8006698,100.854404,Daerah: Sabak Bernam<br>No:35<br>Hex coord:(3;4),Kemajuan Tanah Parit Baharu. Sobak Bernam. Sabak Bernam. Malaysia,0,0,0,0,0,0,1,2022-10-26T18:01:39.7299508Z,0
3.8084498,100.867894,Daerah: Sabak Bernam<br>No:36<br>Hex coord:(4;4),Bagan Telok Ru. Selangor. Malaysia,0,0,0,0,0,0,1,2022-10-26T18:01:40.4611895Z,0
3.8006698,100.881384,Daerah: Sabak Bernam<br>No:37<br>Hex coord:(5;4),Bagan Telok Ru. Selangor. Malaysia,0,0,0,0,0,0,1,2022-10-26T18:01:41.1482436Z,0
3.8084498,100.894874,Daerah: Sabak Bernam<br>No:38<br>Hex coord:(6;4),Sabak Bernam. Selangor. Malaysia,0,0,0,0,0,0,1,2022-10-26T18:01:41.8327824Z,0
3.8006698,100.908364,Daerah: Sabak Bernam<br>No:39<br>Hex coord:(7;4),Sabak Bernam. Selangor. Malaysia,0,0,0,0,0,0,1,2022-10-26T18:01:42.5310153Z,0
3.8084498,100.921854,Daerah: Sabak Bernam<br>No:40<br>Hex coord:(8;4),Sabak Bernam. 45200. Selangor. Malaysia,0,0,0,0,0,0,1,2022-10-26T18:01:43.2077968Z,0
3.8006698,100.935344,Daerah: Sabak Bernam<br>No:41<br>Hex coord:(9;4),Ladang Sungai Bernam Bahagian Empat. Sabak Bernam. Malaysia,0,0,0,0,0,0,1,2022-10-26T18:01:43.8953058Z,0
3.8084498,100.948834,Daerah: Sabak Bernam<br>No:42<br>Hex coord:(10;4),Sabak Bernam. 36400. Selangor. Malaysia,0,0,0,0,0,0,1,2022-10-26T18:01:44.5857259Z,0
3.8006698,100.962324,Daerah: Sabak Bernam<br>No:43<br>Hex coord:(11;4),Sungai Keli Besar. Hilir Perak. Malaysia,0,0,0,0,0,0,1,2022-10-26T18:01:45.2709991Z,0
3.8084498,100.975814,Daerah: Sabak Bernam<br>No:44<br>Hex coord:(12;4),Tanjung Jawa. Sabak Bernam. Malaysia,0,0,0,0,0,0,1,2022-10-26T18:01:45.9933201Z,0
3.8006698,101.016284,Daerah: Sabak Bernam<br>No:45<br>Hex coord:(15;4),Teluk Sepintas. Selangor. Malaysia,0,0,0,0,0,0,1,2022-10-26T18:01:46.6863601Z,0
3.7928898,100.813934,Daerah: Sabak Bernam<br>No:46<br>Hex coord:(0;5),Sungai Apong. Sobak Bernam. Sabak Bernam. Malaysia,0,0,0,0,0,0,1,2022-10-26T18:01:47.3770900Z,0
3.7851098,100.827424,Daerah: Sabak Bernam<br>No:47<br>Hex coord:(1;5),Bagan Beting Kepah. 45100. Selangor. Malaysia,0,0,0,0,0,0,1,2022-10-26T18:01:48.0800013Z,0
3.7928898,100.840914,Daerah: Sabak Bernam<br>No:48<br>Hex coord:(2;5),Bagan Telok Ru. 45100. Selangor. Malaysia,2,0,0,0,0,0,1,2022-10-26T18:01:48.7809427Z,0
3.7851098,100.854404,Daerah: Sabak Bernam<br>No:49<br>Hex coord:(3;5),Bagan Telok Ru. 45100. Selangor. Malaysia,0,0,0,0,0,0,1,2022-10-26T18:01:49.4701546Z,0
3.7928898,100.867894,Daerah: Sabak Bernam<br>No:50<br>Hex coord:(4;5),Bagan Telok Ru. Selangor. Malaysia,0,0,0,0,0,0,1,2022-10-26T18:01:50.1565381Z,0
3.7851098,100.881384,Daerah: Sabak Bernam<br>No:51<br>Hex coord:(5;5),Bagan Telok Ru. Selangor. Malaysia,0,0,0,0,0,0,1,2022-10-26T18:01:50.9093036Z,0
3.7928898,100.894874,Daerah: Sabak Bernam<br>No:52<br>Hex coord:(6;5),Sabak Bernam. Selangor. Malaysia,0,0,0,0,0,0,1,2022-10-26T18:01:51.5960086Z,0
3.7851098,100.908364,Daerah: Sabak Bernam<br>No:53<br>Hex coord:(7;5),Masjid Al-Islakhiah. 45200. Selangor. Malaysia,0,0,0,0,0,0,1,2022-10-26T18:01:52.2712309Z,0
3.7928898,100.921854,Daerah: Sabak Bernam<br>No:54<br>Hex coord:(8;5),Sabak Bernam. 45200. Selangor. Malaysia,0,0,0,0,0,0,1,2022-10-26T18:01:52.9538743Z,0
3.7851098,100.935344,Daerah: Sabak Bernam<br>No:55<br>Hex coord:(9;5),Sabak Bernam. 45200. Selangor. Malaysia,0,0,0,0,0,0,1,2022-10-26T18:01:53.6479436Z,0
3.7928898,100.948834,Daerah: Sabak Bernam<br>No:56<br>Hex coord:(10;5),SK Kampung Baharu. Jalan Pekan Kampung Baru. Sabak Bernam. 45200. Selangor. Malaysia,0,0,0,0,0,0,1,2022-10-26T18:01:54.4184565Z,0
3.7851098,100.989304,Daerah: Sabak Bernam<br>No:57<br>Hex coord:(13;5),Teluk Sepintas. 45200. Selangor. Malaysia,0,0,0,0,0,0,1,2022-10-26T18:01:55.1179151Z,0
3.7928898,101.002794,Daerah: Sabak Bernam<br>No:58<br>Hex coord:(14;5),Teluk Sepintas. Selangor. Malaysia,0,0,0,0,0,0,1,2022-10-26T18:01:56.0450133Z,0
3.7851098,101.016284,Daerah: Sabak Bernam<br>No:59<br>Hex coord:(15;5),Teluk Sepintas. Selangor. Malaysia,0,0,0,0,0,0,1,2022-10-26T18:01:56.7450915Z,0
3.7928898,101.029774,Daerah: Sabak Bernam<br>No:60<br>Hex coord:(16;5),Teluk Sepintas. Selangor. Malaysia,0,0,0,0,0,0,1,2022-10-26T18:01:57.4373559Z,0
3.7851098,101.043264,Daerah: Sabak Bernam<br>No:61<br>Hex coord:(17;5),Teluk Sepintas. Selangor. Malaysia,0,0,0,0,0,0,1,2022-10-26T18:01:58.1219329Z,0
3.7928898,101.056754,Daerah: Sabak Bernam<br>No:62<br>Hex coord:(18;5),Tanjung Ketom. Hilir Perak. Malaysia,0,0,0,0,0,0,1,2022-10-26T18:01:58.8089232Z,0
3.7773298,100.840914,Daerah: Sabak Bernam<br>No:63<br>Hex coord:(2;6),Kuala Bernam Forest Reserve. Jalan Sungai Ayer Tawar. Bagan Beting Kepah. 45100. Selangor. Malaysia,0,0,0,0,0,0,1,2022-10-26T18:01:59.5069133Z,0
3.7773298,100.867894,Daerah: Sabak Bernam<br>No:64<br>Hex coord:(4;6),Bagan Telok Ru. Selangor. Malaysia,0,0,0,0,0,0,1,2022-10-26T18:02:00.1835128Z,0
3.7695498,100.881384,Daerah: Sabak Bernam<br>No:65<br>Hex coord:(5;6),Sabak Bernam. Selangor. Malaysia,0,0,0,0,0,0,1,2022-10-26T18:02:00.9217708Z,0
3.7773298,100.894874,Daerah: Sabak Bernam<br>No:66<br>Hex coord:(6;6),Sabak Bernam. Selangor. Malaysia,0,0,0,0,0,0,1,2022-10-26T18:02:01.5985077Z,0
3.7695498,100.908364,Daerah: Sabak Bernam<br>No:67<br>Hex coord:(7;6),Jalan Tebuk Jawa. Bagan Sungai Pulai. 45200 Sobak Bernam. Selangor. Malaysia,0,0,0,0,0,0,1,2022-10-26T18:02:02.2810875Z,0
3.7773298,100.921854,Daerah: Sabak Bernam<br>No:68<br>Hex coord:(8;6),Rizab Melayu Raja Hitam. Sabak Bernam. Malaysia,0,0,0,0,0,0,1,2022-10-26T18:02:02.9633537Z,0
3.7695498,100.935344,Daerah: Sabak Bernam<br>No:69<br>Hex coord:(9;6),Bagan Sungai Pulai. 45200. Selangor. Malaysia,0,0,0,0,0,0,1,2022-10-26T18:02:03.6614885Z,0
3.7773298,100.948834,Daerah: Sabak Bernam<br>No:70<br>Hex coord:(10;6),Sabak Bernam. 45200. Selangor. Malaysia,1,0,0,0,0,0,1,2022-10-26T18:02:04.3677494Z,0
3.7695498,100.962324,Daerah: Sabak Bernam<br>No:71<br>Hex coord:(11;6),Jalan Kampung Baru. Sabak Bernam. 45200. Selangor. Malaysia,0,0,0,0,0,0,1,2022-10-26T18:02:05.0567053Z,0
3.7695498,100.989304,Daerah: Sabak Bernam<br>No:72<br>Hex coord:(13;6),Teluk Sepintas. 45200. Selangor. Malaysia,2,0,0,0,0,0,1,2022-10-26T18:02:05.7953828Z,0
3.7773298,101.002794,Daerah: Sabak Bernam<br>No:73<br>Hex coord:(14;6),Rizab Melayu Sabak. Sobak Bernam. Sabak Bernam. Malaysia,0,0,0,0,0,0,1,2022-10-26T18:02:06.4780696Z,0
3.7695498,101.016284,Daerah: Sabak Bernam<br>No:74<br>Hex coord:(15;6),Teluk Sepintas. Selangor. Malaysia,0,0,0,0,0,0,1,2022-10-26T18:02:07.1579571Z,0
3.7773298,101.029774,Daerah: Sabak Bernam<br>No:75<br>Hex coord:(16;6),Sungai Sepintas. Sabak Bernam. Malaysia,0,0,0,0,0,0,1,2022-10-26T18:02:07.8485131Z,0
3.7695498,101.043264,Daerah: Sabak Bernam<br>No:76<br>Hex coord:(17;6),Teluk Sepintas. Selangor. Malaysia,0,0,0,0,0,0,1,2022-10-26T18:02:08.5374015Z,0
3.7773298,101.083734,Daerah: Sabak Bernam<br>No:77<br>Hex coord:(20;6),Sungai Samak Kechil. Hilir Perak. Malaysia,0,0,0,0,0,0,1,2022-10-26T18:02:09.2942517Z,0
3.7617698,100.894874,Daerah: Sabak Bernam<br>No:78<br>Hex coord:(6;7),Rizab Melayu Sungai Lang. Sobak Bernam. Sabak Bernam. Malaysia,0,0,0,0,0,0,1,2022-10-26T18:02:09.9805181Z,0
3.7539898,100.908364,Daerah: Sabak Bernam<br>No:79<br>Hex coord:(7;7),Jalan Ghazali. Sobak Bernam. Selangor. Malaysia,0,0,0,0,0,0,1,2022-10-26T18:02:10.7206739Z,0
3.7617698,100.921854,Daerah: Sabak Bernam<br>No:80<br>Hex coord:(8;7),Jalan Kubur. Sobak Bernam. Selangor. Malaysia,0,0,0,0,0,0,1,2022-10-26T18:02:11.4011126Z,0
3.7539898,100.935344,Daerah: Sabak Bernam<br>No:81<br>Hex coord:(9;7),Jalan Haji Sadri. Sobak Bernam. Selangor. Malaysia,0,0,0,0,0,0,1,2022-10-26T18:02:12.0999146Z,0
3.7617698,100.948834,Daerah: Sabak Bernam<br>No:82<br>Hex coord:(10;7),Jalan Haji Saion. Bagan Sungai Pulai. 45200. Selangor. Malaysia,0,0,0,0,0,0,1,2022-10-26T18:02:12.7977037Z,0
3.7539898,100.962324,Daerah: Sabak Bernam<br>No:83<br>Hex coord:(11;7),Jalan Wan Mood. Sobak Bernam. Selangor. Malaysia,0,0,0,0,0,0,1,2022-10-26T18:02:13.4826680Z,0
3.7617698,100.975814,Daerah: Sabak Bernam<br>No:84<br>Hex coord:(12;7),SAM Muhammadiah Pekan Sabak. Jalan Kuala Selangor-Teluk Intan. Sabak Bernam. 45200 Sobak Bernam. Selangor. Malaysia,4,0,0,0,0,0,1,2022-10-26T18:02:14.1778086Z,0
3.7539898,100.989304,Daerah: Sabak Bernam<br>No:85<br>Hex coord:(13;7),K&K HARDWARE AND PHONE. Sobak Bernam. Sabak Bernam. Malaysia,2,0,0,0,0,0,1,2022-10-26T18:02:14.8695068Z,0
3.7617698,101.002794,Daerah: Sabak Bernam<br>No:86<br>Hex coord:(14;7),Teluk Sepintas. 45200. Selangor. Malaysia,0,0,0,0,0,0,1,2022-10-26T18:02:15.6190158Z,0
3.7539898,101.016284,Daerah: Sabak Bernam<br>No:87<br>Hex coord:(15;7),Parit Alur Raja Hitam Lama. Sobak Bernam. Sabak Bernam. Malaysia,0,0,0,0,0,0,1,2022-10-26T18:02:16.3016716Z,0
3.7617698,101.029774,Daerah: Sabak Bernam<br>No:88<br>Hex coord:(16;7),Teluk Sepintas. Selangor. Malaysia,0,0,0,0,0,0,1,2022-10-26T18:02:16.9828270Z,0
3.7539898,101.043264,Daerah: Sabak Bernam<br>No:89<br>Hex coord:(17;7),Ladang Sungai Bernam. Sobak Bernam. Sabak Bernam. Malaysia,0,0,0,0,0,0,1,2022-10-26T18:02:17.6741800Z,0
3.7617698,101.056754,Daerah: Sabak Bernam<br>No:90<br>Hex coord:(18;7),Ladang Antara. Sobak Bernam. Sabak Bernam. Malaysia,0,0,0,0,0,0,1,2022-10-26T18:02:18.3532783Z,0
3.7539898,101.070244,Daerah: Sabak Bernam<br>No:91<br>Hex coord:(19;7),Teluk Sepintas. Selangor. Malaysia,0,0,0,0,0,0,1,2022-10-26T18:02:19.0487027Z,0
3.7617698,101.083734,Daerah: Sabak Bernam<br>No:92<br>Hex coord:(20;7),Kampung Binjai Patah. Selangor. Malaysia,0,0,0,0,0,0,1,2022-10-26T18:02:19.7434718Z,0
3.7539898,101.097224,Daerah: Sabak Bernam<br>No:93<br>Hex coord:(21;7),Kampung Binjai Patah. Selangor. Malaysia,0,0,0,0,0,0,1,2022-10-26T18:02:20.4742449Z,0
3.7384298,100.908364,Daerah: Sabak Bernam<br>No:94<br>Hex coord:(7;8),Bagan Sungai Pulai. 45200. Selangor. Malaysia,0,0,0,0,0,0,1,2022-10-26T18:02:21.1659504Z,0
3.7462098,100.921854,Daerah: Sabak Bernam<br>No:95<br>Hex coord:(8;8),Parit Banting. Sabak Bernam. Malaysia,0,0,0,0,0,0,1,2022-10-26T18:02:21.8785944Z,0
3.7384298,100.935344,Daerah: Sabak Bernam<br>No:96<br>Hex coord:(9;8),Bagan Sungai Pulai. 45200. Selangor. Malaysia,1,0,0,0,0,0,1,2022-10-26T18:02:22.5647676Z,0
3.7462098,100.948834,Daerah: Sabak Bernam<br>No:97<br>Hex coord:(10;8),Jalan Haji Siraj. Bagan Sungai Pulai. 45200. Selangor. Malaysia,0,0,0,0,0,0,1,2022-10-26T18:02:23.2551765Z,0
3.7384298,100.962324,Daerah: Sabak Bernam<br>No:98<br>Hex coord:(11;8),Jalan Haji Mansur. Panchang Bedena. 45200 Sobak Bernam. Selangor. Malaysia,0,0,0,0,0,0,1,2022-10-26T18:02:23.9331547Z,0
3.7462098,100.975814,Daerah: Sabak Bernam<br>No:99<br>Hex coord:(12;8),Surau Ar-Rahmaniah. Jalan Kuala Selangor-Teluk Intan. Parit Enam. 45200 Sobak Bernam. Selangor. Malaysia,0,0,0,0,0,0,1,2022-10-26T18:02:24.6302653Z,0
3.7384298,100.989304,Daerah: Sabak Bernam<br>No:100<br>Hex coord:(13;8),Sabak Bernam. 45200 Sabak Bernam. Selangor. Malaysia,0,0,0,0,0,0,1,2022-10-26T18:02:25.3908234Z,0
3.7462098,101.002794,Daerah: Sabak Bernam<br>No:101<br>Hex coord:(14;8),Ladang Torkington. Sobak Bernam. Sabak Bernam. Malaysia,0,0,0,0,0,0,1,2022-10-26T18:02:26.0729820Z,0
3.7384298,101.016284,Daerah: Sabak Bernam<br>No:102<br>Hex coord:(15;8),Parit Enam. Selangor. Malaysia,0,0,0,0,0,0,1,2022-10-26T18:02:26.7659923Z,0
3.7462098,101.029774,Daerah: Sabak Bernam<br>No:103<br>Hex coord:(16;8),Teluk Sepintas. Selangor. Malaysia,0,0,0,0,0,0,1,2022-10-26T18:02:27.4461100Z,0
3.7384298,101.043264,Daerah: Sabak Bernam<br>No:104<br>Hex coord:(17;8),Parit Sebelas Barat. Sobak Bernam. Sabak Bernam. Malaysia,0,0,0,0,0,0,1,2022-10-26T18:02:28.1374454Z,0
3.7462098,101.056754,Daerah: Sabak Bernam<br>No:105<br>Hex coord:(18;8),Teluk Sepintas. Selangor. Malaysia,1,0,0,0,0,0,1,2022-10-26T18:02:28.8171566Z,0
3.7384298,101.070244,Daerah: Sabak Bernam<br>No:106<br>Hex coord:(19;8),Jalan Tok Khalifah. Kampung Permatang. Selangor. Malaysia,1,0,0,0,0,0,1,2022-10-26T18:02:29.5081257Z,0
3.7384298,101.097224,Daerah: Sabak Bernam<br>No:107<br>Hex coord:(21;8),Sungai Panjang. Sobak Bernam. Sabak Bernam. Malaysia,0,0,0,0,0,0,1,2022-10-26T18:02:30.1943225Z,0
3.7462098,101.110714,Daerah: Sabak Bernam<br>No:108<br>Hex coord:(22;8),Sungai Bugis. Hilir Perak. Malaysia,0,0,0,0,0,0,1,2022-10-26T18:02:31.0716780Z,0
3.7384298,101.124204,Daerah: Sabak Bernam<br>No:109<br>Hex coord:(23;8),Kampung Binjai Patah. Selangor. Malaysia,1,0,0,0,0,0,1,2022-10-26T18:02:31.7597656Z,0
3.7462098,101.137694,Daerah: Sabak Bernam<br>No:110<br>Hex coord:(24;8),Sungai Samak. Sabak Bernam. Malaysia,0,0,0,0,0,0,1,2022-10-26T18:02:32.4405298Z,0
3.7462098,101.164674,Daerah: Sabak Bernam<br>No:111<br>Hex coord:(26;8),Hospital Ulu Sungai Bernam. Hilir Perak. Malaysia,0,0,0,0,0,0,1,2022-10-26T18:02:33.1299518Z,0
3.7306498,100.921854,Daerah: Sabak Bernam<br>No:112<br>Hex coord:(8;9),SJK(C) Phooi Tee. Bagan Sungai Pulai. Jalan Haji Muhammad. Panchang Bedena. 45200. Selangor. Malaysia,0,0,0,0,0,0,1,2022-10-26T18:02:33.8295287Z,0
3.7228698,100.935344,Daerah: Sabak Bernam<br>No:113<br>Hex coord:(9;9),Parit Pulai. Sobak Bernam. Sabak Bernam. Malaysia,1,0,0,0,0,0,1,2022-10-26T18:02:34.5690246Z,0
3.7306498,100.948834,Daerah: Sabak Bernam<br>No:114<br>Hex coord:(10;9),Bagan Sungai Pulai. 45200. Selangor. Malaysia,0,0,0,0,0,0,1,2022-10-26T18:02:35.2559067Z,0
3.7228698,100.962324,Daerah: Sabak Bernam<br>No:115<br>Hex coord:(11;9),Jalan Jentera. Panchang Bedena. 45200. Selangor. Malaysia,1,0,0,0,0,0,1,2022-10-26T18:02:36.0079892Z,0
3.7306498,100.975814,Daerah: Sabak Bernam<br>No:116<br>Hex coord:(12;9),Jalan Kuala Selangor-Teluk Intan. Panchang Bedena. 45200. Selangor. Malaysia,0,0,0,0,0,0,1,2022-10-26T18:02:36.6950248Z,0
3.7228698,100.989304,Daerah: Sabak Bernam<br>No:117<br>Hex coord:(13;9),Parit Enam. 45200. Selangor. Malaysia,0,0,0,0,0,0,1,2022-10-26T18:02:37.3944122Z,0
3.7306498,101.002794,Daerah: Sabak Bernam<br>No:118<br>Hex coord:(14;9),Ladang Lim Kooi Hua Sungai Bernam. Sabak Bernam. Malaysia,0,0,0,0,0,0,1,2022-10-26T18:02:38.0790952Z,0
3.7228698,101.016284,Daerah: Sabak Bernam<br>No:119<br>Hex coord:(15;9),Parit Enam. Selangor. Malaysia,0,0,0,0,0,0,1,2022-10-26T18:02:38.7621038Z,0
3.7306498,101.029774,Daerah: Sabak Bernam<br>No:120<br>Hex coord:(16;9),B51. Selangor. Malaysia,0,0,0,0,0,0,1,2022-10-26T18:02:39.4496071Z,0
3.7228698,101.043264,Daerah: Sabak Bernam<br>No:121<br>Hex coord:(17;9),Kampung Permatang. Selangor. Malaysia,2,0,0,0,0,0,1,2022-10-26T18:02:40.1740749Z,0
3.7306498,101.056754,Daerah: Sabak Bernam<br>No:122<br>Hex coord:(18;9),Kampung Permatang. Selangor. Malaysia,0,0,0,0,0,0,1,2022-10-26T18:02:40.9185221Z,0
3.7228698,101.070244,Daerah: Sabak Bernam<br>No:123<br>Hex coord:(19;9),Kampung Permatang. Selangor. Malaysia,0,0,0,0,0,0,1,2022-10-26T18:02:41.6129953Z,0
3.7306498,101.083734,Daerah: Sabak Bernam<br>No:124<br>Hex coord:(20;9),B44. Sungai Besar. Selangor. Malaysia,0,0,0,0,0,0,1,2022-10-26T18:02:42.2962498Z,0
3.7228698,101.097224,Daerah: Sabak Bernam<br>No:125<br>Hex coord:(21;9),Kampung Binjai Patah. Selangor. Malaysia,0,0,0,0,0,0,1,2022-10-26T18:02:42.9826066Z,0
3.7306498,101.110714,Daerah: Sabak Bernam<br>No:126<br>Hex coord:(22;9),Kampung Binjai Patah. Selangor. Malaysia,0,0,0,0,0,0,1,2022-10-26T18:02:43.6653516Z,0
3.7228698,101.124204,Daerah: Sabak Bernam<br>No:127<br>Hex coord:(23;9),Kampung Binjai Patah. Selangor. Malaysia,0,0,0,0,0,0,1,2022-10-26T18:02:44.3523660Z,0
3.7306498,101.137694,Daerah: Sabak Bernam<br>No:128<br>Hex coord:(24;9),Sungai Telok. Hulu Bemam. Sabak Bernam. Malaysia,0,0,0,0,0,0,1,2022-10-26T18:02:45.0366121Z,0
3.7228698,101.151184,Daerah: Sabak Bernam<br>No:129<br>Hex coord:(25;9),Kemajuan Tanah Belia Merbau Berdarah. Sabak Bernam. Malaysia,0,0,0,0,0,0,1,2022-10-26T18:02:45.7676527Z,0
3.7306498,101.164674,Daerah: Sabak Bernam<br>No:130<br>Hex coord:(26;9),Rantau Panjang. Hilir Perak. Malaysia,0,0,0,0,0,0,1,2022-10-26T18:02:46.4464034Z,0
3.7228698,101.178164,Daerah: Sabak Bernam<br>No:131<br>Hex coord:(27;9),Ulu Bernam Bahagian Selangor. Sabak Bernam. Malaysia,0,0,0,0,0,0,1,2022-10-26T18:02:47.1195543Z,0
3.7150898,100.921854,Daerah: Sabak Bernam<br>No:132<br>Hex coord:(8;10),Bagan Sungai Pulai. Selangor. Malaysia,0,0,0,0,0,0,1,2022-10-26T18:02:47.8081492Z,0
3.7073098,100.935344,Daerah: Sabak Bernam<br>No:133<br>Hex coord:(9;10),Sabak Bernam. Bagan Sungai Burung. Selangor. Malaysia,0,0,0,0,0,0,1,2022-10-26T18:02:48.5056694Z,0
3.7150898,100.948834,Daerah: Sabak Bernam<br>No:134<br>Hex coord:(10;10),Panchang Bedena. 45300. Selangor. Malaysia,0,0,0,0,0,0,1,2022-10-26T18:02:49.1892243Z,0
3.7073098,100.962324,Daerah: Sabak Bernam<br>No:135<br>Hex coord:(11;10),Jalan Surau Suluk. Sungai Besar. Selangor. Malaysia,0,0,0,0,0,0,1,2022-10-26T18:02:49.8803773Z,0
3.7150898,100.975814,Daerah: Sabak Bernam<br>No:136<br>Hex coord:(12;10),Ladang Lingam. Sobak Bernam. Sabak Bernam. Malaysia,0,0,0,0,0,0,1,2022-10-26T18:02:50.6145018Z,0
3.7073098,100.989304,Daerah: Sabak Bernam<br>No:137<br>Hex coord:(13;10),Parit Enam. 45300. Selangor. Malaysia,0,0,0,0,0,0,1,2022-10-26T18:02:51.3070199Z,0
3.7150898,101.002794,Daerah: Sabak Bernam<br>No:138<br>Hex coord:(14;10),Sekolah Kebangsaan Parit Enam. Sungai Besar. Sabak Bernam. Malaysia,0,0,0,0,0,0,1,2022-10-26T18:02:52.0074672Z,0
3.7073098,101.016284,Daerah: Sabak Bernam<br>No:139<br>Hex coord:(15;10),Parit Enam. 45300. Selangor. Malaysia,0,0,0,0,0,0,1,2022-10-26T18:02:52.6962408Z,0
3.7150898,101.029774,Daerah: Sabak Bernam<br>No:140<br>Hex coord:(16;10),Kampung Permatang. Selangor. Malaysia,0,0,0,0,0,0,1,2022-10-26T18:02:53.3832281Z,0
3.7073098,101.043264,Daerah: Sabak Bernam<br>No:141<br>Hex coord:(17;10),Kampung Permatang. Selangor. Malaysia,0,0,0,0,0,0,1,2022-10-26T18:02:54.0718516Z,0
3.7150898,101.056754,Daerah: Sabak Bernam<br>No:142<br>Hex coord:(18;10),Jalan Sabak Bernam - Hulu Selangor. Kampung Permatang. Selangor. Malaysia,0,0,0,0,0,0,1,2022-10-26T18:02:54.7497884Z,0
3.7073098,101.070244,Daerah: Sabak Bernam<br>No:143<br>Hex coord:(19;10),Kampung Permatang. Selangor. Malaysia,0,0,0,0,0,0,1,2022-10-26T18:02:55.5106588Z,0
3.7150898,101.083734,Daerah: Sabak Bernam<br>No:144<br>Hex coord:(20;10),Parit Tiga Belas. Sabak Bernam. Malaysia,1,0,0,0,0,0,1,2022-10-26T18:02:56.1916153Z,0
3.7073098,101.097224,Daerah: Sabak Bernam<br>No:145<br>Hex coord:(21;10),Kampung Binjai Patah. Selangor. Malaysia,0,0,0,0,0,0,1,2022-10-26T18:02:56.8731750Z,0
3.7150898,101.110714,Daerah: Sabak Bernam<br>No:146<br>Hex coord:(22;10),Kampung Binjai Patah. Selangor. Malaysia,0,0,0,0,0,0,1,2022-10-26T18:02:57.5505688Z,0
3.7073098,101.124204,Daerah: Sabak Bernam<br>No:147<br>Hex coord:(23;10),Kampung Belia Satu. Selangor. Malaysia,0,0,0,0,0,0,1,2022-10-26T18:02:58.2142264Z,0
3.7150898,101.137694,Daerah: Sabak Bernam<br>No:148<br>Hex coord:(24;10),Kampung Belia Satu. Selangor. Malaysia,1,0,0,0,0,0,1,2022-10-26T18:02:58.8962490Z,0
3.7073098,101.151184,Daerah: Sabak Bernam<br>No:149<br>Hex coord:(25;10),Rizab Melayu Sungai Panjang. Sabak Bernam. Malaysia,0,0,0,0,0,0,1,2022-10-26T18:02:59.5717472Z,0
3.7150898,101.164674,Daerah: Sabak Bernam<br>No:150<br>Hex coord:(26;10),Telok Mahang. Sabak Bernam. Malaysia,0,0,0,0,0,0,1,2022-10-26T18:03:00.2625957Z,0
3.7073098,101.178164,Daerah: Sabak Bernam<br>No:151<br>Hex coord:(27;10),Tanjung Merbau Berdarah. Sabak Bernam. Malaysia,0,0,0,0,0,0,1,2022-10-26T18:03:00.9962305Z,0
3.7150898,101.191654,Daerah: Sabak Bernam<br>No:152<br>Hex coord:(28;10),Kampung Belia Dua. Selangor. Malaysia,0,0,0,0,0,0,1,2022-10-26T18:03:01.6837135Z,0
3.7073098,101.205144,Daerah: Sabak Bernam<br>No:153<br>Hex coord:(29;10),Kampung Belia Dua. Selangor. Malaysia,0,0,0,0,0,0,1,2022-10-26T18:03:02.3624773Z,0
3.7073098,101.232124,Daerah: Sabak Bernam<br>No:154<br>Hex coord:(31;10),Sabak Bernam. Selangor. Malaysia,0,0,0,0,0,0,1,2022-10-26T18:03:03.0415634Z,0
3.7150898,101.245614,Daerah: Sabak Bernam<br>No:155<br>Hex coord:(32;10),Sabak Bernam. Selangor. Malaysia,0,0,0,0,0,0,1,2022-10-26T18:03:03.7158163Z,0
3.6917498,100.935344,Daerah: Sabak Bernam<br>No:156<br>Hex coord:(9;11),Panchang Bedena. Selangor. Malaysia,0,0,0,0,0,0,1,2022-10-26T18:03:04.4701270Z,0
3.6995298,100.948834,Daerah: Sabak Bernam<br>No:157<br>Hex coord:(10;11),Panchang Bedena. 45300. Selangor. Malaysia,2,0,0,0,0,0,1,2022-10-26T18:03:05.1647636Z,0
3.6917498,100.962324,Daerah: Sabak Bernam<br>No:158<br>Hex coord:(11;11),Jalan Haji Muhammad. Taman Cahaya. 45300. Selangor. Malaysia,0,0,0,0,0,0,1,2022-10-26T18:03:05.9319419Z,0
