lat,lon,label,placename,weeklyactive,totalactive,weeklyrecovered,totalrecovered,weeklydeaths,totaldeaths,weight,timestamp,reserved
3.8629098,100.935344,Daerah: Sabak Bernam<br>No:1<br>Hex coord:(9;0),Hutan Melintang. Hilir Perak. Malaysia,0,0,0,0,0,0,1,2022-04-27T02:30:14.7623906Z,0
3.8473498,100.827424,Daerah: Sabak Bernam<br>No:2<br>Hex coord:(1;1),Sungai Lang. Sobak Bernam. Sabak Bernam. Malaysia,0,0,0,0,0,0,1,2022-04-27T02:30:16.6729558Z,0
3.8473498,100.854404,Daerah: Sabak Bernam<br>No:3<br>Hex coord:(3;1),Sabak Bernam. 45100. Selangor. Malaysia,0,0,0,0,0,0,1,2022-04-27T02:30:18.5303762Z,0
3.8551298,100.867894,Daerah: Sabak Bernam<br>No:4<br>Hex coord:(4;1),Sabak Bernam. Selangor. Malaysia,0,0,0,0,0,0,1,2022-04-27T02:30:20.4208572Z,0
3.8473498,100.881384,Daerah: Sabak Bernam<br>No:5<br>Hex coord:(5;1),Sabak Bernam. Selangor. Malaysia,0,0,0,0,0,0,1,2022-04-27T02:30:22.2909698Z,0
3.8551298,100.894874,Daerah: Sabak Bernam<br>No:6<br>Hex coord:(6;1),Sabak Bernam. Selangor. Malaysia,1 ,0,0,0,0,0,1,2022-04-27T02:30:23.4090640Z,0
3.8473498,100.908364,Daerah: Sabak Bernam<br>No:7<br>Hex coord:(7;1),Sabak Bernam. 36400. Selangor. Malaysia,0,0,0,0,0,0,1,2022-04-27T02:30:24.5520754Z,0
3.8551298,100.921854,Daerah: Sabak Bernam<br>No:8<br>Hex coord:(8;1),Ladang Sabak Bernam Bahagian Satu. Sabak Bernam. Malaysia,0,0,0,0,0,0,1,2022-04-27T02:30:25.6776806Z,0
3.8473498,100.935344,Daerah: Sabak Bernam<br>No:9<br>Hex coord:(9;1),Sabak Bernam. 36400. Selangor. Malaysia,0,0,0,0,0,0,1,2022-04-27T02:30:27.5388788Z,0
3.8395698,100.813934,Daerah: Sabak Bernam<br>No:10<br>Hex coord:(0;2),Sungai Telok Belanga Kechil. Sobak Bernam. Sabak Bernam. Malaysia,0,0,0,0,0,0,1,2022-04-27T02:30:29.3062010Z,0
3.8317898,100.827424,Daerah: Sabak Bernam<br>No:11<br>Hex coord:(1;2),Sabak Bernam. 45100. Selangor. Malaysia,0,0,0,0,0,0,1,2022-04-27T02:30:30.4691161Z,0
3.8395698,100.840914,Daerah: Sabak Bernam<br>No:12<br>Hex coord:(2;2),Sabak Bernam. 45100. Selangor. Malaysia,0,0,0,0,0,0,1,2022-04-27T02:30:32.2087629Z,0
3.8317898,100.854404,Daerah: Sabak Bernam<br>No:13<br>Hex coord:(3;2),Sabak Bernam. 45100. Selangor. Malaysia,1 ,0,0,0,0,0,1,2022-04-27T02:30:34.0226175Z,0
3.8395698,100.867894,Daerah: Sabak Bernam<br>No:14<br>Hex coord:(4;2),Sabak Bernam. 45100. Selangor. Malaysia,0,0,0,0,0,0,1,2022-04-27T02:30:36.8599257Z,0
3.8317898,100.881384,Daerah: Sabak Bernam<br>No:15<br>Hex coord:(5;2),Sabak Bernam. Selangor. Malaysia,0,0,0,0,0,0,1,2022-04-27T02:30:38.6255161Z,0
3.8395698,100.894874,Daerah: Sabak Bernam<br>No:16<br>Hex coord:(6;2),Sabak Bernam. Selangor. Malaysia,0,0,0,0,0,0,1,2022-04-27T02:30:39.7641988Z,0
3.8317898,100.908364,Daerah: Sabak Bernam<br>No:17<br>Hex coord:(7;2),Jalan Haji Abdul Karim. Sobak Bernam. Selangor. Malaysia,0,0,0,0,0,0,1,2022-04-27T02:30:40.9036040Z,0
3.8395698,100.921854,Daerah: Sabak Bernam<br>No:18<br>Hex coord:(8;2),Ladang Sungai Bernam Bahagian Dua. Sabak Bernam. Malaysia,0,0,0,0,0,0,1,2022-04-27T02:30:42.6501904Z,0
3.8317898,100.935344,Daerah: Sabak Bernam<br>No:19<br>Hex coord:(9;2),Sabak Bernam. 36400. Selangor. Malaysia,0,0,0,0,0,0,1,2022-04-27T02:30:44.3552298Z,0
3.8240098,100.813934,Daerah: Sabak Bernam<br>No:20<br>Hex coord:(0;3),Balai Cerap Selangor. 45100 Sobak Bernam. Selangor. Malaysia,0,0,0,0,0,0,1,2022-04-27T02:30:45.5105123Z,0
3.8162298,100.827424,Daerah: Sabak Bernam<br>No:21<br>Hex coord:(1;3),Institut Latihan Dakwah Selangor. 45100 Sobak Bernam. Selangor. Malaysia,1 ,0,0,0,0,0,1,2022-04-27T02:30:47.3208832Z,0
3.8240098,100.840914,Daerah: Sabak Bernam<br>No:22<br>Hex coord:(2;3),Bagan Beting Kepah. 45100. Selangor. Malaysia,1 ,0,0,0,0,0,1,2022-04-27T02:30:48.4525030Z,0
3.8162298,100.854404,Daerah: Sabak Bernam<br>No:23<br>Hex coord:(3;3),Sungai Tangar. Sobak Bernam. Sabak Bernam. Malaysia,0,0,0,0,0,0,1,2022-04-27T02:30:50.2654158Z,0
3.8240098,100.867894,Daerah: Sabak Bernam<br>No:24<br>Hex coord:(4;3),Rizab Melayu Sungai Lang. Sobak Bernam. Sabak Bernam. Malaysia,0,0,0,0,0,0,1,2022-04-27T02:30:51.4345342Z,0
3.8162298,100.881384,Daerah: Sabak Bernam<br>No:25<br>Hex coord:(5;3),Sabak Bernam. Selangor. Malaysia,0,0,0,0,0,0,1,2022-04-27T02:30:53.1863457Z,0
3.8240098,100.894874,Daerah: Sabak Bernam<br>No:26<br>Hex coord:(6;3),Bagan Telok Ru. 45100. Selangor. Malaysia,1 ,0,0,0,0,0,1,2022-04-27T02:30:54.9201313Z,0
3.8162298,100.908364,Daerah: Sabak Bernam<br>No:27<br>Hex coord:(7;3),Jalan Haji Yusof. Sobak Bernam. Selangor. Malaysia,0,0,0,0,0,0,1,2022-04-27T02:30:56.0946835Z,0
3.8240098,100.921854,Daerah: Sabak Bernam<br>No:28<br>Hex coord:(8;3),Jalan Haji Mahfud. Selangor. Malaysia,0,0,0,0,0,0,1,2022-04-27T02:30:57.8423695Z,0
3.8162298,100.935344,Daerah: Sabak Bernam<br>No:29<br>Hex coord:(9;3),Ladang Sabak Berna Bahagian Tiga. Sabak Bernam. Malaysia,0,0,0,0,0,0,1,2022-04-27T02:30:59.8640231Z,0
3.8240098,100.948834,Daerah: Sabak Bernam<br>No:30<br>Hex coord:(10;3),Ladang Sabak Berna Bahagian Tiga. Sabak Bernam. Malaysia,0,0,0,0,0,0,1,2022-04-27T02:31:01.4638933Z,0
3.8162298,100.962324,Daerah: Sabak Bernam<br>No:31<br>Hex coord:(11;3),Sabak Bernam. 45200. Selangor. Malaysia,0,0,0,0,0,0,1,2022-04-27T02:31:03.2688961Z,0
3.8084498,100.813934,Daerah: Sabak Bernam<br>No:32<br>Hex coord:(0;4),SBP Integrasi Sabak Bernam. 45100 Sobak Bernam. Selangor. Malaysia,6 ,0,0,0,0,0,1,2022-04-27T02:31:04.4550804Z,0
3.8006698,100.827424,Daerah: Sabak Bernam<br>No:33<br>Hex coord:(1;4),Bagan Beting Kepah. 45100. Selangor. Malaysia,1 ,0,0,0,0,0,1,2022-04-27T02:31:06.2461345Z,0
3.8084498,100.840914,Daerah: Sabak Bernam<br>No:34<br>Hex coord:(2;4),Bagan Telok Ru. 45100. Selangor. Malaysia,0,0,0,0,0,0,1,2022-04-27T02:31:08.0028194Z,0
3.8006698,100.854404,Daerah: Sabak Bernam<br>No:35<br>Hex coord:(3;4),Kemajuan Tanah Parit Baharu. Sobak Bernam. Sabak Bernam. Malaysia,0,0,0,0,0,0,1,2022-04-27T02:31:10.0379052Z,0
3.8084498,100.867894,Daerah: Sabak Bernam<br>No:36<br>Hex coord:(4;4),Bagan Telok Ru. Selangor. Malaysia,0,0,0,0,0,0,1,2022-04-27T02:31:11.8806019Z,0
3.8006698,100.881384,Daerah: Sabak Bernam<br>No:37<br>Hex coord:(5;4),Bagan Telok Ru. Selangor. Malaysia,0,0,0,0,0,0,1,2022-04-27T02:31:13.4011263Z,0
3.8084498,100.894874,Daerah: Sabak Bernam<br>No:38<br>Hex coord:(6;4),Sabak Bernam. Selangor. Malaysia,1 ,0,0,0,0,0,1,2022-04-27T02:31:15.8461592Z,0
3.8006698,100.908364,Daerah: Sabak Bernam<br>No:39<br>Hex coord:(7;4),Sabak Bernam. Selangor. Malaysia,0,0,0,0,0,0,1,2022-04-27T02:31:17.5998960Z,0
3.8084498,100.921854,Daerah: Sabak Bernam<br>No:40<br>Hex coord:(8;4),Sabak Bernam. 45200. Selangor. Malaysia,0,0,0,0,0,0,1,2022-04-27T02:31:19.8141679Z,0
3.8006698,100.935344,Daerah: Sabak Bernam<br>No:41<br>Hex coord:(9;4),Ladang Sungai Bernam Bahagian Empat. Sabak Bernam. Malaysia,0,0,0,0,0,0,1,2022-04-27T02:31:22.2458315Z,0
3.8084498,100.948834,Daerah: Sabak Bernam<br>No:42<br>Hex coord:(10;4),Sabak Bernam. 36400. Selangor. Malaysia,0,0,0,0,0,0,1,2022-04-27T02:31:24.3921456Z,0
3.8006698,100.962324,Daerah: Sabak Bernam<br>No:43<br>Hex coord:(11;4),Sungai Keli Besar. Hilir Perak. Malaysia,0,0,0,0,0,0,1,2022-04-27T02:31:26.0113135Z,0
3.8084498,100.975814,Daerah: Sabak Bernam<br>No:44<br>Hex coord:(12;4),Tanjung Jawa. Sabak Bernam. Malaysia,0,0,0,0,0,0,1,2022-04-27T02:31:27.5355651Z,0
3.8006698,101.016284,Daerah: Sabak Bernam<br>No:45<br>Hex coord:(15;4),Teluk Sepintas. Selangor. Malaysia,0,0,0,0,0,0,1,2022-04-27T02:31:29.6518990Z,0
3.7928898,100.813934,Daerah: Sabak Bernam<br>No:46<br>Hex coord:(0;5),Sungai Apong. Sobak Bernam. Sabak Bernam. Malaysia,0,0,0,0,0,0,1,2022-04-27T02:31:31.2665322Z,0
3.7851098,100.827424,Daerah: Sabak Bernam<br>No:47<br>Hex coord:(1;5),Bagan Beting Kepah. 45100. Selangor. Malaysia,1 ,0,0,0,0,0,1,2022-04-27T02:31:32.8797360Z,0
3.7928898,100.840914,Daerah: Sabak Bernam<br>No:48<br>Hex coord:(2;5),Bagan Telok Ru. 45100. Selangor. Malaysia,0,0,0,0,0,0,1,2022-04-27T02:31:34.5192960Z,0
3.7851098,100.854404,Daerah: Sabak Bernam<br>No:49<br>Hex coord:(3;5),Bagan Telok Ru. 45100. Selangor. Malaysia,1 ,0,0,0,0,0,1,2022-04-27T02:31:36.5596978Z,0
3.7928898,100.867894,Daerah: Sabak Bernam<br>No:50<br>Hex coord:(4;5),Bagan Telok Ru. Selangor. Malaysia,0,0,0,0,0,0,1,2022-04-27T02:31:37.8316832Z,0
3.7851098,100.881384,Daerah: Sabak Bernam<br>No:51<br>Hex coord:(5;5),Bagan Telok Ru. Selangor. Malaysia,0,0,0,0,0,0,1,2022-04-27T02:31:39.1033848Z,0
3.7928898,100.894874,Daerah: Sabak Bernam<br>No:52<br>Hex coord:(6;5),Sabak Bernam. Selangor. Malaysia,0,0,0,0,0,0,1,2022-04-27T02:31:40.2334672Z,0
3.7851098,100.908364,Daerah: Sabak Bernam<br>No:53<br>Hex coord:(7;5),Masjid Al-Islakhiah. 45200. Selangor. Malaysia,0,0,0,0,0,0,1,2022-04-27T02:31:41.9854657Z,0
3.7928898,100.921854,Daerah: Sabak Bernam<br>No:54<br>Hex coord:(8;5),Sabak Bernam. 45200. Selangor. Malaysia,1 ,0,0,0,0,0,1,2022-04-27T02:31:43.1140347Z,0
3.7851098,100.935344,Daerah: Sabak Bernam<br>No:55<br>Hex coord:(9;5),Sabak Bernam. 45200. Selangor. Malaysia,2 ,0,0,0,0,0,1,2022-04-27T02:31:44.8915840Z,0
3.7928898,100.948834,Daerah: Sabak Bernam<br>No:56<br>Hex coord:(10;5),SK Kampung Baharu. Jalan Pekan Kampung Baru. Sabak Bernam. 45200. Selangor. Malaysia,0,0,0,0,0,0,1,2022-04-27T02:31:46.6432414Z,0
3.7851098,100.989304,Daerah: Sabak Bernam<br>No:57<br>Hex coord:(13;5),Teluk Sepintas. 45200. Selangor. Malaysia,0,0,0,0,0,0,1,2022-04-27T02:31:48.3876513Z,0
3.7928898,101.002794,Daerah: Sabak Bernam<br>No:58<br>Hex coord:(14;5),Teluk Sepintas. Selangor. Malaysia,1 ,0,0,0,0,0,1,2022-04-27T02:31:50.1174436Z,0
3.7851098,101.016284,Daerah: Sabak Bernam<br>No:59<br>Hex coord:(15;5),Teluk Sepintas. Selangor. Malaysia,1 ,0,0,0,0,0,1,2022-04-27T02:31:51.9922553Z,0
3.7928898,101.029774,Daerah: Sabak Bernam<br>No:60<br>Hex coord:(16;5),Teluk Sepintas. Selangor. Malaysia,1 ,0,0,0,0,0,1,2022-04-27T02:31:53.7465069Z,0
3.7851098,101.043264,Daerah: Sabak Bernam<br>No:61<br>Hex coord:(17;5),Teluk Sepintas. Selangor. Malaysia,1 ,0,0,0,0,0,1,2022-04-27T02:31:54.8848434Z,0
3.7928898,101.056754,Daerah: Sabak Bernam<br>No:62<br>Hex coord:(18;5),Tanjung Ketom. Hilir Perak. Malaysia,0,0,0,0,0,0,1,2022-04-27T02:31:56.6074625Z,0
3.7773298,100.840914,Daerah: Sabak Bernam<br>No:63<br>Hex coord:(2;6),Kuala Bernam Forest Reserve. Jalan Sungai Ayer Tawar. Bagan Beting Kepah. 45100. Selangor. Malaysia,0,0,0,0,0,0,1,2022-04-27T02:31:58.3330444Z,0
3.7773298,100.867894,Daerah: Sabak Bernam<br>No:64<br>Hex coord:(4;6),Bagan Telok Ru. Selangor. Malaysia,0,0,0,0,0,0,1,2022-04-27T02:31:59.4583496Z,0
3.7695498,100.881384,Daerah: Sabak Bernam<br>No:65<br>Hex coord:(5;6),Sabak Bernam. Selangor. Malaysia,0,0,0,0,0,0,1,2022-04-27T02:32:01.1995985Z,0
3.7773298,100.894874,Daerah: Sabak Bernam<br>No:66<br>Hex coord:(6;6),Sabak Bernam. Selangor. Malaysia,0,0,0,0,0,0,1,2022-04-27T02:32:03.0681898Z,0
3.7695498,100.908364,Daerah: Sabak Bernam<br>No:67<br>Hex coord:(7;6),Jalan Tebuk Jawa. Bagan Sungai Pulai. 45200 Sobak Bernam. Selangor. Malaysia,1 ,0,0,0,0,0,1,2022-04-27T02:32:04.1855659Z,0
3.7773298,100.921854,Daerah: Sabak Bernam<br>No:68<br>Hex coord:(8;6),Rizab Melayu Raja Hitam. Sabak Bernam. Malaysia,0,0,0,0,0,0,1,2022-04-27T02:32:05.8990659Z,0
3.7695498,100.935344,Daerah: Sabak Bernam<br>No:69<br>Hex coord:(9;6),Bagan Sungai Pulai. 45200. Selangor. Malaysia,0,0,0,0,0,0,1,2022-04-27T02:32:07.6493887Z,0
3.7773298,100.948834,Daerah: Sabak Bernam<br>No:70<br>Hex coord:(10;6),Sabak Bernam. 45200. Selangor. Malaysia,0,0,0,0,0,0,1,2022-04-27T02:32:08.8951399Z,0
3.7695498,100.962324,Daerah: Sabak Bernam<br>No:71<br>Hex coord:(11;6),Jalan Kampung Baru. Sabak Bernam. 45200. Selangor. Malaysia,0,0,0,0,0,0,1,2022-04-27T02:32:10.6309173Z,0
3.7695498,100.989304,Daerah: Sabak Bernam<br>No:72<br>Hex coord:(13;6),Teluk Sepintas. 45200. Selangor. Malaysia,7 ,0,0,0,0,0,1,2022-04-27T02:32:12.5060812Z,0
3.7773298,101.002794,Daerah: Sabak Bernam<br>No:73<br>Hex coord:(14;6),Rizab Melayu Sabak. Sobak Bernam. Sabak Bernam. Malaysia,1 ,0,0,0,0,0,1,2022-04-27T02:32:14.3593144Z,0
3.7695498,101.016284,Daerah: Sabak Bernam<br>No:74<br>Hex coord:(15;6),Teluk Sepintas. Selangor. Malaysia,0,0,0,0,0,0,1,2022-04-27T02:32:16.1033166Z,0
3.7773298,101.029774,Daerah: Sabak Bernam<br>No:75<br>Hex coord:(16;6),Sungai Sepintas. Sabak Bernam. Malaysia,3 ,0,0,0,0,0,1,2022-04-27T02:32:17.2302580Z,0
3.7695498,101.043264,Daerah: Sabak Bernam<br>No:76<br>Hex coord:(17;6),Teluk Sepintas. Selangor. Malaysia,0,0,0,0,0,0,1,2022-04-27T02:32:18.9633385Z,0
3.7773298,101.083734,Daerah: Sabak Bernam<br>No:77<br>Hex coord:(20;6),Sungai Samak Kechil. Hilir Perak. Malaysia,0,0,0,0,0,0,1,2022-04-27T02:32:20.6826117Z,0
3.7617698,100.894874,Daerah: Sabak Bernam<br>No:78<br>Hex coord:(6;7),Rizab Melayu Sungai Lang. Sobak Bernam. Sabak Bernam. Malaysia,0,0,0,0,0,0,1,2022-04-27T02:32:23.4150149Z,0
3.7539898,100.908364,Daerah: Sabak Bernam<br>No:79<br>Hex coord:(7;7),Jalan Ghazali. Sobak Bernam. Selangor. Malaysia,1 ,0,0,0,0,0,1,2022-04-27T02:32:24.5346853Z,0
3.7617698,100.921854,Daerah: Sabak Bernam<br>No:80<br>Hex coord:(8;7),Jalan Kubur. Sobak Bernam. Selangor. Malaysia,2 ,0,0,0,0,0,1,2022-04-27T02:32:25.6604972Z,0
3.7539898,100.935344,Daerah: Sabak Bernam<br>No:81<br>Hex coord:(9;7),Jalan Haji Sadri. Sobak Bernam. Selangor. Malaysia,0,0,0,0,0,0,1,2022-04-27T02:32:27.4060770Z,0
3.7617698,100.948834,Daerah: Sabak Bernam<br>No:82<br>Hex coord:(10;7),Jalan Haji Saion. Bagan Sungai Pulai. 45200. Selangor. Malaysia,0,0,0,0,0,0,1,2022-04-27T02:32:28.5404792Z,0
3.7539898,100.962324,Daerah: Sabak Bernam<br>No:83<br>Hex coord:(11;7),Jalan Wan Mood. Sobak Bernam. Selangor. Malaysia,0,0,0,0,0,0,1,2022-04-27T02:32:29.6661765Z,0
3.7617698,100.975814,Daerah: Sabak Bernam<br>No:84<br>Hex coord:(12;7),SAM Muhammadiah Pekan Sabak. Jalan Kuala Selangor-Teluk Intan. Sabak Bernam. 45200 Sobak Bernam. Selangor. Malaysia,4 ,0,0,0,0,0,1,2022-04-27T02:32:31.4126164Z,0
3.7539898,100.989304,Daerah: Sabak Bernam<br>No:85<br>Hex coord:(13;7),K&K HARDWARE AND PHONE. Sobak Bernam. Sabak Bernam. Malaysia,7 ,0,0,0,0,0,1,2022-04-27T02:32:33.1670471Z,0
3.7617698,101.002794,Daerah: Sabak Bernam<br>No:86<br>Hex coord:(14;7),Teluk Sepintas. 45200. Selangor. Malaysia,0,0,0,0,0,0,1,2022-04-27T02:32:34.9047459Z,0
3.7539898,101.016284,Daerah: Sabak Bernam<br>No:87<br>Hex coord:(15;7),Parit Alur Raja Hitam Lama. Sobak Bernam. Sabak Bernam. Malaysia,0,0,0,0,0,0,1,2022-04-27T02:32:36.6597907Z,0
3.7617698,101.029774,Daerah: Sabak Bernam<br>No:88<br>Hex coord:(16;7),Teluk Sepintas. Selangor. Malaysia,0,0,0,0,0,0,1,2022-04-27T02:32:38.4133113Z,0
3.7539898,101.043264,Daerah: Sabak Bernam<br>No:89<br>Hex coord:(17;7),Ladang Sungai Bernam. Sobak Bernam. Sabak Bernam. Malaysia,3 ,0,0,0,0,0,1,2022-04-27T02:32:39.5308809Z,0
3.7617698,101.056754,Daerah: Sabak Bernam<br>No:90<br>Hex coord:(18;7),Ladang Antara. Sobak Bernam. Sabak Bernam. Malaysia,0,0,0,0,0,0,1,2022-04-27T02:32:41.2837403Z,0
3.7539898,101.070244,Daerah: Sabak Bernam<br>No:91<br>Hex coord:(19;7),Teluk Sepintas. Selangor. Malaysia,1 ,0,0,0,0,0,1,2022-04-27T02:32:43.0215859Z,0
3.7617698,101.083734,Daerah: Sabak Bernam<br>No:92<br>Hex coord:(20;7),Kampung Binjai Patah. Selangor. Malaysia,0,0,0,0,0,0,1,2022-04-27T02:32:44.1612550Z,0
3.7539898,101.097224,Daerah: Sabak Bernam<br>No:93<br>Hex coord:(21;7),Kampung Binjai Patah. Selangor. Malaysia,0,0,0,0,0,0,1,2022-04-27T02:32:45.3968702Z,0
3.7384298,100.908364,Daerah: Sabak Bernam<br>No:94<br>Hex coord:(7;8),Bagan Sungai Pulai. 45200. Selangor. Malaysia,0,0,0,0,0,0,1,2022-04-27T02:32:47.2828486Z,0
3.7462098,100.921854,Daerah: Sabak Bernam<br>No:95<br>Hex coord:(8;8),Parit Banting. Sabak Bernam. Malaysia,0,0,0,0,0,0,1,2022-04-27T02:32:48.5226800Z,0
3.7384298,100.935344,Daerah: Sabak Bernam<br>No:96<br>Hex coord:(9;8),Bagan Sungai Pulai. 45200. Selangor. Malaysia,3 ,0,0,0,0,0,1,2022-04-27T02:32:50.2569912Z,0
3.7462098,100.948834,Daerah: Sabak Bernam<br>No:97<br>Hex coord:(10;8),Jalan Haji Siraj. Bagan Sungai Pulai. 45200. Selangor. Malaysia,1 ,0,0,0,0,0,1,2022-04-27T02:32:52.1356124Z,0
3.7384298,100.962324,Daerah: Sabak Bernam<br>No:98<br>Hex coord:(11;8),Jalan Haji Mansur. Panchang Bedena. 45200 Sobak Bernam. Selangor. Malaysia,1 ,0,0,0,0,0,1,2022-04-27T02:32:54.0129417Z,0
3.7462098,100.975814,Daerah: Sabak Bernam<br>No:99<br>Hex coord:(12;8),Surau Ar-Rahmaniah. Jalan Kuala Selangor-Teluk Intan. Parit Enam. 45200 Sobak Bernam. Selangor. Malaysia,1 ,0,0,0,0,0,1,2022-04-27T02:32:55.7652583Z,0
3.7384298,100.989304,Daerah: Sabak Bernam<br>No:100<br>Hex coord:(13;8),Sabak Bernam. 45200 Sabak Bernam. Selangor. Malaysia,0,0,0,0,0,0,1,2022-04-27T02:32:57.5026081Z,0
3.7462098,101.002794,Daerah: Sabak Bernam<br>No:101<br>Hex coord:(14;8),Ladang Torkington. Sobak Bernam. Sabak Bernam. Malaysia,0,0,0,0,0,0,1,2022-04-27T02:32:59.2604438Z,0
3.7384298,101.016284,Daerah: Sabak Bernam<br>No:102<br>Hex coord:(15;8),Parit Enam. Selangor. Malaysia,0,0,0,0,0,0,1,2022-04-27T02:33:01.1241290Z,0
3.7462098,101.029774,Daerah: Sabak Bernam<br>No:103<br>Hex coord:(16;8),Teluk Sepintas. Selangor. Malaysia,0,0,0,0,0,0,1,2022-04-27T02:33:02.8430041Z,0
3.7384298,101.043264,Daerah: Sabak Bernam<br>No:104<br>Hex coord:(17;8),Parit Sebelas Barat. Sobak Bernam. Sabak Bernam. Malaysia,1 ,0,0,0,0,0,1,2022-04-27T02:33:03.9752171Z,0
3.7462098,101.056754,Daerah: Sabak Bernam<br>No:105<br>Hex coord:(18;8),Teluk Sepintas. Selangor. Malaysia,4 ,0,0,0,0,0,1,2022-04-27T02:33:05.1110399Z,0
3.7384298,101.070244,Daerah: Sabak Bernam<br>No:106<br>Hex coord:(19;8),Jalan Tok Khalifah. Kampung Permatang. Selangor. Malaysia,1 ,0,0,0,0,0,1,2022-04-27T02:33:06.8321436Z,0
3.7384298,101.097224,Daerah: Sabak Bernam<br>No:107<br>Hex coord:(21;8),Sungai Panjang. Sobak Bernam. Sabak Bernam. Malaysia,0,0,0,0,0,0,1,2022-04-27T02:33:07.9609721Z,0
3.7462098,101.110714,Daerah: Sabak Bernam<br>No:108<br>Hex coord:(22;8),Sungai Bugis. Hilir Perak. Malaysia,0,0,0,0,0,0,1,2022-04-27T02:33:09.2071866Z,0
3.7384298,101.124204,Daerah: Sabak Bernam<br>No:109<br>Hex coord:(23;8),Kampung Binjai Patah. Selangor. Malaysia,0,0,0,0,0,0,1,2022-04-27T02:33:10.9629623Z,0
3.7462098,101.137694,Daerah: Sabak Bernam<br>No:110<br>Hex coord:(24;8),Sungai Samak. Sabak Bernam. Malaysia,0,0,0,0,0,0,1,2022-04-27T02:33:12.7272563Z,0
3.7462098,101.164674,Daerah: Sabak Bernam<br>No:111<br>Hex coord:(26;8),Hospital Ulu Sungai Bernam. Hilir Perak. Malaysia,0,0,0,0,0,0,1,2022-04-27T02:33:13.8584137Z,0
3.7306498,100.921854,Daerah: Sabak Bernam<br>No:112<br>Hex coord:(8;9),SJK(C) Phooi Tee. Bagan Sungai Pulai. Jalan Haji Muhammad. Panchang Bedena. 45200. Selangor. Malaysia,2 ,0,0,0,0,0,1,2022-04-27T02:33:14.9939215Z,0
3.7228698,100.935344,Daerah: Sabak Bernam<br>No:113<br>Hex coord:(9;9),Parit Pulai. Sobak Bernam. Sabak Bernam. Malaysia,1 ,0,0,0,0,0,1,2022-04-27T02:33:16.8991020Z,0
3.7306498,100.948834,Daerah: Sabak Bernam<br>No:114<br>Hex coord:(10;9),Bagan Sungai Pulai. 45200. Selangor. Malaysia,0,0,0,0,0,0,1,2022-04-27T02:33:18.0386137Z,0
3.7228698,100.962324,Daerah: Sabak Bernam<br>No:115<br>Hex coord:(11;9),Jalan Jentera. Panchang Bedena. 45200. Selangor. Malaysia,2 ,0,0,0,0,0,1,2022-04-27T02:33:19.1673421Z,0
3.7306498,100.975814,Daerah: Sabak Bernam<br>No:116<br>Hex coord:(12;9),Jalan Kuala Selangor-Teluk Intan. Panchang Bedena. 45200. Selangor. Malaysia,0,0,0,0,0,0,1,2022-04-27T02:33:20.9286053Z,0
3.7228698,100.989304,Daerah: Sabak Bernam<br>No:117<br>Hex coord:(13;9),Parit Enam. 45200. Selangor. Malaysia,0,0,0,0,0,0,1,2022-04-27T02:33:22.0583653Z,0
3.7306498,101.002794,Daerah: Sabak Bernam<br>No:118<br>Hex coord:(14;9),Ladang Lim Kooi Hua Sungai Bernam. Sabak Bernam. Malaysia,0,0,0,0,0,0,1,2022-04-27T02:33:23.1817457Z,0
3.7228698,101.016284,Daerah: Sabak Bernam<br>No:119<br>Hex coord:(15;9),Parit Enam. Selangor. Malaysia,0,0,0,0,0,0,1,2022-04-27T02:33:24.9314602Z,0
3.7306498,101.029774,Daerah: Sabak Bernam<br>No:120<br>Hex coord:(16;9),B51. Selangor. Malaysia,0,0,0,0,0,0,1,2022-04-27T02:33:26.6605962Z,0
3.7228698,101.043264,Daerah: Sabak Bernam<br>No:121<br>Hex coord:(17;9),Kampung Permatang. Selangor. Malaysia,1 ,0,0,0,0,0,1,2022-04-27T02:33:27.7979310Z,0
3.7306498,101.056754,Daerah: Sabak Bernam<br>No:122<br>Hex coord:(18;9),Kampung Permatang. Selangor. Malaysia,1 ,0,0,0,0,0,1,2022-04-27T02:33:28.9243549Z,0
3.7228698,101.070244,Daerah: Sabak Bernam<br>No:123<br>Hex coord:(19;9),Kampung Permatang. Selangor. Malaysia,5 ,0,0,0,0,0,1,2022-04-27T02:33:30.6755778Z,0
3.7306498,101.083734,Daerah: Sabak Bernam<br>No:124<br>Hex coord:(20;9),B44. Sungai Besar. Selangor. Malaysia,6 ,0,0,0,0,0,1,2022-04-27T02:33:31.7949259Z,0
3.7228698,101.097224,Daerah: Sabak Bernam<br>No:125<br>Hex coord:(21;9),Kampung Binjai Patah. Selangor. Malaysia,0,0,0,0,0,0,1,2022-04-27T02:33:33.5328036Z,0
3.7306498,101.110714,Daerah: Sabak Bernam<br>No:126<br>Hex coord:(22;9),Kampung Binjai Patah. Selangor. Malaysia,0,0,0,0,0,0,1,2022-04-27T02:33:35.2728536Z,0
3.7228698,101.124204,Daerah: Sabak Bernam<br>No:127<br>Hex coord:(23;9),Kampung Binjai Patah. Selangor. Malaysia,3 ,0,0,0,0,0,1,2022-04-27T02:33:37.0084307Z,0
3.7306498,101.137694,Daerah: Sabak Bernam<br>No:128<br>Hex coord:(24;9),Sungai Telok. Hulu Bemam. Sabak Bernam. Malaysia,0,0,0,0,0,0,1,2022-04-27T02:33:38.7647396Z,0
3.7228698,101.151184,Daerah: Sabak Bernam<br>No:129<br>Hex coord:(25;9),Kemajuan Tanah Belia Merbau Berdarah. Sabak Bernam. Malaysia,0,0,0,0,0,0,1,2022-04-27T02:33:39.8908491Z,0
3.7306498,101.164674,Daerah: Sabak Bernam<br>No:130<br>Hex coord:(26;9),Rantau Panjang. Hilir Perak. Malaysia,0,0,0,0,0,0,1,2022-04-27T02:33:41.0289973Z,0
3.7228698,101.178164,Daerah: Sabak Bernam<br>No:131<br>Hex coord:(27;9),Ulu Bernam Bahagian Selangor. Sabak Bernam. Malaysia,0,0,0,0,0,0,1,2022-04-27T02:33:42.1670200Z,0
3.7150898,100.921854,Daerah: Sabak Bernam<br>No:132<br>Hex coord:(8;10),Bagan Sungai Pulai. Selangor. Malaysia,0,0,0,0,0,0,1,2022-04-27T02:33:43.8995260Z,0
3.7073098,100.935344,Daerah: Sabak Bernam<br>No:133<br>Hex coord:(9;10),Sabak Bernam. Bagan Sungai Burung. Selangor. Malaysia,0,0,0,0,0,0,1,2022-04-27T02:33:45.0175308Z,0
3.7150898,100.948834,Daerah: Sabak Bernam<br>No:134<br>Hex coord:(10;10),Panchang Bedena. 45300. Selangor. Malaysia,2 ,0,0,0,0,0,1,2022-04-27T02:33:46.1539846Z,0
3.7073098,100.962324,Daerah: Sabak Bernam<br>No:135<br>Hex coord:(11;10),Jalan Surau Suluk. Sungai Besar. Selangor. Malaysia,1 ,0,0,0,0,0,1,2022-04-27T02:33:47.2949871Z,0
3.7150898,100.975814,Daerah: Sabak Bernam<br>No:136<br>Hex coord:(12;10),Ladang Lingam. Sobak Bernam. Sabak Bernam. Malaysia,1 ,0,0,0,0,0,1,2022-04-27T02:33:48.4280191Z,0
3.7073098,100.989304,Daerah: Sabak Bernam<br>No:137<br>Hex coord:(13;10),Parit Enam. 45300. Selangor. Malaysia,4 ,0,0,0,0,0,1,2022-04-27T02:33:50.1744053Z,0
3.7150898,101.002794,Daerah: Sabak Bernam<br>No:138<br>Hex coord:(14;10),Sekolah Kebangsaan Parit Enam. Sungai Besar. Sabak Bernam. Malaysia,4 ,0,0,0,0,0,1,2022-04-27T02:33:51.2945683Z,0
3.7073098,101.016284,Daerah: Sabak Bernam<br>No:139<br>Hex coord:(15;10),Parit Enam. 45300. Selangor. Malaysia,1 ,0,0,0,0,0,1,2022-04-27T02:33:53.0486600Z,0
3.7150898,101.029774,Daerah: Sabak Bernam<br>No:140<br>Hex coord:(16;10),Kampung Permatang. Selangor. Malaysia,0,0,0,0,0,0,1,2022-04-27T02:33:54.8165451Z,0
3.7073098,101.043264,Daerah: Sabak Bernam<br>No:141<br>Hex coord:(17;10),Kampung Permatang. Selangor. Malaysia,0,0,0,0,0,0,1,2022-04-27T02:33:56.1579638Z,0
3.7150898,101.056754,Daerah: Sabak Bernam<br>No:142<br>Hex coord:(18;10),Jalan Sabak Bernam - Hulu Selangor. Kampung Permatang. Selangor. Malaysia,0,0,0,0,0,0,1,2022-04-27T02:33:57.8996838Z,0
3.7073098,101.070244,Daerah: Sabak Bernam<br>No:143<br>Hex coord:(19;10),Kampung Permatang. Selangor. Malaysia,1 ,0,0,0,0,0,1,2022-04-27T02:33:59.6588661Z,0
3.7150898,101.083734,Daerah: Sabak Bernam<br>No:144<br>Hex coord:(20;10),Parit Tiga Belas. Sabak Bernam. Malaysia,0,0,0,0,0,0,1,2022-04-27T02:34:01.5340959Z,0
3.7073098,101.097224,Daerah: Sabak Bernam<br>No:145<br>Hex coord:(21;10),Kampung Binjai Patah. Selangor. Malaysia,0,0,0,0,0,0,1,2022-04-27T02:34:03.2737027Z,0
3.7150898,101.110714,Daerah: Sabak Bernam<br>No:146<br>Hex coord:(22;10),Kampung Binjai Patah. Selangor. Malaysia,0,0,0,0,0,0,1,2022-04-27T02:34:05.0308067Z,0
3.7073098,101.124204,Daerah: Sabak Bernam<br>No:147<br>Hex coord:(23;10),Kampung Belia Satu. Selangor. Malaysia,2 ,0,0,0,0,0,1,2022-04-27T02:34:06.1642172Z,0
3.7150898,101.137694,Daerah: Sabak Bernam<br>No:148<br>Hex coord:(24;10),Kampung Belia Satu. Selangor. Malaysia,5 ,0,0,0,0,0,1,2022-04-27T02:34:07.4365409Z,0
3.7073098,101.151184,Daerah: Sabak Bernam<br>No:149<br>Hex coord:(25;10),Rizab Melayu Sungai Panjang. Sabak Bernam. Malaysia,0,0,0,0,0,0,1,2022-04-27T02:34:09.3303294Z,0
3.7150898,101.164674,Daerah: Sabak Bernam<br>No:150<br>Hex coord:(26;10),Telok Mahang. Sabak Bernam. Malaysia,0,0,0,0,0,0,1,2022-04-27T02:34:11.0675421Z,0
3.7073098,101.178164,Daerah: Sabak Bernam<br>No:151<br>Hex coord:(27;10),Tanjung Merbau Berdarah. Sabak Bernam. Malaysia,0,0,0,0,0,0,1,2022-04-27T02:34:12.2088549Z,0
3.7150898,101.191654,Daerah: Sabak Bernam<br>No:152<br>Hex coord:(28;10),Kampung Belia Dua. Selangor. Malaysia,1 ,0,0,0,0,0,1,2022-04-27T02:34:13.9650448Z,0
3.7073098,101.205144,Daerah: Sabak Bernam<br>No:153<br>Hex coord:(29;10),Kampung Belia Dua. Selangor. Malaysia,0,0,0,0,0,0,1,2022-04-27T02:34:15.0898290Z,0
3.7073098,101.232124,Daerah: Sabak Bernam<br>No:154<br>Hex coord:(31;10),Sabak Bernam. Selangor. Malaysia,0,0,0,0,0,0,1,2022-04-27T02:34:17.0566608Z,0
3.7150898,101.245614,Daerah: Sabak Bernam<br>No:155<br>Hex coord:(32;10),Sabak Bernam. Selangor. Malaysia,0,0,0,0,0,0,1,2022-04-27T02:34:18.8077879Z,0
3.6917498,100.935344,Daerah: Sabak Bernam<br>No:156<br>Hex coord:(9;11),Panchang Bedena. Selangor. Malaysia,1 ,0,0,0,0,0,1,2022-04-27T02:34:20.6990391Z,0
3.6995298,100.948834,Daerah: Sabak Bernam<br>No:157<br>Hex coord:(10;11),Panchang Bedena. 45300. Selangor. Malaysia,6 ,0,0,0,0,0,1,2022-04-27T02:34:22.4665577Z,0
3.6917498,100.962324,Daerah: Sabak Bernam<br>No:158<br>Hex coord:(11;11),Jalan Haji Muhammad. Taman Cahaya. 45300. Selangor. Malaysia,6 ,0,0,0,0,0,1,2022-04-27T02:34:24.2153201Z,0
